title,description,source,source_url,published,hours_old,url,is_govt_source,sector,sentiment,sentiment_confidence,impact_score,valence,arousal,geopolitical_risk,affected_companies,second_order_beneficiaries,catalyst_type,price_direction,time_horizon,conviction,macro_sensitivity,one_line_insight,signal_reason,contrarian_flag,contrarian_reason,sentiment_num,weighted_risk_score,signal_decay,recency_weighted_impact,catalyst_weight,z_score,shock_status
White House says increased productivity means Fed can cut rates,White ​House economic adviser ​Kevin Hassett told CNBC on ‌Monday ⁠that he ⁠expects ​increased productivity in the ​U.S. economy will allow ​the ⁠Federal Reserve to ‌lower ​interest ​rates.,ET Markets,https://economictimes.indiatimes.com/markets/rssfeeds/1977021501.cms,2026-04-06 21:35:28 IST,2.1,https://economictimes.indiatimes.com/markets/us-stocks/news/white-house-says-increased-productivity-means-fed-can-cut-rates/articleshow/130065638.cms,False,Other,positive,0.85,8,0.7,0.6,False,"['Bank of America', 'JPMorgan Chase', 'Goldman Sachs', 'Wells Fargo']","['Homebuilders', 'Consumer Discretionary', 'Automotive', 'Real Estate']",policy_change,bullish,swing_2_5days,high,high,The potential for Fed rate cuts due to increased productivity could boost financial and consumer sectors.,"Lower interest rates typically stimulate borrowing and spending, benefiting various sectors.",False,,1,0.0,0.97,7.76,1.6,1.29,Shock
"New Jersey cannot regulate Kalshi's prediction market, US appeals court rules",A federal appeals court ruled on Monday that New Jersey gaming regulators cannot prevent Kalshi from ​allowing people in the state to use ​its prediction market to place financial bets on the outcome of sporting events.,ET Markets,https://economictimes.indiatimes.com/markets/rssfeeds/1977021501.cms,2026-04-06 21:44:00 IST,2.0,https://economictimes.indiatimes.com/markets/us-stocks/news/new-jersey-cannot-regulate-kalshis-prediction-market-us-appeals-court-rules/articleshow/130065838.cms,False,Fintech,positive,0.85,7,0.6,0.5,False,"['Kalshi', 'DraftKings', 'FanDuel', 'BetMGM']","['PayPal', 'Square', 'Coinbase', 'Robinhood']",regulatory,bullish,swing_2_5days,medium,medium,"The ruling enhances Kalshi's market position, potentially increasing user engagement and revenue.","The court's decision removes regulatory barriers, allowing Kalshi to expand its operations in New Jersey, which is a significant market for sports betting.",False,,1,0.0,0.972,6.8,1.1,0.1,Normal
Sebi considering large-scale training push for independent directors to boost corporate governance: Tuhin Kanta Pandey,"Sebi is planning a large-scale capacity-building initiative for independent directors to strengthen corporate governance, Chairman Tuhin Kanta Pandey said. The move signals a shift from rule-making to improving boardroom effectiveness, with focus on continuous learning, risk awareness, and better decision-making amid rising market complexity and investor participation.",ET Markets,https://economictimes.indiatimes.com/markets/rssfeeds/1977021501.cms,2026-04-06 22:12:44 IST,1.5,https://economictimes.indiatimes.com/markets/stocks/news/sebi-considering-large-scale-training-push-for-independent-directors-to-boost-corporate-governance-tuhin-kanta-pandey/articleshow/130066352.cms,False,Other,positive,0.8,7,0.6,0.5,False,"['Tata Consultancy Services', 'Infosys', 'HDFC Bank', 'Reliance Industries']","['Corporate Governance Advisory Firms', 'Training Institutions', 'Consulting Firms', 'Legal Advisory Services']",regulatory,bullish,positional_weeks,medium,medium,"Sebi's initiative to train independent directors could enhance corporate governance, positively impacting investor confidence and market stability.","Improved corporate governance may lead to better decision-making and risk management, attracting more investments and enhancing company valuations.",False,,1,0.0,0.994,6.96,1.1,0.1,Normal
₹758 cr NH-46 ‘Tiger Corridor’ project gets nod from Gadkari in MP,,ET Economy,https://economictimes.indiatimes.com/economy/rssfeeds/1373380680.cms,2026-04-06 19:14:18 IST,4.5,https://economictimes.indiatimes.com/news/economy/infrastructure/758-cr-nh-46-tiger-corridor-project-gets-nod-from-gadkari-in-mp/videoshow/130062913.cms,False,Other,positive,0.85,7,0.8,0.6,False,"['L&T', 'IRB Infrastructure', 'GMR Infrastructure', 'Sadbhav Engineering']","['Cement Companies', 'Steel Manufacturers', 'Construction Equipment Suppliers', 'Local Businesses']",government_contract,bullish,positional_weeks,medium,medium,The approval of the NH-46 'Tiger Corridor' project is likely to boost infrastructure-related stocks and local economies.,"Government contracts typically lead to increased revenue for construction and infrastructure companies, indicating a positive market sentiment.",False,,1,0.0,0.982,6.87,1.7,0.1,Normal
US Stocks: National Healthcare Properties moves closer to public markets with US IPO filing,"National Healthcare Properties ​made public its paperwork for ​a U.S. initial public offering on Monday, the latest ​real estate investment trust looking to tap public markets this year.",ET Markets,https://economictimes.indiatimes.com/markets/rssfeeds/1977021501.cms,2026-04-06 21:40:08 IST,2.0,https://economictimes.indiatimes.com/markets/us-stocks/news/us-stocks-national-healthcare-properties-moves-closer-to-public-markets-with-us-ipo-filing/articleshow/130065715.cms,False,Healthcare,positive,0.85,7,0.8,0.6,False,"['National Healthcare Properties', 'Healthpeak Properties', 'Welltower', 'Ventas']","['Realty Income Corporation', 'American Tower Corporation', 'Crown Castle', 'Digital Realty Trust']",other,bullish,swing_2_5days,medium,medium,"The IPO filing by National Healthcare Properties signals a positive trend for healthcare REITs, potentially attracting investor interest.","The move towards public markets indicates confidence in the healthcare sector's growth and stability, which could lead to increased investment in similar companies.",False,,1,0.0,0.972,6.8,0.7,0.1,Normal
"US Fed's Austan Goolsbee, Beth Hammack say inflation is flashing 'orange' or worse","Federal Reserve officials Beth Hammack and Austan Goolsbee expressed concern over persistent inflation, rating it orange to red. While Hammack sees the labor market as yellow to green, Goolsbee views it as yellow due to uncertainty. Both acknowledge the financial system is generally stable, though Goolsbee noted potential asset price frothiness.",ET Markets,https://economictimes.indiatimes.com/markets/rssfeeds/1977021501.cms,2026-04-06 22:57:55 IST,0.7,https://economictimes.indiatimes.com/markets/us-stocks/news/us-feds-austan-goolsbee-beth-hammack-say-inflation-is-flashing-orange-or-worse/articleshow/130067610.cms,False,Other,negative,0.75,7,0.2,0.6,False,"['Goldman Sachs', 'JP Morgan', 'Bank of America', 'Citigroup']","['Consumer Staples', 'Utilities', 'Healthcare', 'Real Estate']",policy_change,bearish,swing_2_5days,medium,high,Fed officials' concerns over inflation signal potential market volatility and caution among investors.,"The Fed's inflation warning may lead to tighter monetary policy, impacting market sentiment and asset prices.",False,,-1,49.0,0.99,6.93,1.6,0.1,Normal
NY Fed says March supply chain pressures highest since start of 2023,"In March, supply chain pressures surged to levels unseen since earlier this year, largely due to the ongoing conflict in the Middle East. This escalation could further drive up inflation, creating hurdles for the Federal Reserve's price stabilization efforts and influencing future interest rate considerations.",ET Markets,https://economictimes.indiatimes.com/markets/rssfeeds/1977021501.cms,2026-04-06 22:11:45 IST,1.5,https://economictimes.indiatimes.com/markets/us-stocks/news/update-1-ny-fed-says-march-supply-chain-pressures-highest-since-start-of-2023/articleshow/130066269.cms,False,Other,negative,0.85,7,0.2,0.6,True,"['FedEx', 'UPS', 'Amazon', 'Maersk']","['Logistics Providers', 'Raw Material Suppliers', 'Inflation-Linked Bonds', 'Commodity Traders']",global_event,bearish,swing_2_5days,medium,high,"Rising supply chain pressures could hinder economic recovery and impact inflation, affecting logistics and retail sectors.","The escalation in supply chain issues due to geopolitical tensions may lead to increased costs and inflationary pressures, influencing market sentiment negatively.",False,,-1,73.5,0.979,6.85,0.9,0.1,Normal
RBI keeps investment limit for FPIs in G-secs unchanged for FY27,The Reserve Bank of India has confirmed that foreign investors can continue to invest up to six percent in government securities. This limit applies to the general route for the fiscal year 2026-27. State government securities and corporate bonds also have their investment limits unchanged. An additional limit of over Rs 3.30 lakh crore is set for 2026-27.,ET Economy,https://economictimes.indiatimes.com/economy/rssfeeds/1373380680.cms,2026-04-06 19:45:56 IST,3.9,https://economictimes.indiatimes.com/news/economy/policy/rbi-keeps-investment-limit-for-fpis-in-g-secs-unchanged-for-fy27/articleshow/130063526.cms,False,Banking,neutral,0.7,6,0.5,0.3,False,"['HDFC Bank', 'ICICI Bank', 'Axis Bank', 'State Bank of India']","['Mutual Funds', 'Insurance Companies', 'Pension Funds', 'Foreign Institutional Investors']",policy_change,neutral,swing_2_5days,medium,medium,The RBI's unchanged investment limits for FPIs in G-secs may stabilize foreign investment flows but lacks immediate bullish sentiment.,"The decision maintains the status quo for foreign investments, which could lead to stability in the bond market but does not indicate growth potential.",False,,0,0.0,0.945,5.67,1.6,-1.1,Normal
Wells Fargo Investment Institute downgrades energy sector to 'unfavorable' on limited war premium,"Wells Fargo Investment Institute downgraded its rating on ​the S&amp;P 500 ​energy sector to ""unfavorable"", citing what it ​said were limited prospects for a sustained oil-price risk premium despite the ongoing conflict in the Middle East.",ET Markets,https://economictimes.indiatimes.com/markets/rssfeeds/1977021501.cms,2026-04-06 21:30:57 IST,2.2,https://economictimes.indiatimes.com/markets/us-stocks/news/wells-fargo-investment-institute-downgrades-energy-sector-to-unfavorable-on-limited-war-premium/articleshow/130065593.cms,False,Energy,negative,0.85,7,0.2,0.3,True,"['ExxonMobil', 'Chevron', 'ConocoPhillips', 'BP']","['Renewable Energy Companies', 'Energy Storage Firms', 'Natural Gas Suppliers', 'Electric Vehicle Manufacturers']",policy_change,bearish,swing_2_5days,medium,high,Wells Fargo's downgrade signals potential short-term weakness in the energy sector amid geopolitical tensions.,"The downgrade reflects concerns over limited oil-price risk premium, suggesting a bearish outlook for energy stocks.",False,,-1,100.0,0.969,6.78,1.6,0.1,Normal
Govt extends implementation timeline for quality control order on electrical appliances till October,"The government has announced a new timeline for the rollout of a mandatory quality control directive regarding certain electrical appliances, now set to commence in October 2026. This directive affects a variety of common household gadgets.",ET Economy,https://economictimes.indiatimes.com/economy/rssfeeds/1373380680.cms,2026-04-06 20:20:54 IST,3.4,https://economictimes.indiatimes.com/news/economy/policy/govt-extends-implementation-timeline-for-quality-control-order-on-electrical-appliances-till-october/articleshow/130064237.cms,False,Manufacturing,neutral,0.7,5,0.5,0.3,False,"['Whirlpool', 'Philips', 'Samsung', 'LG Electronics']","['Raw Material Suppliers', 'Logistics Companies', 'Retailers', 'Quality Assurance Firms']",policy_change,neutral,positional_weeks,medium,medium,"The extension of the quality control order provides manufacturers additional time to comply, potentially easing short-term operational pressures.","Manufacturers may benefit from the delay, allowing for better preparation and compliance with the new regulations.",False,,0,0.0,0.986,4.93,1.6,-2.29,Normal
West Asia conflict threatens global energy arteries; prudent economic handling over a decade allows India to keep space for capex: FM,India's finance minister highlights the nation's strong economic footing. Prudent fiscal management over a decade has built resilience. This allows for continued capital spending and support for sectors facing global challenges. India's debt-to-GDP ratio remains low compared to major economies. This strategic fiscal discipline provides a significant advantage in navigating a volatile world.,ET Economy,https://economictimes.indiatimes.com/economy/rssfeeds/1373380680.cms,2026-04-06 19:11:49 IST,4.5,https://economictimes.indiatimes.com/news/economy/policy/west-asia-conflict-threatens-global-energy-arteries-prudent-economic-handling-over-a-decade-allows-india-to-keep-space-for-capex-fm/articleshow/130062795.cms,False,Energy,positive,0.85,7,0.8,0.6,True,"['Reliance Industries', 'ONGC', 'Indian Oil', 'Bharat Petroleum']","['L&T', 'Siemens', 'Tata Power', 'Adani Green']",capex_announcement,bullish,positional_weeks,high,medium,India's prudent fiscal management positions it well to capitalize on global energy challenges.,The finance minister's emphasis on India's economic resilience and continued capital spending amidst global tensions suggests a bullish outlook for energy-related investments.,False,,1,0.0,0.982,6.87,1.4,0.1,Normal
Ashwini Vaishnaw unveils Railways FY26 wrap: 119 Amrit Bharat stations &amp; all-weather Kashmir link,,ET Economy,https://economictimes.indiatimes.com/economy/rssfeeds/1373380680.cms,2026-04-06 16:51:16 IST,6.9,https://economictimes.indiatimes.com/news/economy/infrastructure/ashwini-vaishnaw-unveils-railways-fy26-wrap-119-amrit-bharat-stations-all-weather-kashmir-link/videoshow/130059408.cms,False,Other,positive,0.85,7,0.8,0.6,False,"['IRCON International', 'Indian Railways', 'Larsen & Toubro', 'Siemens']","['Construction Firms', 'Steel Manufacturers', 'Cement Producers', 'Logistics Companies']",capex_announcement,bullish,positional_weeks,medium,medium,"The unveiling of new railway stations and infrastructure projects signals growth in the transportation sector, benefiting related companies.","Government investment in railway infrastructure typically leads to increased demand for construction and materials, positively impacting associated firms.",False,,1,0.0,0.972,6.8,1.4,0.1,Normal
RBI MPC 2026: Rate-setting panel starts deliberations amid West Asia crisis; decision on Wednesday,The Reserve Bank's monetary policy committee has begun its review. Expectations are for no change in interest rates. This is due to worries about rising inflation. Geopolitical tensions and crude oil prices are key concerns. The rupee's depreciation also impacts import costs. The central bank aims to keep inflation at 4 percent.,ET Economy,https://economictimes.indiatimes.com/economy/rssfeeds/1373380680.cms,2026-04-06 16:08:01 IST,7.6,https://economictimes.indiatimes.com/news/economy/policy/rbi-mpc-2026-rate-setting-panel-starts-deliberations-amid-west-asia-crisis-decision-on-wednesday/articleshow/130058074.cms,False,Banking,neutral,0.7,6,0.5,0.4,True,"['State Bank of India', 'HDFC Bank', 'ICICI Bank', 'Axis Bank']","['Oil India', 'Reliance Industries', 'Bharat Petroleum', 'ONGC']",rbi_action,neutral,swing_2_5days,medium,high,"The RBI's deliberations amid geopolitical tensions may lead to cautious market sentiment, particularly in banking stocks.","The focus on inflation and geopolitical risks suggests a stable interest rate environment, which could impact banking sector performance.",False,,0,0.0,0.896,5.38,1.5,-1.1,Normal
Wipro steps up dealmaking with Olam: Here are its other acquisitions,"The dealmaking is aimed at bolstering its capabilities in engineering, consulting, and AI-led services amid a muted demand environment.",ET Startups,https://economictimes.indiatimes.com/small-biz/startups/rssfeeds/13357270.cms,2026-04-06 22:14:43 IST,1.5,https://economictimes.indiatimes.com/tech/information-tech/wipro-steps-up-dealmaking-with-olam-here-are-its-other-acquisitions/articleshow/130066398.cms,False,IT,positive,0.75,7,0.6,0.5,False,"['Wipro', 'Olam', 'TCS', 'Infosys']","['Accenture', 'Cognizant', 'HCL Technologies', 'Tech Mahindra']",other,bullish,swing_2_5days,medium,medium,Wipro's strategic acquisitions signal a proactive approach to enhancing service capabilities despite market challenges.,"The focus on engineering, consulting, and AI-led services indicates a forward-looking strategy that could position Wipro favorably in a competitive landscape.",False,,1,0.0,0.979,6.85,0.7,0.1,Normal
Amazon India to shut down Fresh in top cities amid quick commerce push: UBS report,"Amazon’s move comes at a time when ecommerce majors are expanding their quick commerce services to meet the growing demand. Amazon Now is currently operational in six cities, including Delhi, Bengaluru, and Mumbai. This is expected to be expanded to 10-15 top cities.",ET Startups,https://economictimes.indiatimes.com/small-biz/startups/rssfeeds/13357270.cms,2026-04-06 22:01:02 IST,1.7,https://economictimes.indiatimes.com/tech/technology/amazon-india-to-shut-down-fresh-in-top-cities-amid-quick-commerce-push-ubs-report/articleshow/130066075.cms,False,Retail,negative,0.75,7,0.2,0.4,False,['Amazon'],"['Zomato', 'Swiggy', 'Dunzo', 'Flipkart']",sector_tailwind,bearish,swing_2_5days,medium,medium,"Amazon's shutdown of Fresh in major cities indicates a strategic shift towards quick commerce, potentially impacting its market position.","The decision to close Fresh suggests challenges in the grocery segment, while the focus on quick commerce may not fully compensate for lost revenue.",False,,-1,56.0,0.976,6.83,1.2,0.1,Normal
"Sebi, RBI explore steps to shield companies from market volatility",Market regulator Sebi is discussing measures with industry bodies to navigate financial volatility. The Reserve Bank of India is also preparing steps to counter the West Asia conflict's impact. Proposals include extensions for companies to meet shareholding norms and support for MSMEs and exporters. These actions aim to stabilize markets and bolster the rupee.,ET Economy,https://economictimes.indiatimes.com/economy/rssfeeds/1373380680.cms,2026-04-06 18:02:16 IST,5.7,https://economictimes.indiatimes.com/news/economy/policy/sebi-and-rbi-take-action-to-protect-companies-amid-market-turmoil-from-west-asia-conflict/articleshow/130061056.cms,False,Fintech,positive,0.85,8,0.7,0.6,True,"['HDFC Bank', 'ICICI Bank', 'Axis Bank', 'State Bank of India']","['Tata Consultancy Services', 'Infosys', 'Wipro', 'Tech Mahindra']",policy_change,bullish,swing_2_5days,medium,high,Regulatory measures by Sebi and RBI to stabilize markets could enhance investor confidence and support financial institutions.,"The proactive steps by regulators to mitigate market volatility indicate a supportive environment for financial stability, which is likely to benefit banks and fintech companies.",False,,1,0.0,0.921,7.37,1.6,1.29,Shock
Delhi HC orders restoration of blocked X accounts,"Justice Purushaindra Kumar Kaurav ruled for full account restoration, but said specific tweets flagged in the blocking orders must remain temporarily blocked pending review by a committee of the Ministry of Electronics and Information Technology (MeitY).",ET Startups,https://economictimes.indiatimes.com/small-biz/startups/rssfeeds/13357270.cms,2026-04-06 21:51:04 IST,1.9,https://economictimes.indiatimes.com/tech/technology/delhi-hc-orders-restoration-of-blocked-x-accounts/articleshow/130065931.cms,False,IT,positive,0.75,7,0.6,0.5,False,"['Twitter', 'Meta', 'Google', 'Microsoft']","['Telecom Providers', 'Digital Marketing Firms', 'Content Creators', 'Social Media Analytics Companies']",regulatory,bullish,swing_2_5days,medium,medium,"The Delhi HC ruling may boost user engagement on social media platforms, positively impacting ad revenues.",Restoration of accounts could lead to increased activity and monetization opportunities for affected companies.,False,,1,0.0,0.973,6.81,1.1,0.1,Normal
Bluesky down for thousands of users in the US,"The status page of the decentralised social media platform, where users can share short posts with text, images, and videos, said all systems were operational, and reports of outages had declined by 10.30 am ET.",ET Startups,https://economictimes.indiatimes.com/small-biz/startups/rssfeeds/13357270.cms,2026-04-06 21:43:03 IST,2.0,https://economictimes.indiatimes.com/tech/technology/bluesky-down-for-thousands-of-users-in-the-us/articleshow/130065809.cms,False,IT,negative,0.75,6,0.2,0.4,False,['Bluesky'],"['Twitter', 'Mastodon', 'Facebook', 'Snap']",global_event,bearish,swing_2_5days,medium,medium,"Bluesky's outage may lead to user migration to competing platforms, impacting its growth.","The reported outage could diminish user trust and engagement, potentially affecting future user acquisition.",False,,-1,72.0,0.972,5.83,0.9,-1.1,Normal
"Samsung is discontinuing its texting app, tells impacted users to switch to Google Messages",Samsung is phasing out its own messaging app.  Users of Samsung phones in the US will need to switch to Google Messages by July. This change aims to provide a consistent Android experience.  Google Messages offers advanced features like AI-powered suggestions and better photo sharing.  Older Android versions will not be affected.  Samsung has not confirmed if this applies globally.,ET Startups,https://economictimes.indiatimes.com/small-biz/startups/rssfeeds/13357270.cms,2026-04-06 20:44:40 IST,3.0,https://economictimes.indiatimes.com/tech/technology/samsung-is-discontinuing-its-texting-app-tells-impacted-users-to-switch-to-google-messages/articleshow/130064745.cms,False,IT,neutral,0.7,5,0.5,0.3,False,"['Samsung', 'Google']","['Apple', 'Microsoft', 'Huawei', 'Xiaomi']",other,neutral,swing_2_5days,medium,medium,Samsung's discontinuation of its messaging app may strengthen Google's position in the messaging space.,"The shift to Google Messages could enhance user experience and loyalty towards Google services, potentially impacting market dynamics.",False,,0,0.0,0.958,4.79,0.7,-2.29,Normal
"Pine Labs’ Navin Chandani steps down as president, CBO of issuing business","The resignation is effective April 6, 2026, and no successor has yet been named. In his resignation letter, Chandani said he is leaving to ‘pursue career opportunities outside the company.' The company has, however, not yet named a successor.",ET Startups,https://economictimes.indiatimes.com/small-biz/startups/rssfeeds/13357270.cms,2026-04-06 22:37:17 IST,1.1,https://economictimes.indiatimes.com/tech/technology/pine-labs-navin-chandani-steps-down-as-president-cbo-of-issuing-business/articleshow/130067020.cms,False,Fintech,negative,0.75,6,0.2,0.4,False,['Pine Labs'],"['Paytm', 'Razorpay', 'PhonePe', 'MobiKwik']",management_change,bearish,swing_2_5days,medium,medium,"Navin Chandani's resignation raises concerns about leadership stability at Pine Labs, potentially impacting investor confidence.",The lack of a successor and the timing of the resignation could lead to uncertainty in the company's strategic direction.,False,,-1,72.0,0.984,5.9,1.0,-1.1,Normal
Everstone leads $150 million infusion in SaaS firm Wingify,"Software firm Wingify secured Rs 1,381 crore in a new funding round led by Everstone Capital. This investment follows Wingify's recent announcement of a merger with AB Tasty. The combined entity aims to become a major global platform for digital experience optimization. Existing shareholders also participated in the funding round.",ET Startups,https://economictimes.indiatimes.com/small-biz/startups/rssfeeds/13357270.cms,2026-04-06 19:49:05 IST,3.9,https://economictimes.indiatimes.com/tech/startups/everstone-leads-150-million-infusion-in-saas-firm-wingify/articleshow/130063558.cms,False,IT,positive,0.85,7,0.8,0.6,False,"['Wingify', 'AB Tasty', 'Everstone Capital']","['Adobe', 'Salesforce', 'Shopify', 'HubSpot']",other,bullish,swing_2_5days,medium,medium,"The merger and funding position Wingify as a strong player in the digital optimization space, attracting investor interest.",The significant funding and merger indicate strong growth potential and market confidence in digital experience optimization.,False,,1,0.0,0.945,6.61,0.7,0.1,Normal
"Vedanta, HZL, others likely to participate in pre-bid meet for Rs 7,280-crore rare earth magnet scheme","Several major companies are set to participate in a crucial pre-bid conference. This event is for a significant Rs 7,280-crore government scheme. The initiative aims to boost the manufacturing of rare earth permanent magnets. Bids for setting up these manufacturing facilities are being invited.",ET Industry,https://economictimes.indiatimes.com/industry/rssfeeds/13352306.cms,2026-04-06 22:19:16 IST,1.4,https://economictimes.indiatimes.com/industry/indl-goods/svs/metals-mining/vedanta-hzl-others-likely-to-participate-in-pre-bid-meet-for-rs-7280-crore-rare-earth-magnet-scheme/articleshow/130066421.cms,False,Manufacturing,positive,0.85,8,0.7,0.6,False,"['Vedanta', 'HZL', 'Tata Steel', 'Larsen & Toubro']","['Bharat Electronics', 'Siemens', 'ABB', 'GE']",government_contract,bullish,positional_weeks,high,medium,"The government's Rs 7,280-crore scheme for rare earth magnets presents a significant growth opportunity for participating manufacturers.","The pre-bid meet indicates strong government support and investment in the manufacturing sector, particularly in rare earth materials, which are crucial for various high-tech applications.",False,,1,0.0,0.994,7.95,1.7,1.29,Shock
