title,description,source,source_url,published,hours_old,url,is_govt_source,sector,sentiment,sentiment_confidence,impact_score,valence,arousal,geopolitical_risk,affected_companies,second_order_beneficiaries,catalyst_type,price_direction,time_horizon,conviction,macro_sensitivity,one_line_insight,signal_reason,contrarian_flag,contrarian_reason,sentiment_num,weighted_risk_score,signal_decay,recency_weighted_impact,catalyst_weight,z_score,shock_status
"US stocks: Super Micro shares plunge 27% as co-founder, 2 others charged with smuggling AI chips to China","Super Micro shares sank 27% ​on Friday after U.S. prosecutors ​charged three people linked with the company, including its co-founder, ​with helping smuggle billions of dollars worth of AI technology to China.",ET Markets,https://economictimes.indiatimes.com/markets/rssfeeds/1977021501.cms,2026-03-20 19:56:00 IST,6.7,https://economictimes.indiatimes.com/markets/us-stocks/news/us-stocks-super-micro-shares-plunge-27-as-co-founder-2-others-charged-with-smuggling-ai-chips-to-china/articleshow/129703090.cms,False,IT,negative,0.85,8,0.1,0.9,True,['Super Micro'],"['NVIDIA', 'AMD', 'Intel', 'Qualcomm']",regulatory,bearish,swing_2_5days,high,high,Super Micro's significant share drop indicates heightened regulatory scrutiny and geopolitical tensions affecting the tech sector.,The charges against Super Micro's co-founder suggest serious legal implications that could hinder the company's operations and investor confidence.,False,,-1,100.0,0.908,7.26,1.1,1.34,Shock
Zetwerk plans to confidentially file for IPO in 2 weeks: Sources,"India's Zetwerk plans to confidentially file ‌draft ⁠papers for ⁠an initial public offering within ​the next one to two weeks, ​aiming to raise up to $550 million at a valuation of ​about $4 billion, ⁠two people ‌with direct knowledge said.",ET Markets,https://economictimes.indiatimes.com/markets/rssfeeds/1977021501.cms,2026-03-20 19:39:41 IST,7.0,https://economictimes.indiatimes.com/markets/ipos/fpos/zetwerk-plans-to-confidentially-file-for-ipo-in-2-weeks-sources/articleshow/129702791.cms,False,Startup,positive,0.85,8,0.7,0.6,False,['Zetwerk'],"['Investors', 'Underwriters', 'Market Analysts', 'Tech Startups']",other,bullish,swing_2_5days,high,medium,Zetwerk's IPO filing indicates strong market confidence and potential growth in the startup ecosystem.,"The planned IPO reflects a positive outlook for Zetwerk and the broader startup sector, suggesting investor interest and market readiness.",False,,1,0.0,0.904,7.23,0.7,1.34,Shock
"Goldman Sachs, ICICI Pru MF buy DLF shares worth Rs 231 crore via block deals","Goldman Sachs and ICICI Prudential Mutual Fund acquired significant stakes in DLF Limited via block deals worth Rs 231 crore, even as the stock lags benchmarks and trades below key moving averages.",ET Markets,https://economictimes.indiatimes.com/markets/rssfeeds/1977021501.cms,2026-03-20 22:04:08 IST,4.6,https://economictimes.indiatimes.com/markets/stocks/news/goldman-sachs-icici-pru-mf-buy-dlf-shares-worth-rs-231-crore-via-block-deals/articleshow/129705162.cms,False,Other,positive,0.75,7,0.6,0.5,False,['DLF Limited'],"['HDFC', 'Godrej Properties', 'Oberoi Realty', 'Brigade Enterprises']",other,bullish,swing_2_5days,medium,medium,Institutional buying in DLF suggests potential upside despite current underperformance.,"The acquisition by major institutional players indicates confidence in DLF's future performance, which could lead to a price rebound.",True,"Despite current underperformance, institutional investment often signals a turnaround opportunity.",1,0.0,0.936,6.55,0.7,-0.02,Normal
RBI to conduct Rs 1 lakh cr overnight variable rate repo auction on Mar 23,The Reserve Bank of India on Friday said it will conduct an overnight variable rate repo (VRR) auction of Rs 1 lakh crore on March 23.,ET Markets,https://economictimes.indiatimes.com/markets/rssfeeds/1977021501.cms,2026-03-20 20:27:05 IST,6.2,https://economictimes.indiatimes.com/markets/forex/forex-news/rbi-to-conduct-rs-1-lakh-cr-overnight-variable-rate-repo-auction-on-mar-23/articleshow/129703587.cms,False,Banking,neutral,0.7,6,0.5,0.4,False,"['State Bank of India', 'HDFC Bank', 'ICICI Bank', 'Axis Bank']","['NBFCs', 'Mutual Funds', 'Insurance Companies', 'Corporate Borrowers']",rbi_action,neutral,swing_2_5days,medium,high,"The RBI's repo auction indicates liquidity management, which may stabilize short-term interest rates.","The auction aims to manage liquidity in the banking system, which can influence borrowing costs and market sentiment.",False,,0,0.0,0.914,5.48,1.5,-1.38,Normal
Aelea Commodities bulk deal: Ashish Kacholia bets Rs 9.3 crore on a microcap that is down 36% in a year,"Ashish Kacholia bought shares worth Rs 9.3 crore in Aelea Commodities via a bulk deal as the stock trades below key averages after a sharp correction, with the seller fully exiting its stake.",ET Markets,https://economictimes.indiatimes.com/markets/rssfeeds/1977021501.cms,2026-03-20 20:58:04 IST,5.7,https://economictimes.indiatimes.com/markets/stocks/news/aelea-commodities-bulk-deal-ashish-kacholia-bets-rs-9-3-crore-on-a-microcap-that-is-down-36-in-a-year/articleshow/129704093.cms,False,Other,positive,0.75,7,0.6,0.5,False,['Aelea Commodities'],[],other,bullish,swing_2_5days,medium,low,Ashish Kacholia's significant investment in Aelea Commodities suggests potential recovery after a steep decline.,The bulk purchase by a notable investor indicates confidence in the stock's future performance despite recent losses.,True,"Investing in a microcap that has recently declined may seem risky, but it could present a buying opportunity if the fundamentals are strong.",1,0.0,0.921,6.45,0.7,-0.02,Normal
"US stocks: FedEx shares jump 7% on resilient demand forecast amid geopolitical risks, surging fuel costs","FedEx shares surged about 7% in morning ​trading on Friday, after the ​package-delivery giant raised its full-year profit forecast and signaled steady shipping demand despite ​geopolitical tensions and surging fuel costs.",ET Markets,https://economictimes.indiatimes.com/markets/rssfeeds/1977021501.cms,2026-03-20 19:35:50 IST,7.0,https://economictimes.indiatimes.com/markets/us-stocks/news/us-stocks-fedex-shares-jump-7-on-resilient-demand-forecast-amid-geopolitical-risks-surging-fuel-costs/articleshow/129702695.cms,False,Retail,positive,0.85,8,0.7,0.6,True,"['FedEx', 'UPS', 'DHL', 'Amazon']","['Fuel suppliers', 'Logistics software companies', 'E-commerce platforms', 'Transportation equipment manufacturers']",earnings,bullish,swing_2_5days,high,medium,FedEx's strong demand forecast amidst geopolitical tensions and rising fuel costs indicates resilience in the logistics sector.,The increase in FedEx's profit forecast and positive shipping demand signals strong operational performance despite external pressures.,False,,1,0.0,0.904,7.23,1.3,1.34,Shock
"US stocks: Fed officials say Iran war obscuring economic, monetary policy outlook","Two Federal Reserve officials said on Friday the Iran war and its impact on energy markets were clouding the outlook for the economy and monetary policy, as one policymaker laid ‌out an outlook ⁠calling for notably ⁠more interest rate cuts than most U.S. central bank officials currently support.",ET Markets,https://economictimes.indiatimes.com/markets/rssfeeds/1977021501.cms,2026-03-20 20:31:00 IST,6.1,https://economictimes.indiatimes.com/markets/us-stocks/news/us-stocks-fed-officials-say-iran-war-obscuring-economic-monetary-policy-outlook/articleshow/129703612.cms,False,Other,negative,0.75,7,0.2,0.6,True,"['ExxonMobil', 'Chevron', 'Halliburton', 'BP']","['Renewable Energy Firms', 'Energy Storage Companies', 'Electric Vehicle Manufacturers', 'Utilities']",global_event,bearish,swing_2_5days,medium,high,"The ongoing Iran war is likely to lead to increased volatility in energy markets, impacting economic forecasts and monetary policy.","Federal Reserve officials are indicating that geopolitical tensions are complicating economic outlooks, which could lead to market instability.",False,,-1,73.5,0.916,6.41,0.9,-0.02,Normal
Oil jumps to highest settlement since July 2022 as more Mideast supply disrupted,Oil prices have surged to their highest in nearly four years. Iraq declared force majeure on oilfields. The U.S. is deploying more troops to the Middle East amid escalating Iran tensions. Attacks on energy infrastructure continue. The Strait of Hormuz remains disrupted. Analysts expect prices to stay elevated.  Restoration of oil flows could take months.,ET Markets,https://economictimes.indiatimes.com/markets/rssfeeds/1977021501.cms,2026-03-21 01:27:54 IST,1.2,https://economictimes.indiatimes.com/markets/commodities/news/oil-jumps-to-highest-settlement-since-july-2022-as-more-mideast-supply-disrupted/articleshow/129708593.cms,False,Energy,positive,0.85,8,0.7,0.6,True,"['ExxonMobil', 'Chevron', 'BP', 'Royal Dutch Shell']","['Halliburton', 'Schlumberger', 'Baker Hughes', 'Transocean']",global_event,bullish,positional_weeks,high,high,"Rising geopolitical tensions in the Middle East are likely to sustain elevated oil prices, benefiting major oil companies.","The disruption of oil supply due to geopolitical tensions and force majeure declarations is expected to keep oil prices high, positively impacting energy sector companies.",False,,1,0.0,0.995,7.96,0.9,1.34,Shock
First in Motilal Oswal AMC investing series: QGLP principles for disciplined investing,,ET Markets,https://economictimes.indiatimes.com/markets/rssfeeds/1977021501.cms,2026-03-20 21:00:17 IST,5.6,https://economictimes.indiatimes.com/markets/expert-view/first-in-motilal-oswal-amc-investing-series-qglp-principles-for-disciplined-investing/videoshow/129704137.cms,False,Fintech,positive,0.85,7,0.8,0.6,False,"['Motilal Oswal AMC', 'HDFC Asset Management', 'ICICI Prudential AMC', 'SBI Mutual Fund']","['Zerodha', 'Groww', 'Paytm Money', 'Upstox']",other,bullish,swing_2_5days,medium,medium,"Motilal Oswal AMC's new investing series could attract more retail investors, boosting asset management sector growth.",The introduction of disciplined investing principles may enhance investor confidence and participation in the market.,False,,1,0.0,0.922,6.45,0.7,-0.02,Normal
US Fed Governor Waller sounds alarm on inflation risk due to Iran war,US Federal Reserve Governor Christopher Waller on Friday said he was concerned about the impact of the US-Israel war on Iran on inflation due to the prolonged closure of the Strait of Hormuz.,ET Markets,https://economictimes.indiatimes.com/markets/rssfeeds/1977021501.cms,2026-03-20 19:51:17 IST,6.8,https://economictimes.indiatimes.com/markets/us-stocks/news/us-fed-governor-waller-sounds-alarm-on-inflation-risk-due-to-iran-war/articleshow/129703035.cms,False,Other,negative,0.85,8,0.2,0.7,True,"['ExxonMobil', 'Chevron', 'Halliburton', 'BP']","['Lockheed Martin', 'Raytheon', 'Northrop Grumman', 'General Dynamics']",global_event,bearish,swing_2_5days,high,high,"The ongoing conflict in the Middle East poses significant inflation risks, particularly affecting energy prices.","The closure of the Strait of Hormuz could disrupt oil supply, leading to increased prices and inflationary pressures.",False,,-1,84.0,0.906,7.25,0.9,1.34,Shock
US stocks: Fed's Bowman says penciled in three rate cuts for year: Report,Federal Reserve Vice Chair ​for Supervision Michelle Bowman said on Friday she's notably more in the way of interest rate cuts relative ‌to her colleagues.,ET Markets,https://economictimes.indiatimes.com/markets/rssfeeds/1977021501.cms,2026-03-20 19:24:21 IST,7.2,https://economictimes.indiatimes.com/markets/us-stocks/news/us-stocks-feds-bowman-says-penciled-in-three-rate-cuts-for-year-report/articleshow/129702525.cms,False,Fintech,positive,0.85,8,0.7,0.6,False,"['Goldman Sachs', 'JPMorgan Chase', 'Morgan Stanley', 'Visa']","['PayPal', 'Square', 'Robinhood', 'SoFi']",policy_change,bullish,swing_2_5days,high,high,Potential for increased consumer spending and investment due to anticipated rate cuts could benefit fintech companies.,"Rate cuts typically lower borrowing costs, stimulating economic activity and benefiting financial technology firms.",False,,1,0.0,0.901,7.21,1.6,1.34,Shock
"More trouble brewing? HDFC Bank fires 3 executives for mis-selling bonds, says report","HDFC Bank fired three senior executives, including Sampath Kumar, over alleged mis-selling of Credit Suisse AT-1 bonds to NRIs. The controversy follows Atanu Chakraborty’s resignation and a sharp market value erosion, raising governance and investor trust concerns.",ET Markets,https://economictimes.indiatimes.com/markets/rssfeeds/1977021501.cms,2026-03-20 17:58:49 IST,8.7,https://economictimes.indiatimes.com/markets/stocks/news/more-trouble-brewing-hdfc-bank-fires-3-executives-for-mis-selling-bonds-says-report/articleshow/129700988.cms,False,Banking,negative,0.85,7,0.2,0.7,False,['HDFC Bank'],"['ICICI Bank', 'Axis Bank', 'Kotak Mahindra Bank', 'State Bank of India']",management_change,bearish,swing_2_5days,high,medium,HDFC Bank's governance issues may lead to short-term bearish sentiment and impact investor confidence.,"The firing of executives over mis-selling raises serious governance concerns, likely affecting stock performance and investor sentiment.",False,,-1,100.0,0.882,6.17,1.0,-0.02,Normal
"US stocks today: Dow crashes 444 pts, Nasdaq 2%, S&amp;P over 1% as Iran war hurts US stock markets most in 4 weeks","Indian markets mirrored global trends as Wall Street experienced a significant downturn. Heavyweights like Nvidia and Microsoft saw losses. The ongoing conflict in the Middle East fueled inflation concerns, pushing interest rate expectations higher. This geopolitical tension is impacting investor sentiment, leading to a broad market sell-off. Investors are bracing for prolonged market volatility.",ET Markets,https://economictimes.indiatimes.com/markets/rssfeeds/1977021501.cms,2026-03-20 19:04:20 IST,7.6,https://economictimes.indiatimes.com/markets/us-stocks/news/us-stocks-today-us-stock-open-lower-as-middle-east-turmoil-clouds-fed-outlook/articleshow/129702213.cms,False,Other,negative,0.85,8,0.2,0.7,True,"['Nvidia', 'Microsoft', 'Dow Inc.', 'S&P Global']","['Goldman Sachs', 'JP Morgan', 'Berkshire Hathaway', 'Procter & Gamble']",global_event,bearish,swing_2_5days,high,high,The ongoing Middle East conflict is likely to lead to sustained market volatility and bearish trends in US equities.,"Geopolitical tensions are raising inflation concerns and interest rate expectations, negatively impacting investor sentiment and leading to a market sell-off.",False,,-1,84.0,0.896,7.17,0.9,1.34,Shock
Quote of the day by Warren Buffett: “I make no attempt to forecast the market—my efforts are devoted to finding undervalued securities.”,"Warren Buffett rejects market forecasting and instead focuses on identifying undervalued businesses. His philosophy emphasises fundamentals, rational thinking and intrinsic value, helping investors avoid emotional decisions. By ignoring short-term noise and trusting long-term value, investors can build wealth as markets eventually recognise a company’s true worth.",ET Markets,https://economictimes.indiatimes.com/markets/rssfeeds/1977021501.cms,2026-03-20 17:59:00 IST,8.7,https://economictimes.indiatimes.com/markets/us-stocks/news/quote-of-the-day-by-warren-buffett-i-make-no-attempt-to-forecast-the-marketmy-efforts-are-devoted-to-finding-undervalued-securities-/articleshow/129692866.cms,False,Other,positive,0.85,7,0.8,0.6,False,"['Berkshire Hathaway', 'Apple', 'Coca-Cola', 'American Express']","['Investment Firms', 'Wealth Management Companies', 'Value-focused ETFs', 'Financial Advisors']",other,bullish,positional_weeks,high,medium,Buffett's focus on undervalued securities suggests a potential bullish trend for value stocks.,"The emphasis on intrinsic value and fundamentals may lead investors to seek undervalued stocks, driving their prices up as market sentiment shifts.",False,,1,0.0,0.965,6.76,0.7,-0.02,Normal
Aluminium prices recover as market weighs disruptions and weaker demand,Aluminium ​prices steadied on Friday as investors ​balanced the competing impacts of the Iran war and lower ​supply from disrupted operations in the Middle East against weaker demand from a spike in oil prices.,ET Markets,https://economictimes.indiatimes.com/markets/rssfeeds/1977021501.cms,2026-03-20 19:28:14 IST,7.2,https://economictimes.indiatimes.com/markets/commodities/news/aluminium-prices-recover-as-market-weighs-disruptions-and-weaker-demand/articleshow/129702594.cms,False,Manufacturing,neutral,0.65,6,0.5,0.4,True,"['Alcoa Corporation', 'Rio Tinto', 'Norsk Hydro', 'China Hongqiao Group']","['BHP Group', 'Southern Copper Corporation', 'Freeport-McMoRan', 'Linde plc']",global_event,neutral,swing_2_5days,medium,high,"Aluminium prices are stabilizing amidst geopolitical tensions and fluctuating demand, indicating potential volatility ahead.",The interplay of geopolitical disruptions and demand fluctuations suggests a cautious approach to aluminium investments.,False,,0,0.0,0.901,5.41,0.9,-1.38,Normal
RBI's bond purchases jump after Iran war,"India's central bank ​has boosted its secondary-market ​government bond purchases significantly since the Iran ​war broke out, data showed on Friday.",ET Markets,https://economictimes.indiatimes.com/markets/rssfeeds/1977021501.cms,2026-03-20 18:27:15 IST,8.2,https://economictimes.indiatimes.com/markets/bonds/india-central-banks-bond-purchases-jump-after-iran-war/articleshow/129701560.cms,False,Banking,positive,0.75,7,0.6,0.5,True,"['State Bank of India', 'HDFC Bank', 'ICICI Bank', 'Axis Bank']","['Government of India', 'Bond Market Investors', 'Insurance Companies', 'Pension Funds']",rbi_action,bullish,swing_2_5days,medium,high,Increased bond purchases by RBI may stabilize yields and support banking sector valuations amidst geopolitical tensions.,"The RBI's intervention in the bond market is likely to provide liquidity and confidence to investors, positively impacting banking stocks.",False,,1,0.0,0.888,6.22,1.5,-0.02,Normal
India 10-year yield posts biggest weekly jump in 15 weeks on oil shock,"India's benchmark 10-year bond yield logged its ​biggest weekly jump in 15 ​weeks on Friday, as surging oil prices sent the rupee ​plunging to record lows and stoked fears of inflation and hawkish central bank policy outlook.",ET Markets,https://economictimes.indiatimes.com/markets/rssfeeds/1977021501.cms,2026-03-20 18:32:56 IST,8.1,https://economictimes.indiatimes.com/markets/bonds/india-10-year-yield-posts-biggest-weekly-jump-in-15-weeks-on-oil-shock/articleshow/129701622.cms,False,Other,negative,0.85,7,0.2,0.7,True,"['Oil India', 'Reliance Industries', 'ONGC', 'Bharat Petroleum']","['Goldman Sachs', 'HDFC Bank', 'ICICI Bank', 'Axis Bank']",global_event,bearish,swing_2_5days,medium,high,"The surge in oil prices is likely to lead to increased inflationary pressures, impacting bond yields and the broader market negatively.","The significant rise in bond yields indicates market concerns over inflation and potential central bank tightening, driven by external oil price shocks.",False,,-1,73.5,0.89,6.23,0.9,-0.02,Normal
"Gainers &amp; Losers: Firstcry, GMDC and Petronet LNG among 7 top movers on Friday","Indian markets closed higher Friday, led by IT gains. Top movers: GMDC, Firstcry, Vodafone Idea, Happiest Minds, HDFC Bank, Acme Solar, and Petronet LNG.",ET Markets,https://economictimes.indiatimes.com/markets/rssfeeds/1977021501.cms,2026-03-20 17:33:16 IST,9.1,https://economictimes.indiatimes.com/markets/stocks/news/gainers-amp-losers-firstcry-gmdc-and-petronet-lng-among-7-top-movers-on-friday/slideshow/129700435.cms,False,Other,neutral,0.5,5,0.5,0.5,False,[],[],other,neutral,intraday,low,medium,AI error.,,False,,0,0.0,0.207,1.03,0.7,-2.74,Normal
"Max Estates aims Rs 3,000 crore revenue from new housing project in Noida","Realty firm Max Estates Ltd expects Rs 3,000 crore revenue from a new housing project in Noida.",ET Markets,https://economictimes.indiatimes.com/markets/rssfeeds/1977021501.cms,2026-03-20 17:07:20 IST,9.5,https://economictimes.indiatimes.com/markets/digital-real-estate/realty-news/max-estates-aims-rs-3000-crore-revenue-from-new-housing-project-in-noida/articleshow/129699798.cms,False,Other,positive,0.85,7,0.8,0.6,False,['Max Estates Ltd'],"['HDFC Ltd', 'L&T', 'Godrej Properties', 'Oberoi Realty']",capex_announcement,bullish,swing_2_5days,medium,medium,Max Estates' ambitious revenue target signals strong demand in the Noida real estate market.,The announcement of a significant revenue target indicates confidence in market conditions and potential growth in the real estate sector.,False,,1,0.0,0.872,6.1,1.4,-0.02,Normal
"US Stock Market Today | Dow Jones | Nasdaq Highlights: Dow drops 444 pts, Nasdaq 2%, S&amp;P over 1% as Iran war clouds outlook",,ET Markets,https://economictimes.indiatimes.com/markets/rssfeeds/1977021501.cms,2026-03-20 18:23:08 IST,8.3,https://economictimes.indiatimes.com/markets/us-stocks/news/us-stock-market-live-dow-jones-sp-500-nasdaq-trump-us-iran-israel-war-crude-brent-oil-tech-ai-stock-price-news-earnings/liveblog/129701493.cms,False,Other,negative,0.85,8,0.2,0.7,True,"['Dow Inc.', 'Apple', 'Microsoft', 'Tesla']","['Defense Contractors', 'Energy Suppliers', 'Gold Mining Companies', 'Cybersecurity Firms']",global_event,bearish,swing_2_5days,high,high,"The significant drop in major indices reflects heightened geopolitical tensions, particularly related to Iran, which could lead to increased market volatility.","The market's reaction to geopolitical risks often leads to short-term bearish trends, especially in sectors sensitive to global stability.",False,,-1,84.0,0.887,7.1,0.9,1.34,Shock
Paranjape Schemes to invest Rs 700cr to develop 1400 homes in Pune,Realty firm Paranjape Schemes Construction Ltd will invest Rs 700 crore to develop four projects in Pune as part of its expansion plan.,ET Markets,https://economictimes.indiatimes.com/markets/rssfeeds/1977021501.cms,2026-03-20 17:04:57 IST,9.6,https://economictimes.indiatimes.com/markets/digital-real-estate/realty-news/paranjape-schemes-to-invest-rs-700cr-to-develop-1400-homes-in-pune/articleshow/129699771.cms,False,Other,positive,0.85,7,0.8,0.6,False,['Paranjape Schemes Construction Ltd'],"['Local construction suppliers', 'Real estate agents', 'Home appliance manufacturers', 'Local service providers']",capex_announcement,bullish,positional_weeks,medium,medium,Paranjape Schemes' significant investment in Pune indicates strong growth potential in the local real estate market.,"The investment reflects confidence in the housing demand in Pune, which may lead to increased revenue and market share for the company.",False,,1,0.0,0.961,6.73,1.4,-0.02,Normal
"Wall St futures slip as Iran war rages on, investors dial down rate cut bets","U.S. stock index futures slipped in choppy trading on Friday as ​the Iran war approached its fourth week, roiling energy markets and prompting investors to aggressively reprice bets on interest rate cuts by the U.S. Federal Reserve.",ET Markets,https://economictimes.indiatimes.com/markets/rssfeeds/1977021501.cms,2026-03-20 17:03:13 IST,9.6,https://economictimes.indiatimes.com/markets/stocks/news/wall-st-futures-slip-as-iran-war-rages-on-investors-dial-down-rate-cut-bets/articleshow/129699658.cms,False,Energy,negative,0.75,7,0.2,0.6,True,"['ExxonMobil', 'Chevron', 'BP', 'Shell']","['Halliburton', 'Schlumberger', 'Baker Hughes', 'Transocean']",global_event,bearish,swing_2_5days,medium,high,"The ongoing Iran conflict is negatively impacting energy markets and investor sentiment, leading to reduced expectations for rate cuts.","The geopolitical tensions are causing instability in energy prices, which in turn affects broader market sentiment and interest rate expectations.",False,,-1,100.0,0.871,6.1,0.9,-0.02,Normal
Gold set for worst week in six years as war curbs rate-cut bets,"Gold headed for the biggest weekly loss in six years, as war in the Middle East boosted energy prices and reduced expectations for interest-rate cuts.",ET Markets,https://economictimes.indiatimes.com/markets/rssfeeds/1977021501.cms,2026-03-20 16:58:15 IST,9.7,https://economictimes.indiatimes.com/markets/commodities/news/gold-set-for-worst-week-in-six-years-as-war-curbs-rate-cut-bets/articleshow/129699635.cms,False,Other,negative,0.85,7,0.2,0.6,True,"['Barrick Gold', 'Newmont Corporation', 'Franco-Nevada', 'Wheaton Precious Metals']","['ExxonMobil', 'Chevron', 'BP', 'Royal Dutch Shell']",global_event,bearish,swing_2_5days,high,high,"The geopolitical tensions are negatively impacting gold prices, indicating a bearish trend in the short term.",Increased energy prices and reduced rate-cut expectations due to war are driving gold prices down.,False,,-1,73.5,0.869,6.08,0.9,-0.02,Normal
Tata Power among 7 stocks that hit 52-week high; rally up to 20% in a month,"On Friday, the benchmark Sensex surged 325 points, closing at 74,532. During this broader market rally, seven BSE 1000 stocks reached 52-week highs, marking their highest levels in the past year.",ET Markets,https://economictimes.indiatimes.com/markets/rssfeeds/1977021501.cms,2026-03-20 16:34:39 IST,10.1,https://economictimes.indiatimes.com/markets/stocks/news/tata-power-among-7-stocks-that-hit-52-week-high-rally-up-to-20-in-a-month/slideshow/129699243.cms,False,Energy,positive,0.85,7,0.8,0.6,False,"['Tata Power', 'Adani Green Energy', 'NTPC', 'Reliance Industries']","['Siemens', 'ABB', 'Larsen & Toubro', 'GE Power']",sector_tailwind,bullish,swing_2_5days,medium,medium,"Tata Power's recent performance reflects strong sector momentum, indicating potential for continued growth.","The broader market rally and multiple stocks hitting 52-week highs suggest a positive sentiment in the energy sector, particularly for Tata Power.",False,,1,0.0,0.864,6.05,1.2,-0.02,Normal
