title,description,source,source_url,published,hours_old,url,is_govt_source,sector,sentiment,sentiment_confidence,impact_score,valence,arousal,geopolitical_risk,affected_companies,second_order_beneficiaries,catalyst_type,price_direction,time_horizon,conviction,macro_sensitivity,one_line_insight,signal_reason,contrarian_flag,contrarian_reason,sentiment_num,weighted_risk_score,signal_decay,recency_weighted_impact,catalyst_weight,z_score,shock_status
Tanker carrying Iranian crude shifts course from India to China,"Iran war: A US-sanctioned tanker carrying Iranian crude, Ping Shun, has changed course to China after earlier signaling India as its destination, where it would have marked the first such import in nearly seven years. India has not bought Iranian oil since 2019 due to US sanctions, and despite a temporary waiver by Donald Trump, challenges around payment, shipping and insurance continue to hinder any potential deal.",ET Industry,https://economictimes.indiatimes.com/industry/rssfeeds/13352306.cms,2026-04-03 10:56:36 IST,0.2,https://economictimes.indiatimes.com/industry/energy/oil-gas/oil-prices-tanker-carrying-iranian-crude-shifts-course-from-india-to-china/articleshow/129994806.cms,False,Energy,negative,0.85,7,0.2,0.4,True,"['Reliance Industries', 'Indian Oil Corporation', 'ONGC', 'BPCL']","['Saudi Aramco', 'ExxonMobil', 'Chevron', 'TotalEnergies']",global_event,bearish,positional_weeks,medium,high,The shift of Iranian crude from India to China signals ongoing geopolitical tensions and impacts India's energy import strategy.,The inability of India to import Iranian oil due to US sanctions creates a bearish outlook for Indian oil companies and highlights the geopolitical risks in energy markets.,False,,-1,100.0,0.999,6.99,0.9,0.01,Normal
India’s ‘Lush’ green market is the new battleground for global beauty giants,"International beauty brands are changing their India strategy. They are now focusing on online sales and reaching customers beyond major cities. Platforms like Myntra are key gateways for these brands. This shift is driven by a younger, digitally savvy consumer. Brands entering now are poised to shape India's beauty market for years to come.",ET Industry,https://economictimes.indiatimes.com/industry/rssfeeds/13352306.cms,2026-04-03 10:43:10 IST,0.4,https://economictimes.indiatimes.com/industry/cons-products/indias-lush-green-market-is-the-new-battleground-for-global-beauty-giants/articleshow/129994328.cms,False,FMCG,positive,0.85,8,0.7,0.6,False,"['Myntra', ""L'Oreal"", 'Estée Lauder', 'Unilever']","['Amazon', 'Flipkart', 'Nykaa', 'Zalando']",sector_tailwind,bullish,positional_weeks,high,medium,The shift towards online sales in India's beauty market presents significant growth opportunities for both local and international brands.,The increasing focus on digital sales channels and the engagement of younger consumers indicate a robust growth trajectory for the beauty sector in India.,False,,1,0.0,0.998,7.98,1.2,1.19,Shock
India's 'Mounjaro brides': Weight-loss injections become part of pre-wedding preparation,"With wedding season in full swing, Indian health clinics are rolling out specialized weight-loss packages that include popular drugs such as Mounjaro and Wegovy. This emerging trend underscores the immense societal pressure to achieve a perfect look in a short span of time.",ET Industry,https://economictimes.indiatimes.com/industry/rssfeeds/13352306.cms,2026-04-03 10:11:03 IST,1.0,https://economictimes.indiatimes.com/industry/healthcare/biotech/pharmaceuticals/indias-mounjaro-brides-weight-loss-injections-become-part-of-pre-wedding-preparation/articleshow/129994013.cms,False,Healthcare,positive,0.75,7,0.6,0.5,False,"['Eli Lilly', 'Novo Nordisk', 'Zydus Cadila', 'Sun Pharma']","['Fitness Centers', 'Beauty Clinics', 'Nutritionists', 'Pharmaceutical Distributors']",sector_tailwind,bullish,swing_2_5days,medium,medium,The rising popularity of weight-loss injections in India during wedding season presents a growth opportunity for healthcare providers and pharmaceutical companies.,"The trend of using weight-loss drugs as part of wedding preparations indicates a growing market for health and wellness products, particularly in the context of societal pressures.",False,,1,0.0,0.986,6.9,1.2,0.01,Normal
Fire erupts at Kuwait's Mina Al-Ahmadi oil refinery after drone attack hits key oil hub,"Early Friday morning saw chaos at Kuwait's Mina Al-Ahmadi oil refinery, as fires broke out due to a drone attack. State media provided confirmation of the event and its impact on operational units. Thankfully, no personnel were injured in the incident, and emergency responders acted quickly to extinguish the flames.",ET Industry,https://economictimes.indiatimes.com/industry/rssfeeds/13352306.cms,2026-04-03 10:31:18 IST,0.6,https://economictimes.indiatimes.com/industry/energy/oil-gas/iran-israel-war-missle-east-kuwait-refinery-drone-attack-mina-al-ahmadi-fires-no-injuries/articleshow/129994389.cms,False,Energy,negative,0.85,7,0.2,0.7,True,"['Kuwait Petroleum Corporation', 'Saudi Aramco', 'ExxonMobil', 'BP']","['Halliburton', 'Schlumberger', 'Baker Hughes', 'Fluor Corporation']",global_event,bearish,swing_2_5days,medium,high,The drone attack at Kuwait's oil refinery raises concerns over regional stability and potential supply disruptions.,"The incident highlights vulnerabilities in energy infrastructure, which could lead to increased oil prices and market volatility.",False,,-1,100.0,0.991,6.94,0.9,0.01,Normal
"Noida land compensation probe: SIT questions 11 former officials, flags 20 exorbitant' payouts","A Supreme Court-appointed team has investigated alleged excess compensation payouts by the Noida Authority. Eleven former officials were questioned as part of the probe. The team submitted its report to the Uttar Pradesh government, which has now presented it to the Supreme Court. The investigation focused on inflated land compensation and potential collusion.",ET Industry,https://economictimes.indiatimes.com/industry/rssfeeds/13352306.cms,2026-04-03 09:36:55 IST,1.5,https://economictimes.indiatimes.com/industry/services/property-/-cstruction/noida-land-compensation-probe-sit-questions-11-former-officials-flags-20-exorbitant-payouts/articleshow/129993585.cms,False,Other,negative,0.85,7,0.2,0.4,True,[],[],regulatory,bearish,positional_weeks,medium,medium,The investigation into inflated land compensation could lead to regulatory changes affecting real estate and infrastructure sectors in Uttar Pradesh.,"The probe indicates potential mismanagement and corruption, which may result in stricter regulations and impact investor confidence in the region.",False,,-1,73.5,0.994,6.96,1.1,0.01,Normal
Jammu &amp; Kashmir revives 120-year-old Mohra hydel project amid push to ramp up power capacity,Jammu and Kashmir is reviving the 120-year-old Mohra Power Project. This historic hydroelectric facility shut down in the 1990s. The government is accelerating power generation efforts. The project's revival holds historical and symbolic value. It is a significant piece of Kashmir's engineering heritage.,ET Industry,https://economictimes.indiatimes.com/industry/rssfeeds/13352306.cms,2026-04-03 09:42:59 IST,1.4,https://economictimes.indiatimes.com/industry/energy/power/jammu-kashmir-revives-120-year-old-mohra-hydel-project-amid-push-to-ramp-up-power-capacity/articleshow/129993659.cms,False,Energy,positive,0.85,7,0.8,0.6,True,"['NHPC', 'Tata Power', 'L&T', 'Adani Green Energy']","['Siemens', 'ABB', 'GE', 'Schneider Electric']",government_contract,bullish,positional_weeks,medium,medium,The revival of the Mohra hydel project signals a positive shift in energy infrastructure investment in Jammu & Kashmir.,Government initiatives to boost power capacity can lead to increased investments and growth in the energy sector.,False,,1,0.0,0.994,6.96,1.7,0.01,Normal
"India auto wholesales jump in March; PVs, tractors lead the charge","Vehicle sales in March 2026 showed strong performance. Passenger vehicles and tractors led the growth. Two-wheelers and commercial vehicles also saw steady increases. This marks a record fiscal year for vehicle dispatches. Positive demand and GST 2.0 reforms boosted consumer sentiment. Maruti Suzuki, Mahindra &amp; Mahindra, and Tata Motors reported significant volume growth.",ET Industry,https://economictimes.indiatimes.com/industry/rssfeeds/13352306.cms,2026-04-03 09:46:04 IST,1.4,https://economictimes.indiatimes.com/industry/auto/auto-news/india-auto-wholesales-jump-in-march-pvs-tractors-lead-the-charge/articleshow/129993703.cms,False,Manufacturing,positive,0.85,8,0.7,0.6,False,"['Maruti Suzuki', 'Mahindra & Mahindra', 'Tata Motors']","['Bharat Forge', 'Bosch', 'Apollo Tyres', 'TVS Motor']",sector_tailwind,bullish,swing_2_5days,high,medium,"Strong vehicle sales in March indicate robust demand and positive market sentiment, benefiting major auto manufacturers.",The record fiscal year for vehicle dispatches and positive consumer sentiment driven by GST reforms suggest a bullish outlook for the auto sector.,False,,1,0.0,0.98,7.84,1.2,1.19,Shock
"Suzuki Burgman Street 125 price, mileage, features, engine, variants and colour options",Suzuki Burgman Street 125 Price: Suzuki has updated its Burgman Street scooter for 2026. New variants offer enhanced features like a TFT display and keyless ignition. Practical improvements include increased underseat storage and a repositioned fuel filler. The scooter now uses a revised platform for better rigidity. Engine specifications remain unchanged.,ET Industry,https://economictimes.indiatimes.com/industry/rssfeeds/13352306.cms,2026-04-03 09:33:36 IST,1.6,https://economictimes.indiatimes.com/industry/auto/two-wheelers-three-wheelers/suzuki-burgman-street-125-price-mileage-features-engine-variants-and-colour-options/articleshow/129993467.cms,False,Manufacturing,positive,0.85,6,0.7,0.6,False,['Suzuki'],"['Honda', 'Yamaha', 'Bajaj Auto', 'TVS Motor']",product_launch,bullish,swing_2_5days,medium,low,The updated Suzuki Burgman Street 125 could drive sales growth due to enhanced features and practicality.,"The introduction of new features and improvements in the scooter may attract more customers, positively impacting sales.",False,,1,0.0,0.977,5.86,0.7,-1.16,Normal
Producers find 8K reasons to restore old movies and rake it in,Indian cinema is embracing 8k scanning and restoration. This move preserves classic films from decay and unlocks new revenue streams. Directors like Mani Ratnam and actors like Rajinikanth are leading this trend.  8k scanning ensures films remain relevant for future high-resolution viewing and enhances their value for licensing deals with streaming platforms.  This strategic decision is future-proofing Indian cinematic heritage.,ET Industry,https://economictimes.indiatimes.com/industry/rssfeeds/13352306.cms,2026-04-03 09:22:15 IST,1.8,https://economictimes.indiatimes.com/industry/media/entertainment/producers-find-8k-reasons-to-restore-old-movies-and-rake-it-in/articleshow/129993439.cms,False,Other,positive,0.85,7,0.8,0.6,False,"['Reliance Entertainment', 'Yash Raj Films', 'Eros International', 'PVR Cinemas']","['Netflix', 'Amazon Prime Video', 'Disney+', 'Zee5']",sector_tailwind,bullish,positional_weeks,medium,low,The restoration of classic films using 8K technology presents a lucrative opportunity for Indian cinema and streaming platforms.,The trend of restoring old films enhances their market value and opens new revenue streams through licensing and streaming.,False,,1,0.0,0.993,6.95,1.2,0.01,Normal
"Dubai regulator probe found HDFC’s DIFC branch kept quiet for 5 years, failed to meet integrity standards","Banks own ethics panel found high number of regulatory breaches while onboarding clients; Deloitte, Kroll also had conducted probe. Funding is at odds with bank CEO's statement that these were technical lapses.",ET Industry,https://economictimes.indiatimes.com/industry/rssfeeds/13352306.cms,2026-04-03 05:30:00 IST,5.6,https://economictimes.indiatimes.com/industry/banking/finance/banking/dubai-regulator-probe-found-hdfcs-difc-branch-kept-quiet-for-5-years-failed-to-meet-integrity-standards/articleshow/129988500.cms,False,Banking,negative,0.85,7,0.2,0.6,False,['HDFC Bank'],"['Deloitte', 'Kroll']",regulatory,bearish,swing_2_5days,high,medium,HDFC Bank faces significant reputational damage and potential regulatory penalties due to integrity breaches.,"The findings of the probe indicate systemic issues within HDFC's operations, likely leading to investor concerns and a decline in stock price.",False,,-1,100.0,0.922,6.45,1.1,0.01,Normal
Only 17 states conduct LPG briefings; Centre urges remaining states to curb rumours and prevent panic buying,"The Central Government has raised concerns over the persistence of rumours regarding LPG availability, noting that only 17 states are currently conducting regular press briefings to mitigate public anxiety. In a formal letter to all State and Union Territory Chief Secretaries, the Ministry of Petroleum &amp; Natural Gas (MoPNG) has urged local administrations to intensify their communication strategies to prevent panic buying and hoarding across the country.",ET Industry,https://economictimes.indiatimes.com/industry/rssfeeds/13352306.cms,2026-04-03 09:17:33 IST,1.8,https://economictimes.indiatimes.com/industry/energy/oil-gas/only-17-states-conduct-lpg-briefings-centre-urges-remaining-states-to-curb-rumours-and-prevent-panic-buying/articleshow/129993400.cms,False,Energy,neutral,0.7,6,0.5,0.4,False,"['Indian Oil Corporation', 'Bharat Petroleum', 'Hindustan Petroleum', 'GAIL']","['LPG cylinder manufacturers', 'Logistics companies', 'Retailers', 'Consumer goods companies']",policy_change,neutral,swing_2_5days,medium,medium,Government intervention to manage LPG supply rumors may stabilize market sentiment but lacks immediate bullish impact.,"The government's proactive stance on communication may prevent panic buying, but the overall market reaction remains cautious.",False,,0,0.0,0.974,5.84,1.6,-1.16,Normal
"West Asia crisis: LPG imports run out of gas despite increase in supplies from US, Iran","India's LPG imports saw a sharp decline in March. This drop created a significant supply gap. Shipments from traditional Middle Eastern suppliers reduced considerably. However, the US and Iran stepped in to partially fill the shortfall. Domestic production also increased to meet demand. This situation highlights the impact of global events on India's energy supplies.",ET Industry,https://economictimes.indiatimes.com/industry/rssfeeds/13352306.cms,2026-04-03 05:30:00 IST,5.6,https://economictimes.indiatimes.com/industry/energy/oil-gas/west-asia-crisis-lpg-imports-run-out-of-gas-despite-increase-in-supplies-from-us-iran/articleshow/129988496.cms,False,Energy,negative,0.85,7,0.2,0.6,True,"['Indian Oil Corporation', 'Bharat Petroleum', 'Reliance Industries', 'GAIL India']","['LNG suppliers', 'Domestic LPG producers', 'Logistics companies', 'Energy technology firms']",global_event,bearish,swing_2_5days,medium,high,India's LPG supply crisis due to geopolitical tensions may lead to increased domestic production but highlights vulnerability in energy imports.,The decline in LPG imports from traditional suppliers amidst geopolitical tensions indicates a potential for price volatility and supply chain disruptions.,False,,-1,100.0,0.922,6.45,0.9,0.01,Normal
"Rajesh Palviya of Axis Sec suggests Voltamp Transformers, Shilpa Medicare, Persistent Systems shares to buy on April 6","The domestic equity markets are closed on Good Friday. On April 2, Nifty 50 rose 0.15% and Sensex 0.25% despite ongoing market challenges due to the Iran conflict and rising crude prices. India's manufacturing sector slowed, raising concerns over growth and inflation.",Livemint Markets,https://www.livemint.com/rss/markets,2026-04-03 09:55:45 IST,1.2,https://www.livemint.com/market/stock-market-news/rajesh-palviya-of-axis-sec-suggests-voltamp-transformers-shilpa-medicare-persistent-systems-shares-to-buy-on-april-6-11775189087677.html,False,Manufacturing,positive,0.75,7,0.6,0.5,True,"['Voltamp Transformers', 'Shilpa Medicare', 'Persistent Systems']","['Siemens', 'L&T', 'Tata Power', ""Dr. Reddy's Laboratories""]",earnings,bullish,swing_2_5days,medium,high,"Despite geopolitical tensions, select stocks are recommended for purchase, indicating potential resilience in specific sectors.","The recommendation comes amidst a slight market rise, suggesting confidence in these stocks despite broader economic concerns.",False,,1,0.0,0.983,6.88,1.3,0.01,Normal
Major Coal India arms report drop in production in FY26,"Coal India subsidiaries BCCL, CCL, WCL, and MCL saw production drop in FY26. This occurred as India increased coal reliance due to global gas supply disruptions. SECL and NCL registered growth. Experts noted potential spoilage risks with aggressive targets. CIL met contractual coal supply commitments for power plants and industry. Adequate stocks are expected for peak summer demand.",ET Industry,https://economictimes.indiatimes.com/industry/rssfeeds/13352306.cms,2026-04-03 01:13:38 IST,9.9,https://economictimes.indiatimes.com/industry/indl-goods/svs/metals-mining/major-coal-india-arms-report-drop-in-production-in-fy26/articleshow/129988547.cms,False,Energy,negative,0.75,6,0.3,0.4,True,"['Coal India', 'BCCL', 'CCL', 'WCL']","['SECL', 'NCL', 'power plants', 'industry']",global_event,bearish,swing_2_5days,medium,high,"Coal India faces production challenges amid rising coal reliance, impacting market sentiment.","The drop in production from major subsidiaries raises concerns about supply stability, especially with increased reliance on coal due to global gas disruptions.",False,,-1,100.0,0.867,5.2,0.9,-1.16,Normal
Global brokerages slash Nifty 50 targets! Is a deeper stock market crash coming?,"Global brokerages are lowering their outlook on Indian equities due to rising crude oil prices and geopolitical tensions. Citi, Nomura, Goldman Sachs, and Bernstein have cut Nifty 50 targets.",Livemint Markets,https://www.livemint.com/rss/markets,2026-04-03 10:29:28 IST,0.6,https://www.livemint.com/market/stock-market-news/global-brokerages-goldman-sachs-nomura-slash-nifty-50-target-is-a-deeper-stock-market-crash-coming-11775190282887.html,False,Other,negative,0.85,8,0.2,0.7,True,"['Citi', 'Nomura', 'Goldman Sachs', 'Bernstein']","['Oil & Gas Companies', 'Defensive Stocks', 'Gold Mining Companies', 'Consumer Staples']",global_event,bearish,swing_2_5days,high,high,The downgrade in Nifty 50 targets by major brokerages signals potential bearish trends in the Indian stock market due to external pressures.,"Rising crude oil prices and geopolitical tensions are leading to a pessimistic outlook from global brokerages, indicating a possible market downturn.",False,,-1,84.0,0.991,7.93,0.9,1.19,Shock
"‘April could be gold’s best month since 1980,’ says Peter Schiff —next target may be $6,000","Peter Schiff believes gold's value will rise due to ongoing geopolitical tensions and macroeconomic uncertainty, prompting investors to shift from the U.S. dollar. He predicts April could be a strong month for gold, potentially reaching $5,000 to $6,000.",Livemint Markets,https://www.livemint.com/rss/markets,2026-04-03 09:15:05 IST,1.9,https://www.livemint.com/market/commodities/gold-price-prediction-april-may-be-gold-s-best-month-since-1980-peter-schiff-next-gold-price-target-may-be-6000-11775187211498.html,False,Other,positive,0.85,8,0.7,0.6,True,"['Barrick Gold Corporation', 'Newmont Corporation', 'Franco-Nevada Corporation', 'Wheaton Precious Metals Corp']","['Gold ETFs', 'Mining Equipment Suppliers', 'Precious Metals Refiners', 'Gold Jewelry Manufacturers']",global_event,bullish,swing_2_5days,high,high,"Geopolitical tensions and macroeconomic uncertainty are driving gold prices higher, with potential for significant gains in April.","Peter Schiff's prediction of gold reaching $5,000 to $6,000 indicates strong bullish sentiment in the gold market, driven by external economic factors.",False,,1,0.0,0.973,7.78,0.9,1.19,Shock
Tata Motors PV share price in focus on Monday after JLR sales rebound in Q4 as production normalises,"Range Rover, Range Rover Sport and Defender models’ sales came in at 77.1% of the overall sales in January-March, higher than last year’s share of 66.3%. The models are a meaningful contributor to parent Tata Motors Passenger Vehicles’ cash flow.",Livemint Markets,https://www.livemint.com/rss/markets,2026-04-03 09:47:49 IST,1.3,https://www.livemint.com/market/stock-market-news/tata-motors-pv-share-price-in-focus-on-monday-after-jlr-sales-rebound-in-q4-as-production-normalises-11775189179801.html,False,Manufacturing,positive,0.85,8,0.7,0.6,False,"['Tata Motors', 'Jaguar Land Rover']","['Suppliers', 'Dealerships', 'Auto Parts Manufacturers', 'Logistics Companies']",earnings,bullish,swing_2_5days,high,medium,"Tata Motors is poised for a bullish trend as JLR sales rebound, indicating strong demand and improved cash flow.","The increase in sales share of key models suggests a recovery in production and demand, positively impacting Tata Motors' financials.",False,,1,0.0,0.981,7.85,1.3,1.19,Shock
India plans ₹2-2.5 lakh crore credit guarantee scheme amid West Asia conflict,"India is introducing a new credit guarantee scheme to help industries facing higher costs due to the West Asia conflict. This initiative aims to ensure companies can access funding, easing concerns about rising input and logistics expenses. The government is proactively preparing to mitigate any economic stress.",ET Industry,https://economictimes.indiatimes.com/industry/rssfeeds/13352306.cms,2026-04-03 05:30:00 IST,5.6,https://economictimes.indiatimes.com/industry/banking/finance/india-plans-2-2-5-lakh-crore-credit-guarantee-scheme-amid-west-asia-conflict/articleshow/129988417.cms,False,Other,positive,0.85,8,0.7,0.6,True,"['State Bank of India', 'HDFC Bank', 'ICICI Bank', 'Tata Steel']","['Larsen & Toubro', 'Adani Group', 'Reliance Industries', 'Infosys']",policy_change,bullish,swing_2_5days,high,medium,"The new credit guarantee scheme is likely to boost funding access for industries, positively impacting banks and related sectors.","The government's proactive approach to mitigate economic stress amid geopolitical tensions suggests a supportive environment for businesses, enhancing credit growth.",False,,1,0.0,0.922,7.38,1.6,1.19,Shock
Four top oil exploration stocks to watch as crude jumps 85% in 2026,"Brent began the year at approximately $61.98 per barrel and surged to around $114.57 by the end of trading on 27 March, following the outbreak of the Iran war on 28 February.",Livemint Markets,https://www.livemint.com/rss/markets,2026-04-03 08:00:36 IST,3.1,https://www.livemint.com/market/stock-market-news/four-top-oil-exploration-stocks-to-watch-as-crude-jumps-85-in-2026-11775119253191.html,False,Energy,positive,0.85,8,0.7,0.6,True,"['Company A', 'Company B', 'Company C', 'Company D']","['Service Provider 1', 'Service Provider 2', 'Logistics Company', 'Equipment Manufacturer']",global_event,bullish,positional_weeks,high,high,The surge in crude oil prices due to geopolitical tensions presents a strong investment opportunity in oil exploration stocks.,"The significant increase in crude oil prices driven by the Iran war indicates a favorable environment for oil exploration companies, likely leading to increased revenues and stock performance.",False,,1,0.0,0.987,7.9,0.9,1.19,Shock
"SBI Trustee releases pledged HDFC Bank, ICICI Bank shares linked to Sky Gold. Details here","SBI Trustee Company has released pledged shares of HDFC Bank and ICICI Bank, previously held as security for Sky Gold and Diamonds. The release occurred on March 27, 2026, resulting in no encumbered shares in either bank.",Livemint Markets,https://www.livemint.com/rss/markets,2026-04-03 08:35:22 IST,2.5,https://www.livemint.com/market/stock-market-news/sbi-trustee-releases-pledged-hdfc-bank-icici-bank-shares-linked-to-sky-gold-details-here-11775126607562.html,False,Banking,neutral,0.7,5,0.5,0.3,False,"['HDFC Bank', 'ICICI Bank']","['Sky Gold and Diamonds', 'SBI Trustee Company']",other,neutral,swing_2_5days,medium,medium,"The release of pledged shares may indicate improved liquidity for HDFC Bank and ICICI Bank, but overall market impact remains neutral.","The release of shares suggests a positive development for the banks involved, yet the overall market sentiment is stable, leading to a neutral outlook.",False,,0,0.0,0.965,4.82,0.7,-2.33,Normal
"Stock market holiday: Are BSE, NSE closed today for Good Friday 2026?",Stock market holiday: This is the second market holiday this week and the first for the month of April. The stock market holiday calendar on the BSE and National Stock Exchange (NSE) shows April 3 as a trading holiday for Good Friday.,Livemint Markets,https://www.livemint.com/rss/markets,2026-04-03 06:40:59 IST,4.5,https://www.livemint.com/market/stock-market-news/stock-market-holiday-are-bse-nse-closed-today-for-good-friday-2026-11775178165258.html,False,Other,neutral,0.7,3,0.5,0.2,False,[],[],global_event,neutral,intraday,low,low,"The stock market holiday indicates a pause in trading activity, which may lead to reduced volatility.",Market holidays typically result in lower trading volumes and can affect short-term market sentiment.,False,,0,0.0,0.459,1.38,0.9,-4.68,Normal
