title,description,source,source_url,published,hours_old,url,is_govt_source,sector,sentiment,sentiment_confidence,impact_score,valence,arousal,geopolitical_risk,affected_companies,second_order_beneficiaries,catalyst_type,price_direction,time_horizon,conviction,macro_sensitivity,one_line_insight,signal_reason,contrarian_flag,contrarian_reason,source_reliability,sentiment_num,weighted_risk_score,signal_decay,recency_weighted_impact,catalyst_weight,z_score,shock_status
AI actors and writers not eligible for Oscars,,ET_Startups,,2026-05-02 12:08:51 IST,4.5,https://economictimes.indiatimes.com/tech/artificial-intelligence/ai-actors-and-writers-will-be-ineligible-for-oscars/articleshow/130708656.cms,False,Other,negative,0.7,4.0,0.5,0.5,False,[],[],Regulatory,bearish,intraday,low,medium,Exclusion of AI actors from Oscars may impact industry perception.,,False,,1.0,-1,28.0,0.459,1.84,0.7,-0.84,Normal
"eGaming regulator takes charge, focuses on eSports registrations",,ET_Startups,,2026-05-02 12:08:51 IST,6.1,https://economictimes.indiatimes.com/tech/technology/egaming-regulator-takes-charge-focuses-on-esports-registrations/articleshow/130684703.cms,False,Other,neutral,0.7,5.0,0.5,0.5,False,[],[],Regulatory,neutral,intraday,low,medium,eGaming regulation may enhance market structure.,,False,,1.0,0,0.0,0.348,1.74,0.7,-0.01,Normal
Chip companies chase expert chefs to serve expats,,ET_Startups,,2026-05-02 12:08:51 IST,6.1,https://economictimes.indiatimes.com/tech/technology/chip-companies-chase-expert-chefs-to-serve-expats/articleshow/130684274.cms,False,Other,neutral,0.7,4.0,0.5,0.5,False,[],[],Market,neutral,intraday,low,medium,Chip companies targeting chefs indicates niche market growth.,,False,,1.0,0,0.0,0.348,1.39,0.7,-0.84,Normal
"Home interior startups lean on AI to shave costs, chase profits",,ET_Startups,,2026-05-02 12:08:51 IST,6.1,https://economictimes.indiatimes.com/tech/startups/home-interior-startups-lean-on-ai-to-shave-costs-chase-profits/articleshow/130683897.cms,False,Startup,positive,0.7,6.0,0.5,0.5,False,[],[],Market,bullish,intraday,low,medium,AI adoption in home interior startups could drive efficiency and profitability.,,False,,1.0,1,0.0,0.348,2.09,0.7,-1.0,Normal
"ETtech Deals Digest: Startups raised $660 million in April, up 3.2% on-year",,ET_Startups,,2026-05-02 12:08:51 IST,11.8,https://economictimes.indiatimes.com/tech/funding/ettech-deals-digest-startups-raised-660-million-in-april-up-3-2-on-year/articleshow/130684805.cms,False,Startup,positive,0.7,7.0,0.5,0.5,False,[],[],Investment,bullish,intraday,low,medium,Significant funding raised by startups indicates a healthy investment climate.,,False,,1.0,1,0.0,0.129,0.9,0.7,0.0,Normal
Karnataka launches India’s first state-led spacetech CoE in Bengaluru,,ET_Startups,,2026-05-02 12:08:51 IST,12.3,https://economictimes.indiatimes.com/tech/technology/karnataka-launches-indias-first-state-led-spacetech-coe-in-bengaluru/articleshow/130684381.cms,False,Other,positive,0.7,6.0,0.5,0.5,False,[],[],Innovation,bullish,intraday,low,medium,Karnataka's spacetech CoE could position India as a leader in space technology.,,False,,1.0,1,0.0,0.119,0.71,0.7,0.82,Watch
Meta faces US lawmaker scrutiny over removal of lawyer ads for social media addiction cases,,ET_Startups,,2026-05-02 12:08:51 IST,12.9,https://economictimes.indiatimes.com/tech/technology/meta-faces-us-lawmaker-scrutiny-over-removal-of-lawyer-ads-for-social-media-addiction-cases/articleshow/130683590.cms,False,Other,negative,0.7,5.0,0.5,0.5,False,[],[],Regulatory,bearish,intraday,low,medium,Meta's scrutiny may impact its advertising strategies.,,False,,1.0,-1,35.0,0.107,0.54,0.7,-0.01,Normal
Peter Thiel’s Founders Fund raises $6 billion in its largest-ever haul,,ET_Startups,,2026-05-02 12:08:51 IST,13.2,https://economictimes.indiatimes.com/tech/funding/peter-thiels-founders-fund-raises-6-billion-in-its-largest-ever-haul/articleshow/130683345.cms,False,Other,positive,0.7,7.0,0.5,0.5,False,[],[],Investment,bullish,intraday,low,medium,Founders Fund's significant raise indicates strong investor confidence.,,False,,1.0,1,0.0,0.102,0.71,0.7,1.66,Shock
US officials weigh cutting deadlines to fix digital flaws amid worries over AI-powered hacking,,ET_Startups,,2026-05-02 12:08:51 IST,13.3,https://economictimes.indiatimes.com/tech/artificial-intelligence/us-officials-weigh-cutting-deadlines-to-fix-digital-flaws-amid-worries-over-ai-powered-hacking/articleshow/130683178.cms,False,Other,negative,0.7,6.0,0.5,0.5,True,[],[],Regulatory,bearish,intraday,low,medium,Concerns over AI hacking may lead to stricter regulations.,,False,,1.0,-1,63.0,0.1,0.6,0.7,0.82,Watch
"OpenAI to augment workers, not replace them: CEO Sam Altman",,ET_Startups,,2026-05-02 12:08:51 IST,13.4,https://economictimes.indiatimes.com/tech/artificial-intelligence/openai-to-augment-workers-not-replace-them-ceo-sam-altman/articleshow/130682895.cms,False,Other,positive,0.7,6.0,0.5,0.5,False,[],[],Market,bullish,intraday,low,medium,OpenAI's stance on augmentation may reassure workers in tech.,,False,,1.0,1,0.0,0.098,0.59,0.7,0.82,Watch
Intel's Sambanova deal gets US antitrust clearance,,ET_Startups,,2026-05-02 12:08:51 IST,14.9,https://economictimes.indiatimes.com/tech/information-tech/intels-sambanova-deal-gets-us-antitrust-clearance/articleshow/130681546.cms,False,IT,positive,0.7,7.0,0.5,0.5,False,['Intel'],[],M&A,bullish,intraday,low,medium,Intel's Sambanova deal clearance boosts confidence in tech sector M&A activity.,,False,,1.0,1,0.0,0.076,0.53,0.7,0.0,Normal
Two-wheeler EV sales drop in April after March peak; Ola Electric's market share improves,,ET_Startups,,2026-05-02 12:08:51 IST,15.2,https://economictimes.indiatimes.com/tech/technology/two-wheeler-ev-sales-drop-in-april-after-march-peak-ola-electric-improves-market-share/articleshow/130681312.cms,False,Manufacturing,negative,0.7,5.0,0.5,0.5,False,['Ola Electric'],[],Sales Data,bearish,intraday,low,medium,Drop in two-wheeler EV sales indicates potential market volatility despite Ola's improved share.,,False,,1.0,-1,55.0,0.072,0.36,0.7,-1.37,Normal
I-T appellate body upholds rejection of Paisabazaar’s Rs 145.91 crore expense claim,,ET_Startups,,2026-05-02 12:08:51 IST,15.3,https://economictimes.indiatimes.com/tech/information-tech/i-t-appellate-body-upholds-rejection-of-paisabazaars-rs-145-91-crore-expense-claim/articleshow/130681206.cms,False,Fintech,negative,0.7,6.0,0.5,0.5,False,['Paisabazaar'],[],Regulatory Decision,bearish,intraday,low,medium,Rejection of Paisabazaar's expense claim raises concerns over regulatory scrutiny in fintech.,,False,,1.0,-1,72.0,0.071,0.43,0.7,0.5,Normal
Nebius to buy Eigen AI for $643 million to boost inference and US expansion,,ET_Startups,,2026-05-02 12:08:51 IST,16.2,https://economictimes.indiatimes.com/tech/startups/nebius-to-buy-eigen-ai-for-643-million-to-boost-inference-and-us-expansion/articleshow/130680117.cms,False,IT,positive,0.7,8.0,0.5,0.5,False,"['Nebius', 'Eigen AI']",[],M&A,bullish,intraday,low,medium,Nebius's acquisition of Eigen AI signals strong growth potential in AI sector.,,False,,1.0,1,0.0,0.06,0.48,0.7,0.95,Watch
Palo Alto Networks acquires Portkey; Tim Cook on Apple's India growth,,ET_Startups,,2026-05-02 12:08:51 IST,17.1,https://economictimes.indiatimes.com/tech/newsletters/tech-top-5/palo-alto-networks-acquires-portkey-tim-cook-on-apples-india-growth/articleshow/130678737.cms,False,IT,positive,0.7,7.0,0.5,0.5,False,"['Palo Alto Networks', 'Portkey']",[],Acquisition,bullish,intraday,low,medium,Palo Alto's acquisition of Portkey enhances its capabilities in cybersecurity.,,False,,1.0,1,0.0,0.052,0.36,0.7,0.0,Normal
Pentagon reaches agreements with leading AI companies,,ET_Startups,,2026-05-02 12:08:51 IST,18.6,https://economictimes.indiatimes.com/tech/technology/pentagon-reaches-agreements-with-leading-ai-companies/articleshow/130677523.cms,False,IT,positive,0.7,6.0,0.5,0.5,True,[],[],Agreements,bullish,intraday,low,medium,Pentagon's agreements with AI firms indicate strong government support for AI innovation.,,False,,1.0,1,0.0,0.04,0.24,0.7,-0.95,Normal
PhonePe’s Share.Market CEO Ujjwal Jain steps down,,ET_Startups,,2026-05-02 12:08:51 IST,19.7,https://economictimes.indiatimes.com/tech/technology/phonepes-share-market-ceo-ujjwal-jain-steps-down/articleshow/130676024.cms,False,Fintech,negative,0.7,4.0,0.5,0.5,False,['PhonePe'],[],Leadership Change,bearish,intraday,low,medium,Leadership change at PhonePe may create uncertainty in its strategic direction.,,False,,1.0,-1,48.0,0.033,0.13,0.7,-1.26,Normal
Amazon India Prime Day 2026 sale set for July,,ET_Startups,,2026-05-02 12:08:51 IST,19.7,https://economictimes.indiatimes.com/tech/startups/amazon-india-prime-day-2026-sale-set-for-july/articleshow/130675974.cms,False,Retail,positive,0.7,7.0,0.5,0.5,False,['Amazon'],[],Sales Event,bullish,intraday,low,medium,Amazon India's Prime Day sale is expected to drive significant consumer spending.,,False,,1.0,1,0.0,0.033,0.23,0.7,0.58,Watch
SpaceX spending on Starship tops $15 billion in rush for airline-like rocketry,,ET_Startups,,2026-05-02 12:08:51 IST,20.5,https://economictimes.indiatimes.com/tech/technology/spacex-spending-on-starship-tops-15-billion-in-rush-for-airline-like-rocketry/articleshow/130675161.cms,False,Aerospace,neutral,0.7,5.0,0.5,0.5,True,['SpaceX'],[],Spending Report,neutral,intraday,low,medium,SpaceX's spending on Starship reflects ongoing investment in aerospace innovation.,,False,,1.0,0,0.0,0.029,0.15,0.7,0.0,Normal
Reddit rallies as AI‑driven ad growth fuels strong revenue outlook,,ET_Startups,,2026-05-02 12:08:51 IST,21.1,https://economictimes.indiatimes.com/tech/artificial-intelligence/reddit-rallies-as-aidriven-ad-growth-fuels-strong-revenue-outlook/articleshow/130674476.cms,False,IT,positive,0.7,8.0,0.5,0.5,False,['Reddit'],[],Revenue Growth,bullish,intraday,low,medium,Reddit's strong revenue outlook driven by AI ad growth indicates robust digital marketing trends.,,False,,1.0,1,0.0,0.026,0.21,0.7,0.95,Watch
"IPO-bound JSW One acquires proptech platform BuildNext, expands home-construction wares",,ET_Startups,,2026-05-02 12:08:51 IST,21.2,https://economictimes.indiatimes.com/tech/technology/ipo-bound-jsw-one-acquires-proptech-platform-buildnext-expands-home-construction-wares/articleshow/130674444.cms,False,Real Estate,positive,0.7,6.0,0.5,0.5,False,"['JSW One', 'BuildNext']",[],Acquisition,bullish,intraday,low,medium,JSW One's acquisition of BuildNext expands its footprint in the proptech sector.,,False,,1.0,1,0.0,0.025,0.15,0.7,0.0,Normal
Confidant Claude: Anthropic says 6% of users turn to its AI chatbot for personal advice,,ET_Startups,,2026-05-02 12:08:51 IST,21.5,https://economictimes.indiatimes.com/tech/artificial-intelligence/confidant-claude-anthropic-says-6-of-users-turn-to-its-ai-chatbot-for-personal-advice/articleshow/130674038.cms,False,IT,neutral,0.7,5.0,0.5,0.5,False,['Anthropic'],[],User Engagement,neutral,intraday,low,medium,Anthropic's AI chatbot usage reflects growing interest in AI-driven personal assistance.,,False,,1.0,0,0.0,0.024,0.12,0.7,-1.9,Normal
Hyderabad cops want RBI to plug gaps that facilitate cybercrime,,ET_Startups,,2026-05-02 12:08:51 IST,21.9,https://economictimes.indiatimes.com/tech/technology/hyderabad-cops-want-rbi-to-plug-gaps-that-facilitate-cybercrime/articleshow/130673739.cms,False,Fintech,negative,0.7,5.0,0.5,0.5,False,[],[],Regulatory Request,bearish,intraday,low,medium,Hyderabad cops' request to RBI highlights ongoing concerns over cybercrime in fintech.,,False,,1.0,-1,60.0,0.023,0.12,0.7,-0.38,Normal
Drone maker ideaForge soars to profit in Q4; FY26 revenue surges 40% to Rs 226 crore,,ET_Startups,,2026-05-02 12:08:51 IST,22.7,https://economictimes.indiatimes.com/tech/technology/drone-maker-ideaforge-soars-to-profit-in-q4-fy26-revenue-surges-40-to-rs-226-crore/articleshow/130672818.cms,False,Energy,negative,0.7,7.0,0.5,0.5,False,[],[],Market Conditions,bearish,intraday,low,medium,Power prices hitting regulatory ceiling indicates supply-demand imbalance amid heatwave.,,False,,1.0,-1,98.0,0.02,0.14,0.7,0.76,Watch
UPI volumes report 3% dip in April to 22.5 billion transactions after record high numbers in March,,ET_Startups,,2026-05-02 12:08:51 IST,24.8,https://economictimes.indiatimes.com/tech/technology/upi-hits-record-scale-24162-crore-transactions-worth-rs-314-lakh-crore-in-fy26/articleshow/130671135.cms,False,Aviation,neutral,0.7,5.0,0.5,0.5,False,['Air India'],[],Leadership Change,neutral,intraday,low,medium,Air India CEO race reflects ongoing changes in leadership within the aviation sector.,,False,,1.0,0,0.0,0.014,0.07,0.7,-1.0,Normal
Power prices hit regulatory ceiling as heatwave drives demand,,ET_Industry,,2026-05-02 12:08:51 IST,6.6,https://economictimes.indiatimes.com/industry/energy/power/power-prices-hit-regulatory-ceiling-as-heatwave-drives-demand/articleshow/130699798.cms,False,FMCG,positive,0.7,6.0,0.5,0.5,False,['Magnum'],[],Market Demand,bullish,intraday,low,medium,Magnum's expansion plans align with rising demand for ice cream in India.,,False,,1.0,1,0.0,0.319,1.91,0.7,0.6,Watch
Air India CEO race: CCO Nipun Aggarwal among contenders to replace Campbell Wilson,,ET_Industry,,2026-05-02 12:08:51 IST,10.6,https://economictimes.indiatimes.com/industry/transportation/airlines-/-aviation/air-india-ceo-race-cco-nipun-aggarwal-among-contenders-to-replace-campbell-wilson/articleshow/130691281.cms,False,Manufacturing,positive,0.7,7.0,0.5,0.5,True,['Maruti Suzuki'],[],Market Demand,bullish,intraday,low,medium,Healthy demand for Maruti cars indicates resilience in the automotive sector despite global challenges.,,False,,1.0,1,0.0,0.159,1.11,0.7,0.41,Normal
Magnum plans three more factories to cash in on India's ice cream craze,,ET_Industry,,2026-05-02 12:08:51 IST,11.1,https://economictimes.indiatimes.com/industry/cons-products/food/magnum-plans-three-more-factories-to-cash-in-on-indias-ice-cream-craze/articleshow/130686237.cms,False,Manufacturing,positive,0.7,8.0,0.5,0.5,True,['Various Indian Car Companies'],[],Sales Data,bullish,intraday,low,medium,Strong start for Indian car companies in FY27 reflects robust domestic demand.,,False,,1.0,1,0.0,0.146,1.17,0.7,1.3,Shock
"'Demand for Maruti cars healthy in local market despite global challenges,' says senior executive Partho Banerjee",,ET_Industry,,2026-05-02 12:08:51 IST,11.2,https://economictimes.indiatimes.com/industry/auto/cars-uvs/demand-for-maruti-cars-healthy-in-local-market-despite-global-challenges-says-senior-executive-partho-banerjee/articleshow/130685156.cms,False,Infrastructure,positive,0.7,6.0,0.5,0.5,False,[],[],Development Project,bullish,intraday,low,medium,Missing Link project aims to enhance connectivity and economic prospects in Mumbai.,,False,,1.0,1,0.0,0.144,0.86,0.7,0.0,Normal
EVs ring in new fiscal on strong note,,ET_Industry,,2026-05-02 12:08:51 IST,11.3,https://economictimes.indiatimes.com/industry/renewables/evs-ring-in-new-fiscal-on-strong-note/articleshow/130684988.cms,False,Healthcare,negative,0.7,5.0,0.5,0.5,False,[],[],Talent Shortage,bearish,intraday,low,medium,Healthcare expansion in India faces challenges due to critical talent shortages.,,False,,1.0,-1,55.0,0.141,0.7,0.7,-0.61,Normal
GAIL moves court against PNGRB over unbundling plan,,ET_Industry,,2026-05-02 12:08:51 IST,11.4,https://economictimes.indiatimes.com/industry/energy/oil-gas/gail-moves-court-against-pngrb-over-unbundling-plan/articleshow/130685072.cms,False,Energy,positive,0.7,6.0,0.5,0.5,True,[],[],Market Dynamics,bullish,intraday,low,medium,Venezuela's oil export increase could impact global oil prices and supply dynamics.,,False,,1.0,1,0.0,0.139,0.83,0.7,-0.44,Normal
"Govt awarded 172 oil &amp; gas blocks in 10 years, but negligible output brings policy and execution into focus",,ET_Industry,,2026-05-02 12:08:51 IST,11.5,https://economictimes.indiatimes.com/industry/energy/oil-gas/govt-awarded-172-oil-gas-blocks-in-10-years-but-negligible-output-brings-policy-and-execution-into-focus/articleshow/130684950.cms,False,FMCG,negative,0.7,5.0,0.5,0.5,False,[],[],Price Hike,bearish,intraday,low,medium,Job losses due to LPG price hikes could negatively affect consumer spending in FMCG.,,False,,1.0,-1,50.0,0.136,0.68,0.7,-0.6,Normal
Indian car companies begin FY27 on a strong note despite geopolitical uncertainties,,ET_Industry,,2026-05-02 12:08:51 IST,11.9,https://economictimes.indiatimes.com/industry/auto/auto-news/indian-car-companies-begin-fy27-on-a-strong-note-despite-geopolitical-uncertainties/articleshow/130684674.cms,False,Manufacturing,positive,0.7,7.0,0.5,0.5,False,[],[],Policy Initiative,bullish,intraday,low,medium,Andhra Pradesh's e-mobility cities initiative supports growth in the EV sector.,,False,,1.0,1,0.0,0.127,0.89,0.7,0.41,Normal
Maruti Suzuki sees double-digit growth in FY27 as demand holds firm despite West Asia tensions,,ET_Industry,,2026-05-02 12:08:51 IST,11.9,https://economictimes.indiatimes.com/industry/auto/auto-news/maruti-suzuki-sees-double-digit-growth-in-fy27-as-demand-holds-firm-despite-west-asia-tensions/articleshow/130684625.cms,False,Banking,positive,0.7,6.0,0.5,0.5,False,[],[],Policy Initiative,bullish,intraday,low,medium,Banking panel's focus on PSUs' balance sheets could enhance capital efficiency.,,False,,1.0,1,0.0,0.127,0.76,0.7,0.0,Normal
"Missing Link to reshape Mumbai-Pune corridor, boost prospects of Mumbai 3.0",,ET_Industry,,2026-05-02 12:08:51 IST,12.9,https://economictimes.indiatimes.com/industry/services/property-/-cstruction/missing-link-to-reshape-mumbai-pune-corridor-boost-prospects-of-mumbai-3-0/articleshow/130683537.cms,False,Other,neutral,0.7,5.0,0.5,0.5,False,[],[],other,neutral,intraday,low,medium,,,False,,1.0,0,0.0,0.107,0.54,0.7,-0.01,Normal
"India's healthcare expansion faces a critical talent crunch, says Alisha Moopen",,ET_Industry,,2026-05-02 12:08:51 IST,14.3,https://economictimes.indiatimes.com/industry/healthcare/biotech/healthcare/indias-healthcare-expansion-faces-a-critical-talent-crunch-says-alisha-moopen/articleshow/130681989.cms,False,Other,neutral,0.7,5.0,0.5,0.5,False,[],[],other,neutral,intraday,low,medium,,,False,,1.0,0,0.0,0.084,0.42,0.7,-0.01,Normal
"Venezuela's oil exports jump to highest since 2018, with more sales to US, India",,ET_Industry,,2026-05-02 12:08:51 IST,14.5,https://economictimes.indiatimes.com/industry/energy/oil-gas/venezuelas-oil-exports-jump-to-highest-since-2018-with-more-sales-to-us-india/articleshow/130681990.cms,False,Other,neutral,0.7,5.0,0.5,0.5,False,[],[],other,neutral,intraday,low,medium,,,False,,1.0,0,0.0,0.081,0.4,0.7,-0.01,Normal
"Job losses to worsen due to commercial LPG price hikes, Industry associations say",,ET_Industry,,2026-05-02 12:08:51 IST,16.0,https://economictimes.indiatimes.com/industry/energy/oil-gas/job-losses-to-worsen-due-to-commercial-lpg-price-hikes-industry-associations-say/articleshow/130680375.cms,False,Other,neutral,0.7,5.0,0.5,0.5,False,[],[],other,neutral,intraday,low,medium,,,False,,1.0,0,0.0,0.063,0.32,0.7,-0.01,Normal
Andhra Pradesh govt notifies five model e-mobility cities under EV policy 4.0,,ET_Industry,,2026-05-02 12:08:51 IST,16.4,https://economictimes.indiatimes.com/industry/renewables/andhra-pradesh-govt-notifies-five-model-e-mobility-cities-under-ev-policy-4-0/articleshow/130679937.cms,False,Other,neutral,0.7,5.0,0.5,0.5,False,[],[],other,neutral,intraday,low,medium,,,False,,1.0,0,0.0,0.058,0.29,0.7,-0.01,Normal
"Banking panel to tackle PSUs' balance sheet constraints, boost capital use: DFS Secretary M Nagaraju",,ET_Industry,,2026-05-02 12:08:51 IST,17.0,https://economictimes.indiatimes.com/industry/banking/finance/banking/banking-panel-to-tackle-psus-balance-sheet-constraints-boost-capital-use-dfs-secretary-m-nagaraju/articleshow/130679231.cms,False,Other,neutral,0.7,5.0,0.5,0.5,False,[],[],other,neutral,intraday,low,medium,,,False,,1.0,0,0.0,0.053,0.26,0.7,-0.01,Normal
Mangalam Worldwide Q4 net profit grows to Rs 15 crore,,ET_Industry,,2026-05-02 12:08:51 IST,17.3,https://economictimes.indiatimes.com/industry/indl-goods/svs/steel/mangalam-worldwide-q4-net-profit-grows-to-rs-15-crore/articleshow/130678978.cms,False,Other,positive,0.7,6.0,0.5,0.5,False,['Mangalam Worldwide'],[],earnings,bullish,intraday,low,medium,"Mangalam Worldwide reports a profit growth, indicating strong performance.",,False,,1.0,1,0.0,0.05,0.3,1.3,0.82,Watch
"Lord’s Mark among few global players to win HIV self-test approval, exports from June 2026",,ET_Industry,,2026-05-02 12:08:51 IST,17.4,https://economictimes.indiatimes.com/industry/healthcare/biotech/healthcare/lords-mark-among-few-global-players-to-win-hiv-self-test-approval-exports-from-june-2026/articleshow/130678954.cms,False,Healthcare,positive,0.7,7.0,0.5,0.5,False,"[""Lord's Mark""]",[],regulatory approval,bullish,intraday,low,medium,"Lord’s Mark gains approval for HIV self-test, expanding its market potential.",,False,,1.0,1,0.0,0.049,0.34,0.7,0.92,Watch
Mahindra dethrones Tata Motors to become top EV revenue player in FY26,,ET_Industry,,2026-05-02 12:08:51 IST,18.1,https://economictimes.indiatimes.com/industry/auto/auto-news/mahindra-dethrones-tata-motors-as-it-tops-ev-revenue-charts-in-fy26/articleshow/130677615.cms,False,Manufacturing,positive,0.7,8.0,0.5,0.5,False,"['Mahindra', 'Tata Motors']",[],market position,bullish,intraday,low,medium,"Mahindra surpasses Tata Motors in EV revenue, showcasing strong market leadership.",,False,,1.0,1,0.0,0.043,0.34,0.7,1.3,Shock
Bright start to FY27 for carmakers with estimated sales of 4.5 lakh units in April,,ET_Industry,,2026-05-02 12:08:51 IST,18.1,https://economictimes.indiatimes.com/industry/auto/auto-news/bright-start-to-fy27-for-carmakers-with-estimated-sales-of-4-5-lakh-units-in-april/articleshow/130678046.cms,False,Manufacturing,positive,0.7,7.0,0.5,0.5,False,['Various Carmakers'],[],sales data,bullish,intraday,low,medium,"Carmakers report strong sales in April, indicating robust demand.",,False,,1.0,1,0.0,0.043,0.3,0.7,0.41,Normal
"Lodha Developers to launch homes worth nearly Rs 22,000 cr for sale in FY27",,ET_Industry,,2026-05-02 12:08:51 IST,18.3,https://economictimes.indiatimes.com/industry/services/property-/-cstruction/lodha-developers-to-launch-homes-worth-nearly-rs-22000-cr-for-sale-in-fy27/articleshow/130676149.cms,False,Real Estate,positive,0.7,6.0,0.5,0.5,False,['Lodha Developers'],[],project launch,bullish,intraday,low,medium,"Lodha Developers plans significant home launches, boosting market confidence.",,False,,1.0,1,0.0,0.042,0.25,0.7,0.0,Normal
UP: Dubai-bound passenger held at Lucknow airport with country-made pistol,,ET_Industry,,2026-05-02 12:08:51 IST,18.3,https://economictimes.indiatimes.com/industry/transportation/airlines-/-aviation/up-dubai-bound-passenger-held-at-lucknow-airport-with-country-made-pistol/articleshow/130675632.cms,False,Other,negative,0.7,3.0,0.5,0.5,True,[],[],security incident,bearish,intraday,low,medium,Security breach at airport raises concerns over safety and security.,,False,,1.0,-1,31.5,0.042,0.13,0.7,-1.68,Normal
"Ola Electric delivers 20% MoM growth in April, continues recovery momentum",,ET_Industry,,2026-05-02 12:08:51 IST,18.5,https://economictimes.indiatimes.com/industry/renewables/ola-electric-delivers-20-mom-growth-in-april-continues-recovery-momentum/articleshow/130677657.cms,False,Energy,positive,0.7,7.0,0.5,0.5,False,['Ola Electric'],[],growth data,bullish,intraday,low,medium,"Ola Electric shows strong growth, indicating recovery in the EV sector.",,False,,1.0,1,0.0,0.041,0.29,0.7,0.76,Watch
"This summer season, explore Usha ceiling fans",,ET_Industry,,2026-05-02 12:08:51 IST,18.8,https://economictimes.indiatimes.com/industry/cons-products/durables/this-summer-season-explore-usha-ceiling-fans/articleshow/130677002.cms,False,FMCG,neutral,0.7,4.0,0.5,0.5,False,['Usha'],[],seasonal promotion,neutral,intraday,low,medium,"Usha promotes ceiling fans for summer, a typical seasonal strategy.",,False,,1.0,0,0.0,0.038,0.15,0.7,-1.79,Normal
India supplies 20% of global generic medicines; its IP rules WTO-compliant: GTRI,,ET_Industry,,2026-05-02 12:08:51 IST,19.4,https://economictimes.indiatimes.com/industry/healthcare/biotech/pharmaceuticals/india-supplies-20-of-global-generic-medicines-its-ip-rules-wto-compliant-gtri/articleshow/130676557.cms,False,Healthcare,positive,0.7,6.0,0.5,0.5,False,[],[],trade data,bullish,intraday,low,medium,India's strong position in generic medicines boosts its global standing.,,False,,1.0,1,0.0,0.035,0.21,0.7,0.15,Normal
Noida International Airport to begin passenger flights from June 15; IndiGo to operate first service,,ET_Industry,,2026-05-02 12:08:51 IST,19.7,https://economictimes.indiatimes.com/industry/transportation/airlines-/-aviation/noida-international-airport-to-begin-passenger-flights-from-june-15-indigo-to-operate-first-service/articleshow/130676042.cms,False,Transportation,positive,0.7,7.0,0.5,0.5,False,['IndiGo'],[],infrastructure development,bullish,intraday,low,medium,Noida International Airport set to enhance connectivity with new flights.,,False,,1.0,1,0.0,0.033,0.23,0.7,0.0,Normal
"Petrol, diesel price hike in near future not ruled out, say govt sources",,ET_Industry,,2026-05-02 12:08:51 IST,20.3,https://economictimes.indiatimes.com/industry/energy/oil-gas/petrol-diesel-price-hike-in-near-future-not-ruled-out-say-govt-sources/articleshow/130675318.cms,False,Energy,negative,0.7,5.0,0.5,0.5,True,[],[],government policy,bearish,intraday,low,medium,Potential fuel price hikes could impact consumer spending and inflation.,,False,,1.0,-1,100.0,0.03,0.15,0.7,-1.65,Normal
