title,description,source,source_url,published,hours_old,url,is_govt_source,sector,sentiment,sentiment_confidence,impact_score,valence,arousal,geopolitical_risk,affected_companies,second_order_beneficiaries,catalyst_type,price_direction,time_horizon,conviction,macro_sensitivity,one_line_insight,signal_reason,contrarian_flag,contrarian_reason,sentiment_num,weighted_risk_score,signal_decay,recency_weighted_impact,catalyst_weight,z_score,shock_status
Russia to give itself sweeping powers to ban or restrict foreign AI tools,Russia is set to introduce new rules for artificial intelligence. Foreign AI tools may face bans or restrictions if they fail to comply. These regulations aim to protect citizens and promote domestic AI development. The new regime will likely come into effect next year. Russian user data will need to be stored locally for compliance.,ET Startups,https://economictimes.indiatimes.com/small-biz/startups/rssfeeds/13357270.cms,2026-03-20 19:24:17 IST,7.2,https://economictimes.indiatimes.com/tech/artificial-intelligence/russia-to-give-itself-sweeping-powers-to-ban-or-restrict-foreign-ai-tools/articleshow/129702520.cms,False,IT,negative,0.85,7,0.2,0.4,True,"['Yandex', 'Sberbank', 'Mail.ru Group', 'Tinkoff']","['Local AI Startups', 'Data Storage Companies', 'Cybersecurity Firms', 'Telecom Providers']",policy_change,bearish,positional_weeks,medium,high,"Russia's new AI regulations may hinder foreign tech firms while boosting local players, creating a challenging environment for international competition.","The introduction of sweeping powers to restrict foreign AI tools indicates a significant shift in regulatory landscape, likely impacting foreign investments and market dynamics.",False,,-1,100.0,0.971,6.8,1.6,-0.02,Normal
"ETtech Deals Digest: Startups raise $343 million this week, down 69% on-year","The number of deals during the week was down significantly at 29, compared to 44 in the corresponding week last year.",ET Startups,https://economictimes.indiatimes.com/small-biz/startups/rssfeeds/13357270.cms,2026-03-20 21:34:07 IST,5.1,https://economictimes.indiatimes.com/tech/funding/ettech-deals-digest-startups-raise-343-million-this-week-down-69-on-year/articleshow/129704583.cms,False,Startup,negative,0.85,7,0.2,0.3,False,[],[],other,bearish,swing_2_5days,medium,high,"The significant drop in startup funding indicates a tightening investment climate, which could impact growth prospects.",The drastic year-on-year decline in funding and deal volume suggests investor caution and potential challenges for startups in securing capital.,True,"While the overall sentiment is negative, some startups may emerge stronger by adapting to the new funding landscape, presenting unique investment opportunities.",-1,63.0,0.929,6.5,0.7,-0.02,Normal
Tesla expects Dutch decision on self-driving technology by April 10,"Tesla Europe expects ​a decision by ​April 10 from the Dutch vehicle authority RDW ‌on ⁠whether ⁠to approve ​Full Self-Driving technology in the Netherlands, ​it said on Friday.",ET Startups,https://economictimes.indiatimes.com/small-biz/startups/rssfeeds/13357270.cms,2026-03-20 18:26:47 IST,8.2,https://economictimes.indiatimes.com/tech/technology/tesla-expects-dutch-decision-on-self-driving-technology-by-april-10/articleshow/129701525.cms,False,IT,positive,0.8,7,0.6,0.5,False,['Tesla'],"['NVIDIA', 'Waymo', 'Mobileye', 'Apple']",regulatory,bullish,swing_2_5days,medium,medium,Approval of Tesla's self-driving tech in the Netherlands could boost investor confidence and market position.,"The upcoming decision by the Dutch authority is a significant regulatory milestone for Tesla's self-driving technology, which may enhance its competitive edge in the EV market.",False,,1,0.0,0.888,6.22,1.1,-0.02,Normal
Ecolab to acquire AI data center cooling tech firm for $5 billion,"Ecolab said on Friday it has ‌agreed ⁠to ⁠acquire CoolIT Systems, a ​liquid cooling technology provider for ​AI data centers, from KKR for $4.75 billion in ​cash.",ET Startups,https://economictimes.indiatimes.com/small-biz/startups/rssfeeds/13357270.cms,2026-03-20 17:52:50 IST,8.8,https://economictimes.indiatimes.com/tech/technology/ecolab-to-acquire-ai-data-center-cooling-tech-firm-for-4-75-billion/articleshow/129700816.cms,False,IT,positive,0.85,8,0.7,0.6,False,"['Ecolab', 'CoolIT Systems', 'KKR']","['NVIDIA', 'AMD', 'Intel', 'Microsoft']",acquisition,bullish,positional_weeks,high,medium,Ecolab's acquisition of CoolIT Systems positions it strongly in the growing AI data center market.,The acquisition enhances Ecolab's technological capabilities and market position in a rapidly expanding sector.,False,,1,0.0,0.964,7.71,0.7,1.34,Shock
"'Dark web' fraud sites cracked, 100s of suspects: Europol","The dark web platform ""Alice with Violence CP"" sold child abuse images and other cybercrime ""services"" such as credit card data and access to back-end computer systems. Europol estimated the suspect made around 345,000 euros ($400,000) from around 10,000 people who attempted to buy the illicit material.",ET Startups,https://economictimes.indiatimes.com/small-biz/startups/rssfeeds/13357270.cms,2026-03-20 16:46:14 IST,9.9,https://economictimes.indiatimes.com/tech/technology/dark-web-fraud-sites-cracked-100s-of-suspects-europol/articleshow/129699354.cms,False,Other,negative,0.85,7,0.1,0.9,True,[],"['Cybersecurity Firms', 'Law Enforcement Agencies', 'Legal Services', 'Data Protection Companies']",global_event,neutral,swing_2_5days,medium,medium,Increased scrutiny on cybercrime may boost demand for cybersecurity solutions.,"The crackdown on dark web fraud highlights vulnerabilities in online security, potentially increasing investments in cybersecurity.",False,,-1,73.5,0.867,6.07,0.9,-0.02,Normal
"China to allow more banks to handle digital yuan, sources say","The push to put the digital ​yuan into the real economy has been slow so far since its launch in 2019, with most retail customers already able to make safe and low-cost electronic transactions via platforms such as Alibaba's Alipay and Tencent Holdings' WeChat Pay.",ET Startups,https://economictimes.indiatimes.com/small-biz/startups/rssfeeds/13357270.cms,2026-03-20 16:40:53 IST,10.0,https://economictimes.indiatimes.com/tech/technology/china-to-allow-more-banks-to-handle-digital-yuan-sources-say/articleshow/129699218.cms,False,Banking,positive,0.75,7,0.6,0.5,True,"['Alibaba', 'Tencent', 'Bank of China', 'ICBC']","['JD.com', 'Baidu', 'Ant Group', 'China Merchants Bank']",policy_change,bullish,swing_2_5days,medium,medium,Increased access to digital yuan by banks could enhance transaction efficiency and boost adoption.,"The policy change indicates a strategic move to integrate digital currency into everyday transactions, potentially benefiting banks and tech companies.",False,,1,0.0,0.866,6.06,1.6,-0.02,Normal
"Govt cracks down on illegal gambling, betting websites; 300 such sites, apps blocked","The blocked sites and apps are related to online sports betting platforms; online casinos offering slots, roulette, live dealer tables; betting exchanges functioning like P-2-P betting marketplaces.",ET Startups,https://economictimes.indiatimes.com/small-biz/startups/rssfeeds/13357270.cms,2026-03-20 16:21:21 IST,10.3,https://economictimes.indiatimes.com/tech/technology/govt-cracks-down-on-illegal-gambling-betting-websites-300-such-sites-apps-blocked/articleshow/129698758.cms,False,Other,positive,0.75,7,0.6,0.5,False,"['DraftKings', 'FanDuel', 'BetMGM', '888 Holdings']","['Sports leagues', 'Media companies', 'Advertising firms', 'Payment processors']",policy_change,bullish,swing_2_5days,medium,medium,The crackdown on illegal gambling may boost the market for regulated betting platforms.,"Increased regulation can lead to a more favorable environment for licensed operators, potentially increasing their market share.",False,,1,0.0,0.862,6.03,1.6,-0.02,Normal
Amazon working on new smartphone years after Fire Phone flop: Report,Amazon is planning a comeback in the smartphone market. The company is reportedly developing a new AI-driven mobile hub. This device aims to integrate with Alexa and enhance Amazon services. It could offer a conventional smartphone or a simpler 'dumbphone'. This move signals Amazon's increased focus on artificial intelligence in consumer devices.,ET Startups,https://economictimes.indiatimes.com/small-biz/startups/rssfeeds/13357270.cms,2026-03-20 15:51:41 IST,10.8,https://economictimes.indiatimes.com/tech/technology/amazon-smartphone-plan-alexa-integration-transformer-project/articleshow/129698867.cms,False,IT,positive,0.75,7,0.6,0.5,False,['Amazon'],"['Apple', 'Google', 'Samsung', 'Microsoft']",product_launch,bullish,positional_weeks,medium,medium,Amazon's new smartphone initiative could revitalize its presence in the mobile market and enhance its AI ecosystem.,The integration of AI and Alexa into a new smartphone could attract consumers and boost Amazon's market share in mobile technology.,False,,1,0.0,0.956,6.69,0.7,-0.02,Normal
ByteDance agrees to sell Moonton to Savvy Games for $6 billion,"ByteDance has agreed to sell Moonton to Savvy Games Group for about $6 billion, shifting its focus to generative AI. The Beijing company will keep Moonton’s management and offer staff incentives. Savvy, a subsidiary of Saudi Arabia’s $1 trillion Public Investment Fund, is central to the kingdom’s aggressive push to become a global leader in video games and esports.",ET Startups,https://economictimes.indiatimes.com/small-biz/startups/rssfeeds/13357270.cms,2026-03-20 16:17:45 IST,10.3,https://economictimes.indiatimes.com/tech/technology/bytedance-agrees-to-sell-moonton-to-savvy-games-for-6-billion/articleshow/129698576.cms,False,Other,positive,0.85,7,0.8,0.6,True,"['ByteDance', 'Savvy Games', 'Moonton', 'Public Investment Fund']","['Tencent', 'Activision Blizzard', 'Electronic Arts', 'NVIDIA']",other,bullish,positional_weeks,medium,medium,ByteDance's strategic divestment to focus on generative AI may enhance its valuation while positioning Savvy Games for growth in the gaming sector.,"The sale aligns with global trends in gaming and AI, potentially benefiting both companies and their stakeholders.",False,,1,0.0,0.958,6.71,0.7,-0.02,Normal
Beijing-backed brain chip firm says it is 3 years behind Elon Musk's Neuralink,"NeuCyber's ⁠frontier Beinao-2 ⁠product is an invasive BCI with flexible electrodes that fully implant into the brain, currently undergoing large-scale animal implantation. Neuralink's technical advantage is that ​its surgical robot can insert hundreds of electrodes into the brain in minutes for its invasive N1 chip.",ET Startups,https://economictimes.indiatimes.com/small-biz/startups/rssfeeds/13357270.cms,2026-03-20 15:48:50 IST,10.8,https://economictimes.indiatimes.com/tech/artificial-intelligence/beijing-backed-brain-chip-firm-says-it-is-3-years-behind-elon-musks-neuralink/articleshow/129697033.cms,False,IT,negative,0.75,7,0.2,0.6,True,"['Neuralink', 'NeuCyber']","['Medtronic', 'Boston Scientific', 'Abbott Laboratories', 'Cochlear']",global_event,bearish,positional_weeks,medium,high,"NeuCyber's delay in brain chip technology highlights competitive pressures on Neuralink, potentially affecting investor sentiment.","The announcement of being three years behind indicates significant competitive challenges for NeuCyber, which may impact investor confidence in the sector.",False,,-1,100.0,0.956,6.69,0.9,-0.02,Normal
Free seat mandate will force sharp hike in Fares: Airlines,"Airlines in India are pushing back against a government order for free seat selection. They warn this will force ticket price hikes, hurting passengers. The Federation of Indian Airlines states this move will increase costs for all travelers. They cite a court ruling and government statements supporting market-driven fares.",ET Industry,https://economictimes.indiatimes.com/industry/rssfeeds/13352306.cms,2026-03-21 01:18:06 IST,1.3,https://economictimes.indiatimes.com/industry/transportation/airlines-/-aviation/free-seat-mandate-will-force-sharp-hike-in-fares-airlines/articleshow/129708492.cms,False,Other,negative,0.85,7,0.2,0.6,False,"['IndiGo', 'SpiceJet', 'Air India', 'GoAir']","['Travel Agencies', 'Online Travel Platforms', 'Hotels', 'Tour Operators']",policy_change,bearish,swing_2_5days,medium,high,"The government's free seat selection mandate may lead to increased fares, negatively impacting airline profitability and passenger demand.","Airlines are likely to face higher operational costs due to the mandate, which could lead to fare hikes and reduced consumer demand.",False,,-1,49.0,0.981,6.87,1.6,-0.02,Normal
"Air India 777 to Vancouver turns back after 7 hours over clearance lapse, lands safely in Delhi",An Air India flight bound for Vancouver had to turn back to Delhi. The Boeing 777-200LR was over seven hours into its journey. This happened because the aircraft was not cleared for the route. An administrative oversight led to the wrong plane being assigned. The flight landed safely back in Delhi.,ET Industry,https://economictimes.indiatimes.com/industry/rssfeeds/13352306.cms,2026-03-21 01:15:36 IST,1.4,https://economictimes.indiatimes.com/industry/transportation/airlines-/-aviation/air-india-777-to-vancouver-turns-back-after-7-hours-over-clearance-lapse-lands-safely-in-delhi/articleshow/129708518.cms,False,Other,negative,0.75,6,0.2,0.4,False,"['Air India', 'Boeing']","['Airbus', 'Indian Airports']",other,bearish,swing_2_5days,medium,medium,Air India's operational oversight raises concerns about airline management and safety protocols.,The incident reflects negatively on Air India's operational efficiency and could impact customer trust and future bookings.,False,,-1,42.0,0.98,5.88,0.7,-1.38,Normal
Obesity bet may drive focus on chronic segment: Alkem Labs,"Alkem Labs anticipates its upcoming semaglutide launch will drive a strategic shift from acute treatments to chronic care, including diabetes and obesity. The company aims to double its chronic segment revenue in three to five years, leveraging organic growth and acquisitions. This move is expected to create a more consistent sales trajectory for Alkem.",ET Industry,https://economictimes.indiatimes.com/industry/rssfeeds/13352306.cms,2026-03-21 01:07:39 IST,1.5,https://economictimes.indiatimes.com/industry/healthcare/biotech/pharmaceuticals/obesity-bet-may-drive-focus-on-chronic-segment-alkem-labs/articleshow/129708455.cms,False,Healthcare,positive,0.85,8,0.7,0.6,False,['Alkem Labs'],"['Novo Nordisk', 'Eli Lilly', 'Bristol-Myers Squibb', 'Pfizer']",earnings,bullish,positional_weeks,high,medium,Alkem Labs' strategic shift towards chronic care could significantly enhance its revenue stability and growth potential.,"The anticipated launch of semaglutide positions Alkem Labs favorably in a growing market for chronic conditions, particularly obesity and diabetes.",False,,1,0.0,0.994,7.95,1.3,1.34,Shock
Novo to track generic surge as semaglutide goes off patent,"Novo Nordisk is preparing for a surge of generic semaglutide drugs in India. The company's India head stated they will monitor rivals' pricing and market strategies closely. With many companies launching cheaper versions, Novo Nordisk plans to evaluate the market before reacting. This move comes as the blockbuster diabetes and weight-loss drug's patent expires.",ET Industry,https://economictimes.indiatimes.com/industry/rssfeeds/13352306.cms,2026-03-21 01:11:24 IST,1.5,https://economictimes.indiatimes.com/industry/healthcare/biotech/pharmaceuticals/novo-to-track-generic-surge-as-semaglutide-goes-off-patent/articleshow/129708471.cms,False,Healthcare,negative,0.75,7,0.3,0.5,False,"['Novo Nordisk', 'Mylan', 'Teva', 'Sandoz']","['Pharmacy Benefit Managers', 'Health Insurance Companies', 'Generic Drug Manufacturers', 'Diabetes Care Providers']",policy_change,bearish,swing_2_5days,medium,medium,Novo Nordisk faces potential revenue pressure as generics enter the market post-patent expiration.,"The expiration of semaglutide's patent will likely lead to increased competition from generic manufacturers, impacting Novo Nordisk's market share and pricing power.",True,"While the market may react negatively to Novo's immediate challenges, the company's strong brand and potential for innovation could provide long-term resilience.",-1,77.0,0.979,6.85,1.6,-0.02,Normal
"Natco, Eris Life to launch slimming shots in both Vial and Pen formats","Natco Pharma and Eris Lifesciences are launching generic semaglutide weight-loss injections. The companies are introducing both vial and pen formats. This move aims to make the treatment more affordable. Vials will be available first, targeting a wider patient base. Pens are expected later for metropolitan markets. This strategy offers patients pricing flexibility.",ET Industry,https://economictimes.indiatimes.com/industry/rssfeeds/13352306.cms,2026-03-21 01:06:11 IST,1.5,https://economictimes.indiatimes.com/industry/healthcare/biotech/pharmaceuticals/natco-eris-life-to-launch-slimming-shots-in-both-vial-and-pen-formats/articleshow/129708448.cms,False,Healthcare,positive,0.85,7,0.8,0.6,False,"['Natco Pharma', 'Eris Lifesciences']","['Pharmaceutical Distributors', 'Healthcare Providers', 'Insurance Companies', 'Weight Loss Clinics']",product_launch,bullish,swing_2_5days,medium,medium,Natco and Eris's launch of affordable weight-loss injections could capture significant market share in the growing obesity treatment sector.,"The introduction of generic semaglutide in both vial and pen formats enhances accessibility and affordability, likely increasing demand.",False,,1,0.0,0.979,6.85,0.7,-0.02,Normal
Hormuz shock hits India's Oil lifeline,"India's crude oil imports have significantly declined this month, dropping 23% due to a sharp contraction in supplies from the Gulf. Refiners are compensating by nearly doubling purchases from Russia and increasing imports from African nations, while Saudi Arabian supplies are also set to rise.",ET Industry,https://economictimes.indiatimes.com/industry/rssfeeds/13352306.cms,2026-03-21 00:57:58 IST,1.7,https://economictimes.indiatimes.com/industry/energy/oil-gas/hormuz-shock-hits-indias-oil-lifeline/articleshow/129708333.cms,False,Energy,negative,0.85,7,0.2,0.6,True,"['Reliance Industries', 'Indian Oil Corporation', 'Bharat Petroleum', 'Hindustan Petroleum']","['Russian Oil Companies', 'African Oil Producers', 'Shipping Companies', 'Logistics Firms']",global_event,bearish,swing_2_5days,medium,high,"India's oil supply chain faces disruption due to geopolitical tensions, impacting local refiners and altering import strategies.","The significant drop in crude oil imports from the Gulf indicates a supply shock, leading to potential price increases and volatility in the energy sector.",False,,-1,100.0,0.976,6.83,0.9,-0.02,Normal
Overseas film distributors rework terms to cut risks,"Indian film distributors overseas are adapting their strategies due to the West Asia war. They are now preferring refundable advances over non-refundable minimum guarantees. Distributors are also becoming more selective about the films they acquire. This shift aims to mitigate financial risks in a volatile market. The focus is on films with broader appeal, moving away from nationalist themes.",ET Industry,https://economictimes.indiatimes.com/industry/rssfeeds/13352306.cms,2026-03-21 01:04:52 IST,1.6,https://economictimes.indiatimes.com/industry/media/entertainment/overseas-film-distributors-rework-terms-to-cut-risks/articleshow/129708423.cms,False,Other,neutral,0.7,6,0.5,0.4,True,"['Eros International', 'Yash Raj Films', 'Reliance Entertainment', 'PVR Cinemas']","['Netflix', 'Amazon Prime Video', 'Disney+', 'Zee5']",global_event,bearish,swing_2_5days,medium,high,"The shift in overseas film distribution strategies indicates a cautious approach amid geopolitical tensions, potentially impacting revenue streams.","The adaptation of distributors to mitigate risks suggests a challenging environment for film acquisitions, which could lead to reduced box office performance.",False,,0,0.0,0.977,5.86,0.9,-1.38,Normal
"HUL rebuts divestment buzz, says foods business ‘core’ as Unilever confirms talks after inbound offer","Hindustan Unilever has denied speculation of divesting its foods business, stating it remains a core and attractive segment. Parent Unilever confirmed talks with McCormick &amp; Company following an inbound offer, but emphasized no deal is certain. The Indian foods business, generating over ₹15,000 crore annually, is a key pillar of HUL's strategy.",ET Industry,https://economictimes.indiatimes.com/industry/rssfeeds/13352306.cms,2026-03-21 01:05:30 IST,1.6,https://economictimes.indiatimes.com/industry/cons-products/food/hul-rebuts-divestment-buzz-says-foods-business-core-as-unilever-confirms-talks-after-inbound-offer/articleshow/129708428.cms,False,FMCG,positive,0.85,7,0.6,0.5,False,"['Hindustan Unilever', 'Unilever', 'McCormick & Company']","['Nestlé', 'Britannia', 'ITC', 'Dabur']",other,bullish,swing_2_5days,medium,medium,HUL's reaffirmation of its foods business as core amidst divestment rumors suggests stability and potential growth in the FMCG sector.,"The denial of divestment rumors by HUL indicates confidence in its food segment, which could attract investor interest and support stock performance.",False,,1,0.0,0.977,6.84,0.7,-0.02,Normal
PGCIL board nod to new merger plan for 28 subsidiaries,"Power Grid Corporation of India's board has approved a revised plan to merge 28 wholly owned subsidiaries into two group entities, expanding a previous proposal. This significant consolidation aims to streamline operations, reduce legal entities, and enhance efficiency within the company's extensive transmission network. The move is subject to regulatory approvals.",ET Industry,https://economictimes.indiatimes.com/industry/rssfeeds/13352306.cms,2026-03-21 00:37:41 IST,2.0,https://economictimes.indiatimes.com/industry/energy/power/pgcil-board-nod-to-new-merger-plan-for-28-subsidiaries/articleshow/129708096.cms,False,Energy,positive,0.85,7,0.8,0.6,False,['Power Grid Corporation of India'],"['Siemens', 'ABB', 'GE', 'Tata Power']",regulatory,bullish,positional_weeks,high,medium,The merger plan for PGCIL's subsidiaries is likely to enhance operational efficiency and investor confidence.,"Consolidation of subsidiaries can lead to cost savings and improved operational focus, positively impacting the company's market position.",False,,1,0.0,0.992,6.94,1.1,-0.02,Normal
Concessional diesel: No relief for Vedanta,"The Supreme Court has backed a High Court decision against Vedanta. The company will not get cheaper diesel. This is because Vedanta used the fuel for purposes beyond mining. It was resold to transporters and private parties. The court found this violated tax registration rules. Tax authorities denied Form C, impacting Vedanta's tax claims.",ET Industry,https://economictimes.indiatimes.com/industry/rssfeeds/13352306.cms,2026-03-21 00:47:41 IST,1.8,https://economictimes.indiatimes.com/industry/indl-goods/svs/metals-mining/concessional-diesel-no-relief-for-vedanta/articleshow/129708198.cms,False,Energy,negative,0.85,7,0.2,0.3,False,['Vedanta'],"['Oil India', 'Bharat Petroleum', 'Indian Oil', 'Reliance Industries']",regulatory,bearish,swing_2_5days,high,medium,"Vedanta faces regulatory hurdles impacting its diesel procurement costs, likely affecting profitability.","The Supreme Court's ruling against Vedanta restricts access to concessional diesel, increasing operational costs.",False,,-1,98.0,0.974,6.82,1.1,-0.02,Normal
Handset affordability key for bridging digital divide: Jyotiraditya Scindia,"Handset affordability remains the primary obstacle to global digital inclusion. India is actively addressing this through schemes like PLI. The nation has rapidly built the world's second-largest 5G network. India's 5G subscriber base is set to reach one billion by 2031. The country is also focusing on 6G development, aiming for significant patent contributions.",ET Industry,https://economictimes.indiatimes.com/industry/rssfeeds/13352306.cms,2026-03-21 00:44:24 IST,1.9,https://economictimes.indiatimes.com/industry/cons-products/electronics/handset-affordability-key-for-bridging-digital-divide-jyotiraditya-scindia/articleshow/129708151.cms,False,IT,positive,0.85,7,0.8,0.6,False,"['Reliance Industries', 'Bharti Airtel', 'Vodafone Idea', 'Samsung']","['Qualcomm', 'Nokia', 'Ericsson', 'ZTE']",policy_change,bullish,positional_weeks,high,medium,India's push for handset affordability and 5G expansion presents significant growth opportunities in the IT sector.,Government initiatives to enhance digital inclusion and infrastructure development are likely to boost telecom and tech companies.,False,,1,0.0,0.992,6.94,1.6,-0.02,Normal
