title,description,source,source_url,published,hours_old,url,is_govt_source,sector,sentiment,sentiment_confidence,impact_score,valence,arousal,geopolitical_risk,affected_companies,second_order_beneficiaries,catalyst_type,price_direction,time_horizon,conviction,macro_sensitivity,one_line_insight,signal_reason,contrarian_flag,contrarian_reason,sentiment_num,weighted_risk_score,signal_decay,recency_weighted_impact,catalyst_weight,z_score,shock_status
"India stood alone to oppose IFD pact at WTO meet, won't join crowd just to look better: Goyal","India stood alone at the WTO meeting in Cameroon, opposing a China-led Investment Facilitation for Development agreement. Commerce Minister Piyush Goyal stated India's stance prioritizes national interests and the WTO's multilateral character. India did not agree to the pact's incorporation into the WTO framework.",ET Economy,https://economictimes.indiatimes.com/economy/rssfeeds/1373380680.cms,2026-04-02 21:16:46 IST,13.9,https://economictimes.indiatimes.com/news/economy/foreign-trade/india-stood-alone-to-oppose-ifd-pact-at-wto-meet-wont-join-crowd-just-to-look-better-goyal/articleshow/129983713.cms,False,Other,neutral,0.7,6,0.5,0.4,True,[],[],global_event,neutral,positional_weeks,medium,high,"India's opposition to the IFD pact may signal a shift in trade dynamics, impacting future negotiations.","The stance taken by India reflects a prioritization of national interests over multilateral agreements, which could influence trade relations and investment flows.",False,,0,0.0,0.944,5.66,0.9,-1.16,Normal
A shield for India Inc: How govt is blunting the Iran war shock,"West Asia crisis: In response to Iran war chaos, India has rolled out a set of targeted measures over the past few weeks aimed at cushioning these shocks without resorting to sweeping market interventions. The approach has focused on easing cash flow pressures, lowering key costs and ensuring supply continuity.",ET Economy,https://economictimes.indiatimes.com/economy/rssfeeds/1373380680.cms,2026-04-02 22:30:57 IST,12.6,https://economictimes.indiatimes.com/news/economy/policy/a-shield-for-india-inc-how-govt-is-blunting-the-iran-war-shock/articleshow/129984979.cms,False,Other,positive,0.85,7,0.6,0.5,True,"['Reliance Industries', 'Tata Steel', 'Infosys', 'HDFC Bank']","['Adani Group', 'Larsen & Toubro', 'Maruti Suzuki', 'Bajaj Finance']",policy_change,bullish,swing_2_5days,medium,high,India's proactive measures to mitigate the impact of the Iran war could bolster market confidence and support key sectors.,"The government's targeted measures are likely to stabilize cash flows and supply chains, positively impacting various sectors.",False,,1,0.0,0.834,5.84,1.6,0.01,Normal
Several measures announced to cushion exporters from Gulf conflict impact: DGFT,"India is taking steps to help exporters facing challenges due to the Gulf conflict. Key sectors like gems, jewellery, rice, and pharma are affected. The government is working with insurers and banks on insurance and finance issues. Measures are being devised to resolve exporter problems.",ET Economy,https://economictimes.indiatimes.com/economy/rssfeeds/1373380680.cms,2026-04-02 21:18:52 IST,13.8,https://economictimes.indiatimes.com/news/economy/foreign-trade/several-measures-announced-to-cushion-exporters-from-gulf-conflict-impact-dgft/articleshow/129983737.cms,False,Other,neutral,0.5,5,0.5,0.5,False,[],[],other,neutral,intraday,low,medium,AI error.,,False,,0,0.0,0.092,0.46,0.7,-2.33,Normal
"India eyes preferential market access in US trade push, highlights strong growth position: Piyush Goyal","India is actively pursuing preferential access and the best possible trade deal with the United States. Union Minister Piyush Goyal highlighted India's strong position among emerging economies. Recent WTO discussions focused on critical trade areas, with agreements reached on integrating smaller economies and addressing fisheries subsidies.",ET Economy,https://economictimes.indiatimes.com/economy/rssfeeds/1373380680.cms,2026-04-02 20:25:53 IST,14.7,https://economictimes.indiatimes.com/news/economy/foreign-trade/india-eyes-preferential-market-access-in-us-trade-push-highlights-strong-growth-position-piyush-goyal/articleshow/129982577.cms,False,Other,positive,0.85,8,0.7,0.6,True,"['Tata Steel', 'Infosys', 'Mahindra & Mahindra', 'Wipro']","['HDFC Bank', 'Reliance Industries', 'Larsen & Toubro', 'Adani Group']",policy_change,bullish,positional_weeks,high,medium,India's push for preferential trade access with the US could enhance export opportunities for key sectors.,The emphasis on trade agreements and India's strong position may lead to increased foreign investment and export growth.,False,,1,0.0,0.941,7.53,1.6,1.19,Shock
New creditor-led IBC framework to put in place safeguards for stressed firm's management,"New creditor-led insolvency rules will impose strict financial transaction limits on stressed companies, requiring committee of creditors' approval. This aims to safeguard the rescue process and prevent misconduct. Management will continue operations under a resolution professional's supervision, with enhanced oversight and reporting obligations to ensure transparency and protect creditor interests.",ET Economy,https://economictimes.indiatimes.com/economy/rssfeeds/1373380680.cms,2026-04-02 20:38:02 IST,14.5,https://economictimes.indiatimes.com/news/economy/policy/new-creditor-led-ibc-framework-to-put-in-place-safeguards-for-stressed-firms-management/articleshow/129982980.cms,False,Other,neutral,0.7,6,0.5,0.4,False,"['Reliance Capital', 'Jaypee Infratech', 'Bhushan Steel', 'Essar Steel']","['Resolution Professionals', 'Financial Institutions', 'Legal Firms', 'Consulting Firms']",policy_change,neutral,swing_2_5days,medium,medium,"The new IBC framework aims to enhance transparency and oversight in the management of stressed firms, potentially stabilizing the sector.","The introduction of stricter rules may lead to improved recovery rates for creditors, but could also create operational challenges for affected companies.",False,,0,0.0,0.811,4.87,1.6,-1.16,Normal
West Asia crisis: Govt to assess impact of recent tax concessions on its indirect tax revenues,"Iran war: The review will factor in revenue implications from duty relief measures announced to cushion industries from supply disruptions, alongside broader economic effects stemming from the geopolitical tensions, officials said.",ET Economy,https://economictimes.indiatimes.com/economy/rssfeeds/1373380680.cms,2026-04-02 20:23:20 IST,14.7,https://economictimes.indiatimes.com/news/economy/policy/west-asia-crisis-govt-to-assess-impact-of-recent-tax-concessions-on-its-indirect-tax-revenues/articleshow/129982656.cms,False,Other,neutral,0.65,6,0.5,0.4,True,"['Oil & Gas Companies', 'Logistics Firms', 'Manufacturers', 'Retailers']","['Tax Consulting Firms', 'Insurance Companies', 'Financial Institutions', 'Exporters']",policy_change,bearish,swing_2_5days,medium,high,The government's assessment of tax concessions amidst geopolitical tensions may lead to cautious market sentiment.,"The review of tax concessions indicates potential revenue impacts, which could affect market confidence and company valuations in the short term.",False,,0,0.0,0.809,4.85,1.6,-1.16,Normal
"Govt imposes import curbs on all articles of gold, silver, platinum","These restrictions will apply irrespective of any prior contract, irrevocable letter of credit, advance payment, shipment status, or any other commitment, the Directorate General of Foreign Trade (DGFT) said in a notification.",ET Economy,https://economictimes.indiatimes.com/economy/rssfeeds/1373380680.cms,2026-04-02 22:43:25 IST,12.4,https://economictimes.indiatimes.com/news/economy/foreign-trade/govt-imposes-import-curbs-on-all-articles-of-gold-silver-platinum/articleshow/129985374.cms,False,Other,negative,0.85,8,0.2,0.7,True,"['Titan Company', 'Kalyan Jewellers', 'PC Jeweller', 'Malabar Gold & Diamonds']","['HDFC Bank', 'ICICI Bank', 'Axis Bank', 'State Bank of India']",policy_change,bearish,swing_2_5days,high,high,The government's import curbs on precious metals are likely to negatively impact jewelry companies and banks involved in financing gold purchases.,"The restrictions on imports will limit supply, potentially increasing prices domestically and affecting sales for jewelry retailers.",False,,-1,84.0,0.836,6.69,1.6,1.19,Shock
AI startup Sarvam close to raising $300 million at $1.5 billion valuation,"India’s homegrown artificial intelligence startup, Sarvam AI, is close to raising $300 million to $350 million as it seeks to build a domestic player that can compete with leaders from the US and China.",ET Startups,https://economictimes.indiatimes.com/small-biz/startups/rssfeeds/13357270.cms,2026-04-03 10:09:41 IST,1.0,https://economictimes.indiatimes.com/tech/startups/ai-startup-sarvam-close-to-raising-300-million-at-1-5-billion-valuation/articleshow/129994098.cms,False,Startup,positive,0.85,8,0.7,0.6,False,['Sarvam AI'],"['NVIDIA', 'Google', 'Microsoft', 'Amazon']",funding,bullish,swing_2_5days,high,medium,"Sarvam AI's significant funding round positions it as a strong competitor in the AI space, indicating robust investor confidence.",The substantial capital raise at a high valuation suggests strong market interest and potential for growth in the AI sector.,False,,1,0.0,0.986,7.89,0.7,1.19,Shock
Tata Group weighs West Asia fallout,"Tata Sons chairman Natarajan Chandrasekaran met over 30 group CEOs and managing directors to assess the impact of the West Asia war on businesses and plan measures to deal with it. More than 10,000 Tata Group employees are based in the affected region across companies such as Voltas, Tata Consultancy Services, Indian Hotels Company and Titan, including its West Asia jewellery brand Damas, the chairman noted.",ET Startups,https://economictimes.indiatimes.com/small-biz/startups/rssfeeds/13357270.cms,2026-04-03 11:05:20 IST,0.0,https://economictimes.indiatimes.com/tech/technology/tata-group-weighs-west-asia-fallout/articleshow/129994895.cms,False,Other,negative,0.75,7,0.2,0.4,True,"['Voltas', 'Tata Consultancy Services', 'Indian Hotels Company', 'Titan']","['Damas', 'Tata Power', 'Tata Steel', 'Tata Motors']",global_event,bearish,swing_2_5days,medium,high,"The ongoing conflict in West Asia poses significant risks to Tata Group's operations and employee safety, potentially impacting financial performance.","The meeting of Tata Group's leadership indicates a proactive approach to mitigate risks from geopolitical tensions, but the overall sentiment remains negative due to uncertainty.",False,,-1,73.5,1.0,7.0,0.9,0.01,Normal
India may soon announce more relief  for exporters hit by West Asia crisis,"India's government is introducing measures to support exporters facing disruptions from the West Asia crisis. Freight subsidies are being considered as part of a relief package. The ongoing conflict has impacted global trade and shipping costs. India's food and energy security remain strong despite these challenges. Merchandise exports saw a slight dip in February, with trade deficit narrowing.",ET Economy,https://economictimes.indiatimes.com/economy/rssfeeds/1373380680.cms,2026-04-02 20:01:34 IST,15.1,https://economictimes.indiatimes.com/news/economy/foreign-trade/some-more-decisions-on-anvil-to-help-exporters-tackle-west-asia-crisis-goyal/articleshow/129982048.cms,False,Other,positive,0.8,7,0.6,0.5,True,"['Adani Ports', 'Tata Steel', 'Mahindra Logistics', 'Hindustan Unilever']","['Shipping Companies', 'Logistics Providers', 'Agriculture Exporters', 'Textile Manufacturers']",government_contract,bullish,swing_2_5days,medium,medium,India's government support for exporters may boost related sectors amid West Asia crisis.,"The relief measures could enhance export competitiveness and stabilize affected sectors, leading to potential stock price increases.",False,,1,0.0,0.804,5.63,1.7,0.01,Normal
Microsoft to invest $10 billion in Japan for AI and cyber defence expansion,Microsoft will invest ten billion dollars in Japan from 2026 to 2029. This investment will expand artificial intelligence infrastructure and boost cybersecurity cooperation. The plan includes training one million engineers and developers by 2030. Microsoft will partner with domestic firms to enhance AI computing capacity. This initiative aims to support Japan's technological growth and national security.,ET Startups,https://economictimes.indiatimes.com/small-biz/startups/rssfeeds/13357270.cms,2026-04-03 09:13:43 IST,1.9,https://economictimes.indiatimes.com/tech/technology/microsoft-to-invest-10-billion-in-japan-for-ai-and-cyber-defence-expansion/articleshow/129993387.cms,False,IT,positive,0.85,8,0.7,0.6,False,"['Microsoft', 'NTT Data', 'Fujitsu', 'SoftBank']","['NVIDIA', 'Amazon Web Services', 'IBM', 'Google']",capex_announcement,bullish,positional_weeks,high,medium,Microsoft's $10 billion investment in Japan signals strong growth potential in AI and cybersecurity sectors.,"The investment will enhance AI infrastructure and cybersecurity, creating opportunities for both Microsoft and local partners.",False,,1,0.0,0.992,7.94,1.4,1.19,Shock
Database startup Supabase seeks to double valuation to $10 billion: Report,"Singapore sovereign wealth fund ​GIC is in ​talks to lead an investment ​in open-source database startup Supabase at a valuation of about $10 billion, The Information reported on ‌Thursday.",ET Startups,https://economictimes.indiatimes.com/small-biz/startups/rssfeeds/13357270.cms,2026-04-03 09:03:01 IST,2.1,https://economictimes.indiatimes.com/tech/startups/database-startup-supabase-seeks-to-double-valuation-to-10-billion-report/articleshow/129993278.cms,False,Startup,positive,0.85,8,0.7,0.6,False,['Supabase'],"['GIC', 'OpenAI', 'MongoDB', 'AWS']",investment,bullish,positional_weeks,high,medium,Supabase's potential valuation increase signals strong investor confidence in the open-source database sector.,"The involvement of a major sovereign wealth fund like GIC indicates a robust interest in the startup, which could lead to increased market attention and investment in similar companies.",False,,1,0.0,0.991,7.93,0.7,1.19,Shock
Anthropic acquires startup Coefficient Bio for about $400 million: Report,Anthropic acquires startup Coefficient Bio for about $400 million: report,ET Startups,https://economictimes.indiatimes.com/small-biz/startups/rssfeeds/13357270.cms,2026-04-03 07:20:32 IST,3.8,https://economictimes.indiatimes.com/tech/startups/anthropic-acquires-startup-coefficient-bio-for-about-400-million-report/articleshow/129992345.cms,False,Startup,positive,0.85,7,0.8,0.6,False,"['Anthropic', 'Coefficient Bio']","['AI Research Firms', 'Biotechnology Companies', 'Venture Capital Firms', 'Tech Startups']",other,bullish,positional_weeks,medium,medium,"Anthropic's acquisition of Coefficient Bio signals a strategic move into biotech, enhancing its AI capabilities.","The acquisition indicates growth potential in AI and biotech sectors, which could lead to increased investor interest and market confidence.",False,,1,0.0,0.984,6.89,0.7,0.01,Normal
"Under global spotlight, Australia plays hardball on social media ban","The global spotlight on the first ​such ban on people under 16 using popular apps appears to have encouraged Prime Minister Anthony Albanese's government to ramp up enforcement ​this week of what it was touting as successful cooperation with industry two months ago, tech policy experts say.",ET Startups,https://economictimes.indiatimes.com/small-biz/startups/rssfeeds/13357270.cms,2026-04-03 08:55:20 IST,2.2,https://economictimes.indiatimes.com/tech/technology/under-global-spotlight-australia-plays-hardball-on-social-media-ban/articleshow/129993253.cms,False,IT,negative,0.75,7,0.2,0.6,True,"['Meta Platforms', 'Snap Inc.', 'TikTok', 'Twitter']","['VPN providers', 'Cybersecurity firms', 'Local content creators', 'Alternative social media platforms']",policy_change,bearish,swing_2_5days,medium,high,Australia's stringent social media regulations could negatively impact major tech companies and create opportunities for alternatives.,The enforcement of a social media ban for users under 16 may lead to reduced user engagement and revenue for affected companies.,True,"While the immediate sentiment is negative, this could lead to a shift towards privacy-focused platforms, benefiting smaller players.",-1,100.0,0.969,6.78,1.6,0.01,Normal
Product design startup Noon emerges from stealth mode with $44 million funding,"San Francisco-headquartered startup Noon has emerged from stealth mode with $44 million in funding from Chemistry, First Round Capital, Scribble Ventures, Elevation Capital, and Afore Capital, along with individual investors from the technology and design industries.",ET Startups,https://economictimes.indiatimes.com/small-biz/startups/rssfeeds/13357270.cms,2026-04-03 06:27:13 IST,4.7,https://economictimes.indiatimes.com/tech/funding/product-design-startup-noon-emerges-from-stealth-mode-with-44-million-funding/articleshow/129992002.cms,False,Startup,positive,0.85,7,0.8,0.6,False,"['Chemistry', 'First Round Capital', 'Scribble Ventures', 'Elevation Capital']","['Afore Capital', 'design software companies', 'tech incubators', 'venture capital firms']",funding,bullish,swing_2_5days,medium,medium,Noon's successful funding round indicates strong investor confidence in innovative design solutions.,The emergence from stealth mode and significant funding suggest potential for growth and market interest.,False,,1,0.0,0.934,6.54,0.7,0.01,Normal
"BigBasket, 1mg founders plan transition; QED's Morris flags credit tightening",Happy Friday! BigBasket and 1mg founders are preparing to step back from day-to-day roles. This and more in today's ETtech Morning Dispatch.,ET Startups,https://economictimes.indiatimes.com/small-biz/startups/rssfeeds/13357270.cms,2026-04-03 06:52:32 IST,4.3,https://economictimes.indiatimes.com/tech/newsletters/morning-dispatch/bigbasket-1mg-founders-plan-transition-qeds-morris-flags-credit-tightening/articleshow/129992094.cms,False,Startup,neutral,0.7,5,0.5,0.3,False,"['BigBasket', '1mg']","['Zomato', 'PharmEasy', 'Swiggy', 'Paytm']",management_change,neutral,swing_2_5days,medium,medium,"Founders stepping back may lead to strategic shifts in BigBasket and 1mg, impacting their market positions.","The transition of founders could indicate a shift in company strategy, which may affect investor sentiment and operational focus.",False,,0,0.0,0.94,4.7,1.0,-2.33,Normal
"Crisis contractor for OpenAI, Anthropic eyes a move to combat extremism","People who show violent extremist tendencies on ChatGPT will be directed to human and chatbot‑based deradicalisation support through a new tool in development ​in New Zealand, the people behind it said.",ET Startups,https://economictimes.indiatimes.com/small-biz/startups/rssfeeds/13357270.cms,2026-04-03 06:20:40 IST,4.8,https://economictimes.indiatimes.com/tech/artificial-intelligence/crisis-contractor-for-openai-anthropic-eyes-a-move-to-combat-extremism/articleshow/129991939.cms,False,IT,positive,0.75,7,0.6,0.5,False,"['OpenAI', 'Anthropic']","['Tech Support Firms', 'Mental Health Organizations', 'AI Ethics Consultants']",policy_change,bullish,swing_2_5days,medium,medium,OpenAI and Anthropic's new tool for deradicalization could enhance their reputations and lead to increased adoption of their technologies.,"The initiative addresses a pressing social issue, potentially increasing user trust and engagement with AI platforms.",False,,1,0.0,0.933,6.53,1.6,0.01,Normal
"Small cities like Mangalore, Bhopal, Aurangabad join GCC race","Tier-2 cities now make up 30-32% of all new job postings, according to Sachin Alug, CEO of talent solutions firm NLB Services. “Hiring demand for tech and GCC roles in cities like Mangalore, Ahmedabad, and Nagpur has picked up noticeably, driven by the rise of nano-GCCs,” he said.",ET Startups,https://economictimes.indiatimes.com/small-biz/startups/rssfeeds/13357270.cms,2026-04-03 06:00:00 IST,5.1,https://economictimes.indiatimes.com/tech/technology/small-cities-like-mangalore-bhopal-aurangabad-enter-gcc-race/articleshow/129988377.cms,False,IT,positive,0.85,7,0.8,0.6,False,"['NLB Services', 'TCS', 'Infosys', 'Wipro']","['Real Estate Developers', 'Local Businesses', 'Educational Institutions', 'Transport Services']",sector_tailwind,bullish,swing_2_5days,medium,medium,"The rise of GCC roles in tier-2 cities indicates a growing demand for tech talent, benefiting local economies and IT firms.","Increased job postings in smaller cities suggest a shift in the tech job market, which could lead to higher revenues for IT companies and local businesses.",False,,1,0.0,0.929,6.5,1.2,0.01,Normal
Powerus backed by Trump sons looks to sell drone interceptors to Gulf states being attacked by Iran,Powerus cofounder Brett Velicovich told The Associated Press that the company is making sales pitches that include drone demonstrations in several Gulf countries to show how its defensive drone interceptors could help them ward off Iranian attacks.,ET Startups,https://economictimes.indiatimes.com/small-biz/startups/rssfeeds/13357270.cms,2026-04-03 06:19:36 IST,4.8,https://economictimes.indiatimes.com/tech/technology/powerus-backed-by-trump-sons-looks-to-sell-drone-interceptors-to-gulf-states-being-attacked-by-iran/articleshow/129991936.cms,False,Other,positive,0.85,7,0.6,0.7,True,"['Powerus', 'Lockheed Martin', 'Northrop Grumman', 'Raytheon']","['Boeing', 'General Dynamics', 'L3Harris Technologies', 'Thales Group']",global_event,bullish,positional_weeks,medium,high,Powerus's initiative to sell drone interceptors to Gulf states amid Iranian threats presents a significant growth opportunity in the defense sector.,"The geopolitical tensions in the Gulf region create a demand for defense solutions, positioning Powerus favorably for contracts.",False,,1,0.0,0.98,6.86,0.9,0.01,Normal
Broadcom taps Alphabet executive Amie Thuener as next CFO,"US ​chip designer Broadcom on ​Thursday named Alphabet executive Amie Thuener ​as its next finance chief, effective June 12, when incumbent Kirsten Spears retires. Thuener is currently Alphabet's vice president, corporate controller and ‌chief ⁠accounting officer.",ET Startups,https://economictimes.indiatimes.com/small-biz/startups/rssfeeds/13357270.cms,2026-04-03 06:14:13 IST,4.9,https://economictimes.indiatimes.com/tech/technology/broadcom-taps-alphabet-executive-amie-thuener-as-next-cfo/articleshow/129991942.cms,False,IT,positive,0.85,7,0.8,0.6,False,"['Broadcom', 'Alphabet']","['NVIDIA', 'Qualcomm', 'Intel', 'AMD']",management_change,bullish,positional_weeks,medium,medium,Broadcom's appointment of a seasoned executive from Alphabet signals a strategic shift that could enhance financial oversight and innovation.,"The transition in leadership, especially from a tech giant like Alphabet, suggests a focus on financial discipline and growth potential, which may positively influence investor sentiment.",False,,1,0.0,0.98,6.86,1.0,0.01,Normal
"AI disruption, inflation risks could tighten lending environment: QED’s Nigel Morris","Nigel Morris, cofounder of QED Investors, expects lending companiess to tighten credit amid rising inflation and geopolitical tensions. While cautious in the short term, he remains positive on India’s fintech growth. However, according to CreditSights, a prolonged Middle East conflict could raise credit costs and tighten liquidity for lenders in India.",ET Startups,https://economictimes.indiatimes.com/small-biz/startups/rssfeeds/13357270.cms,2026-04-03 06:00:00 IST,5.1,https://economictimes.indiatimes.com/tech/technology/ai-disruption-inflation-risks-could-tighten-lending-environment-qeds-nigel-morris/articleshow/129988150.cms,False,Fintech,negative,0.75,7,0.3,0.5,True,"['Paytm', 'Razorpay', 'PhonePe', 'Zerodha']","['HDFC Bank', 'ICICI Bank', 'Axis Bank', 'State Bank of India']",global_event,bearish,swing_2_5days,medium,high,Rising inflation and geopolitical tensions may lead to tighter credit conditions for fintech lenders in India.,The expectation of tightened lending due to inflation and geopolitical risks suggests a bearish outlook for fintech companies reliant on credit.,False,,-1,100.0,0.929,6.5,0.9,0.01,Normal
"TP-Link India arm claims US ties, denies China ink","Network equipment maker TP-Link said its India unit is part of its US entity, which split from its China business in 2024, rejecting claims that it is a Chinese company and thus barred from selling CCTV cameras in India.",ET Startups,https://economictimes.indiatimes.com/small-biz/startups/rssfeeds/13357270.cms,2026-04-03 06:00:00 IST,5.1,https://economictimes.indiatimes.com/tech/technology/tp-link-india-arm-claims-us-ties-denies-china-ink/articleshow/129988170.cms,False,IT,positive,0.8,7,0.6,0.5,True,"['TP-Link', 'Cisco', 'Hikvision', 'Dahua']","['Amazon', 'Flipkart', 'Reliance', 'Tata']",policy_change,bullish,swing_2_5days,medium,medium,TP-Link's clarification on its US ties may enhance its market position in India amidst geopolitical tensions.,The company's assertion of US ties could alleviate regulatory concerns and boost sales potential in the Indian market.,False,,1,0.0,0.929,6.5,1.6,0.01,Normal
