title,description,source,source_url,published,hours_old,url,is_govt_source,sector,sentiment,sentiment_confidence,impact_score,valence,arousal,geopolitical_risk,affected_companies,second_order_beneficiaries,catalyst_type,price_direction,time_horizon,conviction,macro_sensitivity,one_line_insight,signal_reason,contrarian_flag,contrarian_reason,source_reliability,sentiment_num,weighted_risk_score,signal_decay,recency_weighted_impact,catalyst_weight,z_score,shock_status
"Gold consolidates in $4,600-$4,800 range for almost 2 months. A big rally brewing in May?",,ET_Markets,,2026-05-02 12:08:51 IST,0.3,https://economictimes.indiatimes.com/markets/commodities/news/gold-consolidates-in-4600-4800-range-for-almost-2-months-a-big-rally-brewing-in-may/articleshow/130711353.cms,False,Other,neutral,0.7,5.0,0.5,0.5,False,[],[],Market Sentiment,neutral,intraday,low,medium,"Gold's consolidation may indicate a potential rally, but current macro conditions suggest caution.",,False,,1.0,0,0.0,0.949,4.74,0.7,-0.01,Normal
"F&amp;O Talk: Nifty charts suggest further consolidation; Sudeep Shah's strategy on Cohance, HEG and 4 more stocks",,ET_Markets,,2026-05-02 12:08:51 IST,0.4,https://economictimes.indiatimes.com/markets/expert-view/fo-talk-nifty-charts-suggest-further-consolidation-sudeep-shahs-strategy-on-cohance-heg-and-4-more-stocks/articleshow/130711223.cms,False,Other,neutral,0.7,4.0,0.5,0.5,False,[],[],Technical Analysis,neutral,intraday,low,medium,Nifty's consolidation suggests a wait-and-see approach; no immediate bullish signals.,,False,,1.0,0,0.0,0.933,3.73,0.7,-0.84,Normal
Ego vs. Edge: What today’s investors can learn from Tom Gayner’s four-point framework,,ET_Markets,,2026-05-02 12:08:51 IST,0.5,https://economictimes.indiatimes.com/markets/us-stocks/news/ego-vs-edge-what-todays-investors-can-learn-from-tom-gayners-four-point-framework/articleshow/130711135.cms,False,Other,neutral,0.7,3.0,0.5,0.5,False,[],[],Investor Education,neutral,intraday,low,medium,"Investor frameworks can provide insights, but macro conditions remain challenging.",,False,,1.0,0,0.0,0.917,2.75,0.7,-1.68,Normal
Jane Street employees set to get  $2.68 million payout after record revenue haul,,ET_Markets,,2026-05-02 12:08:51 IST,0.6,https://economictimes.indiatimes.com/markets/us-stocks/news/jane-street-employees-set-to-get-2-68-million-payout-after-record-revenue-haul/articleshow/130711040.cms,False,Other,positive,0.7,6.0,0.5,0.5,False,[],[],Corporate Performance,bullish,intraday,low,medium,"Jane Street's payout reflects strong performance, potentially boosting investor sentiment.",,False,,1.0,1,0.0,0.901,5.41,0.7,0.82,Watch
"EM is back, India is next: Why the 2025 underperformance is the perfect setup for a 2026 comeback",,ET_Markets,,2026-05-02 12:08:51 IST,0.8,https://economictimes.indiatimes.com/markets/stocks/news/em-is-back-india-is-next-why-the-2025-underperformance-is-the-perfect-setup-for-a-2026-comeback/articleshow/130710971.cms,False,Other,positive,0.7,7.0,0.5,0.5,False,[],[],Market Outlook,bullish,intraday,low,medium,Positive outlook for India in 2026 could attract long-term investments despite current macro risks.,,False,,1.0,1,0.0,0.871,6.1,0.7,1.66,Shock
"IPO Calendar: Rs 3,491 crore up for grabs for investors as 3 issues to open next week",,ET_Markets,,2026-05-02 12:08:51 IST,0.9,https://economictimes.indiatimes.com/markets/ipos/fpos/ipo-calendar-rs-3491-crore-up-for-grabs-for-investors-as-3-issues-to-open-next-week/articleshow/130710883.cms,False,Other,positive,0.7,6.0,0.5,0.5,False,[],[],Market Activity,bullish,intraday,low,medium,"Upcoming IPOs indicate strong market interest, potentially boosting investor confidence.",,False,,1.0,1,0.0,0.856,5.14,0.7,0.82,Watch
India’s newest mutual fund: Bhautik Ambani wants to bring global quant power to retail investors,,ET_Markets,,2026-05-02 12:08:51 IST,0.9,https://economictimes.indiatimes.com/markets/expert-view/indias-newest-mutual-fund-bhautik-ambani-wants-to-bring-global-quant-power-to-retail-investors/articleshow/130710823.cms,False,Other,positive,0.7,5.0,0.5,0.5,False,[],[],Market Innovation,bullish,intraday,low,medium,Bhautik Ambani's mutual fund could democratize access to global investment strategies.,,False,,1.0,1,0.0,0.856,4.28,0.7,-0.01,Normal
"Concurrent Gainers: 15 smallcap stocks gain for 5 straight sessions, rally up to 25%",,ET_Markets,,2026-05-02 12:08:51 IST,1.4,https://economictimes.indiatimes.com/markets/stocks/news/concurrent-gainers-15-smallcap-stocks-gain-for-5-straight-sessions-rally-up-to-25/slideshow/130710777.cms,False,Other,positive,0.7,6.0,0.5,0.5,False,[],[],Market Performance,bullish,intraday,low,medium,Smallcap stocks gaining consistently may indicate a healthy market environment.,,False,,1.0,1,0.0,0.785,4.71,0.7,0.82,Watch
"Securities Markets Code, 2025: How it can build a future-ready regulatory framework",,ET_Markets,,2026-05-02 12:08:51 IST,1.5,https://economictimes.indiatimes.com/markets/stocks/news/securities-markets-code-2025-how-it-can-build-a-future-ready-regulatory-framework/articleshow/130710466.cms,False,Other,neutral,0.7,4.0,0.5,0.5,False,[],[],Regulatory Framework,neutral,intraday,low,medium,Proposed regulations could enhance market stability but may face implementation challenges.,,False,,1.0,0,0.0,0.771,3.08,0.7,-0.84,Normal
Dollar set for sharp weekly loss versus yen after Japan steps in,,ET_Markets,,2026-05-02 12:08:51 IST,2.2,https://economictimes.indiatimes.com/markets/forex/forex-news/dollar-set-for-sharp-weekly-loss-versus-yen-after-japan-steps-in/articleshow/130709940.cms,False,Other,neutral,0.7,3.0,0.5,0.5,False,[],[],Currency Movement,neutral,intraday,low,medium,Dollar's movement against yen may have limited direct impact on Indian markets.,,False,,1.0,0,0.0,0.683,2.05,0.7,-1.68,Normal
Gold turns positive as oil eases on hopes for Iran talks,,ET_Markets,,2026-05-02 12:08:51 IST,2.2,https://economictimes.indiatimes.com/markets/commodities/news/gold-turns-positive-as-oil-eases-on-hopes-for-iran-talks/articleshow/130709912.cms,False,Energy,positive,0.7,7.0,0.5,0.5,False,[],[],Market Sentiment,bullish,intraday,low,medium,Gold's positive movement amid easing oil prices may attract safe-haven investors.,,False,,1.0,1,0.0,0.683,4.78,0.7,0.76,Watch
"Nifty has best month since December 2023; defence, capital markets &amp; realty put the shine on April",,ET_Markets,,2026-05-02 12:08:51 IST,2.2,https://economictimes.indiatimes.com/markets/stocks/news/nifty-has-best-month-since-december-2023-defence-capital-markets-realty-put-the-shine-on-april/articleshow/130709878.cms,False,Energy,neutral,0.7,5.0,0.5,0.5,False,[],[],Market Sentiment,neutral,intraday,low,medium,Oil price drop due to proposed talks may stabilize markets but uncertainty remains.,,False,,1.0,0,0.0,0.683,3.42,0.7,-1.65,Normal
Oil falls as Iran proposes talks but prices still set for weekly gains,,ET_Markets,,2026-05-02 12:08:51 IST,2.3,https://economictimes.indiatimes.com/markets/commodities/news/oil-falls-as-iran-proposes-talks-but-prices-still-set-for-weekly-gains/articleshow/130709884.cms,False,Energy,negative,0.7,6.0,0.5,0.5,True,[],[],Market Sentiment,bearish,intraday,low,medium,"Oil prices may face downward pressure from geopolitical talks, impacting energy stocks.",,False,,1.0,-1,100.0,0.671,4.03,0.7,-0.44,Normal
UK's FTSE 100 slips as losses in energy stocks and AstraZeneca weigh,,ET_Markets,,2026-05-02 12:08:51 IST,2.3,https://economictimes.indiatimes.com/markets/us-stocks/news/uks-ftse-100-slips-as-losses-in-energy-stocks-and-astrazeneca-weigh/articleshow/130709800.cms,False,Energy,negative,0.7,6.0,0.5,0.5,True,[],[],Market Performance,bearish,intraday,low,medium,FTSE 100's decline due to energy stock losses may reflect broader market concerns.,,False,,1.0,-1,100.0,0.671,4.03,0.7,-0.44,Normal
"Bank Lending to NBFCs Rises 26%, Fastest in FY26",,ET_Markets,,2026-05-02 12:08:51 IST,2.3,https://economictimes.indiatimes.com/markets/forex/bank-lending-to-nbfcs-rises-26-fastest-in-fy26/articleshow/130709795.cms,False,Banking,positive,0.7,7.0,0.5,0.5,False,[],[],Market Activity,bullish,intraday,low,medium,Significant rise in bank lending to NBFCs indicates strong credit demand and economic activity.,,False,,1.0,1,0.0,0.671,4.7,0.7,1.0,Watch
Global markets tread water as yen moves dominate currency trading,,ET_Markets,,2026-05-02 12:08:51 IST,2.4,https://economictimes.indiatimes.com/markets/us-stocks/news/global-markets-tread-water-as-yen-moves-dominate-currency-trading/articleshow/130709781.cms,False,Other,neutral,0.7,4.0,0.5,0.5,False,[],[],Market Sentiment,neutral,intraday,low,medium,"Global markets remain stable, but currency fluctuations may create volatility.",,False,,1.0,0,0.0,0.66,2.64,0.7,-0.84,Normal
Indian banks need to grow global forex game: RBI governor Sanjay Malhotra,,ET_Markets,,2026-05-02 12:08:51 IST,2.4,https://economictimes.indiatimes.com/markets/forex/indian-banks-need-to-grow-global-forex-game-rbi-governor-sanjay-malhotra/articleshow/130709783.cms,False,Banking,positive,0.7,6.0,0.5,0.5,False,[],[],Regulatory Framework,bullish,intraday,low,medium,RBI's focus on global forex could enhance banks' international competitiveness.,,False,,1.0,1,0.0,0.66,3.96,0.7,0.0,Normal
"RBI steps up play in us treasuries, other securities",,ET_Markets,,2026-05-02 12:08:51 IST,2.4,https://economictimes.indiatimes.com/markets/forex/rbi-steps-up-play-in-us-treasuries-other-securities/articleshow/130709733.cms,False,Banking,positive,0.7,6.0,0.5,0.5,False,[],[],Market Activity,bullish,intraday,low,medium,RBI's investment in US treasuries may signal confidence in global markets.,,False,,1.0,1,0.0,0.66,3.96,0.7,0.0,Normal
"AI agents becoming day traders, but gains prove elusive",,ET_Markets,,2026-05-02 12:08:51 IST,2.5,https://economictimes.indiatimes.com/markets/stocks/news/ai-agents-becoming-day-traders-but-gains-prove-elusive/articleshow/130709705.cms,False,Other,neutral,0.7,4.0,0.5,0.5,False,[],[],Market Sentiment,neutral,intraday,low,medium,"AI's role in trading is evolving, but current gains are inconsistent.",,False,,1.0,0,0.0,0.648,2.59,0.7,-0.84,Normal
"FPIs bet small on local debt, inflow pickup seen far away",,ET_Markets,,2026-05-02 12:08:51 IST,2.5,https://economictimes.indiatimes.com/markets/stocks/news/fpis-bet-small-on-local-debt-inflow-pickup-seen-far-away/articleshow/130709643.cms,False,Other,neutral,0.7,3.0,0.5,0.5,False,[],[],Market Activity,neutral,intraday,low,medium,FPIs' cautious approach to local debt reflects broader market uncertainties.,,False,,1.0,0,0.0,0.648,1.94,0.7,-1.68,Normal
"Wall Street Week Ahead: US stocks rally could find fuel in earnings, jobs data amid surging oil prices",,ET_Markets,,2026-05-02 12:08:51 IST,2.8,https://economictimes.indiatimes.com/markets/us-stocks/news/wall-street-week-ahead-us-stocks-rally-could-find-fuel-in-earnings-jobs-data-amid-surging-oil-prices/articleshow/130709483.cms,False,Other,positive,0.7,7.0,0.5,0.5,False,[],[],Market Outlook,bullish,intraday,low,medium,Positive earnings and job data could support US stock rally despite oil price concerns.,,False,,1.0,1,0.0,0.616,4.31,0.7,1.66,Shock
"US stocks today: S&amp;P 500, Nasdaq end higher, notch weekly gains after earnings-heavy week",,ET_Markets,,2026-05-02 12:08:51 IST,10.5,https://economictimes.indiatimes.com/markets/us-stocks/news/us-stocks-today-sp-500-nasdaq-end-higher-notch-weekly-gains-after-earnings-heavy-week/articleshow/130695675.cms,False,Other,positive,0.7,7.0,0.5,0.5,False,[],[],Market Performance,bullish,intraday,low,medium,US stocks' gains after earnings indicate strong market resilience amid volatility.,,False,,1.0,1,0.0,0.162,1.13,0.7,1.66,Shock
Zen Technologies Q4 results: Cons PAT falls 69% YoY to Rs 32 crore; revenue down 45%,,ET_Markets,,2026-05-02 12:08:51 IST,12.4,https://economictimes.indiatimes.com/markets/stocks/news/zen-technologies-q4-results-cons-pat-falls-69-yoy-to-rs-32-crore-revenue-down-45/articleshow/130684278.cms,False,Manufacturing,negative,0.7,5.0,0.5,0.5,False,['Zen Technologies'],[],Corporate Performance,bearish,intraday,low,medium,Zen Technologies' significant revenue drop raises concerns about its operational efficiency.,,False,,1.0,-1,55.0,0.117,0.59,0.7,-1.37,Normal
Musk’s $158 billion payday is a lot like Tesla stock: full of hot air,,ET_Markets,,2026-05-02 12:08:51 IST,12.9,https://economictimes.indiatimes.com/markets/us-stocks/news/musks-payday-is-a-lot-like-tesla-stock-full-of-hot-air-mark-gongloff/articleshow/130683654.cms,False,Other,negative,0.7,5.0,0.5,0.5,False,['Tesla'],[],Corporate Performance,bearish,intraday,low,medium,Musk's payday raises questions about Tesla's valuation and market sustainability.,,False,,1.0,-1,35.0,0.107,0.54,0.7,-0.01,Normal
US stock today | Spirit Airlines prepares to cease operations after bailout plan falls apart: Report,,ET_Markets,,2026-05-02 12:08:51 IST,13.9,https://economictimes.indiatimes.com/markets/us-stocks/news/us-stock-today-spirit-airlines-prepares-to-cease-operations-after-bailout-plan-falls-apart-report/articleshow/130682489.cms,False,Other,negative,0.7,6.0,0.5,0.5,False,['Spirit Airlines'],[],Corporate Performance,bearish,intraday,low,medium,Spirit Airlines' operational cease indicates severe financial distress and market instability.,,False,,1.0,-1,42.0,0.09,0.54,0.7,0.82,Watch
RBI should reject Tata Sons application to deregister as a CIC: InGovern Research,,ET_Markets,,2026-05-02 12:08:51 IST,14.0,https://economictimes.indiatimes.com/markets/stocks/news/rbi-should-reject-tata-sons-application-to-deregister-as-a-cic-ingovern-research/articleshow/130682149.cms,False,Other,negative,0.7,4.0,0.5,0.5,False,[],[],Regulatory Framework,bearish,intraday,low,medium,RBI's stance on Tata Sons may impact corporate governance perceptions in India.,,False,,1.0,-1,28.0,0.088,0.35,0.7,-0.84,Normal
"Sell in May and go away? Not so fast, as earnings, geopolitics may offset seasonal concerns",,ET_Markets,,2026-05-02 12:08:51 IST,14.4,https://economictimes.indiatimes.com/markets/us-stocks/news/sell-in-may-and-go-away-not-so-fast-as-earnings-geopolitics-may-offset-seasonal-concerns/articleshow/130681996.cms,False,Other,neutral,0.7,4.0,0.5,0.5,False,[],[],Market Sentiment,neutral,intraday,low,medium,Seasonal market trends may be offset by strong earnings and geopolitical factors.,,False,,1.0,0,0.0,0.083,0.33,0.7,-0.84,Normal
US stocks today: Roblox shares tumble as forecast cut signals safety measures weighing on user growth,,ET_Markets,,2026-05-02 12:08:51 IST,15.5,https://economictimes.indiatimes.com/markets/us-stocks/us-stocks-today-roblox-shares-tumble-as-forecast-cut-signals-safety-measures-weighing-on-user-growth/articleshow/130680966.cms,False,Other,negative,0.7,5.0,0.5,0.5,False,['Roblox'],[],Corporate Performance,bearish,intraday,low,medium,Roblox's forecast cut raises concerns about user growth and market competitiveness.,,False,,1.0,-1,35.0,0.068,0.34,0.7,-0.01,Normal
US stocks today: Reddit rallies as AI‑driven ad growth fuels strong revenue outlook,,ET_Markets,,2026-05-02 12:08:51 IST,15.6,https://economictimes.indiatimes.com/markets/us-stocks/us-stocks-today-reddit-rallies-as-aidriven-ad-growth-fuels-strong-revenue-outlook/articleshow/130680862.cms,False,Other,positive,0.7,6.0,0.5,0.5,False,['Reddit'],[],Market Performance,bullish,intraday,low,medium,Reddit's strong revenue outlook driven by AI suggests robust growth potential.,,False,,1.0,1,0.0,0.067,0.4,0.7,0.82,Watch
"RBI Governor Malhotra calls for deeper, more efficient financial markets as India shows resilience amid global headwinds",,ET_Economy,,2026-05-02 12:08:51 IST,2.0,https://economictimes.indiatimes.com/news/economy/policy/rbi-governor-malhotra-calls-for-deeper-more-efficient-financial-markets-as-india-shows-resilience-amid-global-headwinds/articleshow/130709953.cms,False,Banking,positive,0.7,7.0,0.5,0.5,False,[],[],Market Outlook,bullish,intraday,low,medium,RBI's call for efficient financial markets indicates a proactive approach to economic resilience.,,False,,1.0,1,0.0,0.707,4.95,0.7,1.0,Watch
India's consumption stands its ground amid Gulf War tremors,,ET_Economy,,2026-05-02 12:08:51 IST,6.6,https://economictimes.indiatimes.com/news/economy/indicators/indias-consumption-stands-its-ground-amid-gulf-war-tremors/articleshow/130689222.cms,False,Other,neutral,0.7,5.0,0.5,0.5,True,[],[],Geopolitical,neutral,intraday,low,medium,India's consumption remains stable despite geopolitical tensions.,,False,,1.0,0,0.0,0.319,1.6,0.7,-0.01,Normal
"India in talks with Nepal for ethanol exports, exploring shipments to SAARC nations",,ET_Economy,,2026-05-02 12:08:51 IST,16.3,https://economictimes.indiatimes.com/news/economy/foreign-trade/india-in-talks-with-nepal-for-ethanol-exports-exploring-shipments-to-saarc-nations/articleshow/130679973.cms,False,Manufacturing,positive,0.7,6.0,0.5,0.5,False,[],[],Trade,bullish,intraday,low,medium,Ethanol exports to Nepal and SAARC nations could boost India's manufacturing sector.,,False,,1.0,1,0.0,0.059,0.35,0.7,-0.48,Normal
"India discusses boosting trade with UK, local currency trade settlement with Tanzania",,ET_Economy,,2026-05-02 12:08:51 IST,18.4,https://economictimes.indiatimes.com/news/economy/foreign-trade/india-discusses-boosting-trade-with-uk-local-currency-trade-settlement-with-tanzania/articleshow/130677699.cms,False,Other,positive,0.7,6.0,0.5,0.5,False,[],[],Trade,bullish,intraday,low,medium,Boosting trade with the UK and local currency settlements could enhance economic ties.,,False,,1.0,1,0.0,0.041,0.25,0.7,0.82,Watch
India’s forex reserves fall $4.82 billion to $698.49 billion as of April 24,,ET_Economy,,2026-05-02 12:08:51 IST,18.8,https://economictimes.indiatimes.com/news/economy/indicators/indias-forex-reserves-fall-4-82-billion-to-698-48-billion-as-of-april-24/articleshow/130677141.cms,False,Banking,negative,0.7,7.0,0.5,0.5,False,[],[],Economic,bearish,intraday,low,medium,A significant drop in forex reserves may indicate economic stress.,,False,,1.0,-1,100.0,0.038,0.27,0.7,1.0,Watch
"US raises concerns at India’s duties on IP-intensive goods, source code, AI working paper",,ET_Economy,,2026-05-02 12:08:51 IST,19.4,https://economictimes.indiatimes.com/news/economy/foreign-trade/us-raises-concerns-at-indias-duties-on-ip-intensive-goods-source-code-ai-working-paper/articleshow/130676261.cms,False,Other,negative,0.7,6.0,0.5,0.5,True,[],[],Regulatory,bearish,intraday,low,medium,US concerns over India's duties on IP goods could strain trade relations.,,False,,1.0,-1,63.0,0.035,0.21,0.7,0.82,Watch
Worker unions can submit eighth CPC demands till May-end,,ET_Economy,,2026-05-02 12:08:51 IST,19.4,https://economictimes.indiatimes.com/news/economy/policy/worker-unions-can-submit-eighth-cpc-demands-till-may-end/articleshow/130676315.cms,False,Other,neutral,0.7,4.0,0.5,0.5,False,[],[],Labor,neutral,intraday,low,medium,Worker unions' demands may not significantly impact the broader economy.,,False,,1.0,0,0.0,0.035,0.14,0.7,-0.84,Normal
"India, UK discuss ways to boost bilateral trade",,ET_Economy,,2026-05-02 12:08:51 IST,19.9,https://economictimes.indiatimes.com/news/economy/foreign-trade/india-uk-discuss-ways-to-boost-bilateral-trade/articleshow/130675801.cms,False,Other,positive,0.7,5.0,0.5,0.5,False,[],[],Trade,bullish,intraday,low,medium,Discussions to boost bilateral trade with the UK could enhance economic growth.,,False,,1.0,1,0.0,0.032,0.16,0.7,-0.01,Normal
"Barrierless tolling to go live soon, MLFF trials underway at Delhi’s Mundka plaza",,ET_Economy,,2026-05-02 12:08:51 IST,19.9,https://economictimes.indiatimes.com/news/economy/infrastructure/barrierless-tolling-to-go-live-soon-mlff-trials-underway-at-delhis-mundka-plaza/articleshow/130675270.cms,False,Other,positive,0.7,5.0,0.5,0.5,False,[],[],Infrastructure,bullish,intraday,low,medium,Barrierless tolling could improve transportation efficiency in Delhi.,,False,,1.0,1,0.0,0.032,0.16,0.7,-0.01,Normal
Give our bullion back: India wants its gold under own lock and key,,ET_Economy,,2026-05-02 12:08:51 IST,20.3,https://economictimes.indiatimes.com/news/economy/policy/gold-storage-repatriation-from-england-give-our-bullion-back-india-wants-its-gold-under-own-lock-and-key/articleshow/130674895.cms,False,Other,negative,0.7,6.0,0.5,0.5,True,[],[],Geopolitical,bearish,intraday,low,medium,India's demand for gold back could indicate concerns over global economic stability.,,False,,1.0,-1,63.0,0.03,0.18,0.7,0.82,Watch
India's sugar exports to be 7.5-8 lakh tonnes in 2025-26 season on weak global prices: Official,,ET_Economy,,2026-05-02 12:08:51 IST,21.4,https://economictimes.indiatimes.com/news/economy/agriculture/indias-sugar-exports-to-be-7-5-8-lakh-tonnes-in-2025-26-season-on-weak-global-prices-official/articleshow/130674249.cms,False,Manufacturing,negative,0.7,5.0,0.5,0.5,False,[],[],Market,bearish,intraday,low,medium,Weak global prices may hinder India's sugar export potential.,,False,,1.0,-1,55.0,0.025,0.12,0.7,-1.37,Normal
IMD sees above-normal heatwave Maydays,,ET_Economy,,2026-05-02 12:08:51 IST,21.9,https://economictimes.indiatimes.com/news/economy/agriculture/india-likely-to-see-above-normal-rainfall-in-may-mixed-heat-trends-as-el-nino-signal-strengthens-imd/articleshow/130673722.cms,False,Other,negative,0.7,5.0,0.5,0.5,False,[],[],Weather,bearish,intraday,low,medium,Above-normal heatwaves could impact agricultural productivity.,,False,,1.0,-1,35.0,0.023,0.12,0.7,-0.01,Normal
"Govt plans to stick to budgeted capex, exit non-strategic areas",,ET_Economy,,2026-05-02 12:08:51 IST,22.4,https://economictimes.indiatimes.com/news/economy/finance/govt-to-continue-with-budgeted-capex-despite-fiscal-stress-due-to-global-uncertainties-official/articleshow/130673201.cms,False,Other,neutral,0.7,4.0,0.5,0.5,False,[],[],Policy,neutral,intraday,low,medium,Sticking to budgeted capex may indicate fiscal discipline.,,False,,1.0,0,0.0,0.021,0.08,0.7,-0.84,Normal
"India’s gross GST collections hit record Rs 2.42 lakh crore in April, up 8.7%",,ET_Economy,,2026-05-02 12:08:51 IST,24.5,https://economictimes.indiatimes.com/news/economy/finance/indias-gst-collections-rise-7-3-to-rs-2-11-lakh-crore-in-april/articleshow/130671358.cms,False,Other,positive,0.7,7.0,0.5,0.5,False,[],[],Economic,bullish,intraday,low,medium,Record GST collections reflect strong economic activity.,,False,,1.0,1,0.0,0.014,0.1,0.7,1.66,Shock
Rain check! A dry economic switch may add to Indians' war-led shocks,,ET_Economy,,2026-05-02 12:08:51 IST,24.6,https://economictimes.indiatimes.com/news/economy/indicators/india-inflation-outlook-weak-monsoon-2026-el-nino-impact-food-cpi-rbi-forecast-fy27-agriculture-growth-rural-demand-kharif-rainfall-impact/articleshow/130670848.cms,False,Other,negative,0.7,5.0,0.5,0.5,True,[],[],Geopolitical,bearish,intraday,low,medium,Economic shocks from war may impact consumer sentiment.,,False,,1.0,-1,52.5,0.014,0.07,0.7,-0.01,Normal
Fertiliser output steady despite West Asia crisis; govt secures 37 lac ton urea imports for kharif,,ET_Economy,,2026-05-02 12:08:51 IST,25.2,https://economictimes.indiatimes.com/news/economy/agriculture/fertiliser-output-steady-despite-west-asia-crisis-govt-secures-37-lac-ton-urea-imports-for-kharif/articleshow/130670841.cms,False,Manufacturing,positive,0.7,6.0,0.5,0.5,True,[],[],Supply,bullish,intraday,low,medium,Steady fertilizer output amid crisis ensures agricultural stability.,,False,,1.0,1,0.0,0.013,0.08,0.7,-0.48,Normal
US Trade Representative retains India on priority watch list on IPR; Vietnam faces toughest scrutiny,,ET_Economy,,2026-05-02 12:08:51 IST,25.8,https://economictimes.indiatimes.com/news/economy/foreign-trade/us-trade-representative-retains-india-on-priority-watch-list-on-ipr-vietnam-faces-toughest-scrutiny/articleshow/130670304.cms,False,Other,negative,0.7,6.0,0.5,0.5,True,[],[],Regulatory,bearish,intraday,low,medium,India's IPR status may affect foreign investment and trade.,,False,,1.0,-1,63.0,0.011,0.07,0.7,0.82,Watch
China's open-source AI models challenge US dominance as Europe grapples with Iran fallout: Report,,ET_Startups,,2026-05-02 12:08:51 IST,0.5,https://economictimes.indiatimes.com/tech/artificial-intelligence/chinas-open-source-ai-models-challenge-us-dominance-as-europe-grapples-with-iran-fallout-report/articleshow/130711163.cms,False,Other,neutral,0.7,5.0,0.5,0.5,True,[],[],Geopolitical,neutral,intraday,low,medium,China's AI advancements may shift global tech dynamics.,,False,,1.0,0,0.0,0.917,4.58,0.7,-0.01,Normal
India's data centre capacity likely to surge nearly six‑fold to 10.5 GW by FY31,,ET_Startups,,2026-05-02 12:08:51 IST,1.4,https://economictimes.indiatimes.com/tech/technology/indias-data-centre-capacity-likely-to-surge-nearly-sixfold-to-10-5-gw-by-fy31/articleshow/130710521.cms,False,IT,positive,0.7,7.0,0.5,0.5,False,[],[],Market,bullish,intraday,low,medium,Surge in data center capacity indicates strong growth in IT infrastructure.,,False,,1.0,1,0.0,0.785,5.5,0.7,0.0,Normal
Meta acquires robotics company Assured Robot Intelligence to help build humanoid technology,,ET_Startups,,2026-05-02 12:08:51 IST,3.8,https://economictimes.indiatimes.com/tech/artificial-intelligence/meta-acquires-robotics-company-assured-robot-intelligence-to-help-build-humanoid-technology/articleshow/130708991.cms,False,Other,positive,0.7,6.0,0.5,0.5,False,[],[],Acquisition,bullish,intraday,low,medium,Meta's acquisition could enhance its technological capabilities.,,False,,1.0,1,0.0,0.518,3.11,0.7,0.82,Watch
Coinbase says deal reached on key provision of crypto bill,,ET_Startups,,2026-05-02 12:08:51 IST,4.4,https://economictimes.indiatimes.com/tech/technology/coinbase-says-deal-reached-on-key-provision-of-crypto-bill/articleshow/130708680.cms,False,Fintech,positive,0.7,6.0,0.5,0.5,False,[],[],Regulatory,bullish,intraday,low,medium,Coinbase's deal on crypto bill provision may boost market confidence.,,False,,1.0,1,0.0,0.467,2.8,0.7,0.5,Normal
