title,description,source,source_url,published,hours_old,url,is_govt_source,sector,sentiment,sentiment_confidence,impact_score,valence,arousal,geopolitical_risk,affected_companies,second_order_beneficiaries,catalyst_type,price_direction,time_horizon,conviction,macro_sensitivity,one_line_insight,signal_reason,contrarian_flag,contrarian_reason,sentiment_num,weighted_risk_score,signal_decay,recency_weighted_impact,catalyst_weight,z_score,shock_status
"'India's economy will double every 7-8 years,' says Union Minister Gajendra Singh Shekhawat","India's economy is set for significant growth, aiming for 30 trillion dollars by 2047.  However, ongoing global conflicts pose risks.  These tensions could reduce India's economic expansion by one percent and increase inflation by 1.5 percent.  The nation's reliance on imported energy makes it vulnerable to these disruptions.  Despite these challenges, India's economy shows strong momentum.",ET Economy,https://economictimes.indiatimes.com/economy/rssfeeds/1373380680.cms,2026-03-31 14:24:12 IST,27.0,https://economictimes.indiatimes.com/news/economy/indicators/indias-economy-will-double-every-7-8-years-says-union-minister-gajendra-singh-shekhawat/articleshow/129920916.cms,False,Other,positive,0.75,7,0.6,0.5,True,"['Reliance Industries', 'ONGC', 'Tata Power', 'Adani Green Energy']","['L&T', 'Siemens', 'BHEL', 'NTPC']",policy_change,bullish,positional_weeks,medium,high,India's ambitious economic growth targets present opportunities despite geopolitical risks.,"The government's focus on economic growth and infrastructure development can benefit energy and manufacturing sectors, although global tensions pose risks.",False,,1,0.0,0.895,6.26,1.6,-0.15,Normal
Bajaj Finserv leads Rs 80 crore funding in NowPurchase,"The round also saw participation from individual investors and family offices, including Shikhar Raj of the venture capital firm S Four Capital, the Real Ispat Group, Madhur Gupta of Lloyds Metals and Energy, VC Grid, and Kartik Hosanagar, cofounder of Bodhium Labs.",ET Startups,https://economictimes.indiatimes.com/small-biz/startups/rssfeeds/13357270.cms,2026-04-01 16:12:10 IST,1.2,https://economictimes.indiatimes.com/tech/technology/bajaj-finserv-leads-rs-80-crore-funding-in-nowpurchase/articleshow/129949255.cms,False,Fintech,positive,0.85,7,0.8,0.6,False,"['Bajaj Finserv', 'NowPurchase', 'Lloyds Metals and Energy', 'S Four Capital']","['Bodhium Labs', 'Real Ispat Group', 'VC Grid', 'individual investors']",funding,bullish,swing_2_5days,medium,medium,Bajaj Finserv's investment in NowPurchase signals confidence in the fintech sector's growth potential.,The funding round indicates strong investor interest and potential for innovation in the fintech space.,False,,1,0.0,0.983,6.88,0.7,-0.15,Normal
"New I-T law, higher securities transaction tax on F&amp;O trade to kick in from April 1","New tax laws and budgetary provisions, including higher STT on F&amp;O trades and lower TCS on overseas tour packages and LRS remittances for medical/education, take effect April 1. A 20-year tax holiday for data centre services and new safe harbour rules for software firms also commence with the 2026-27 fiscal year.",ET Economy,https://economictimes.indiatimes.com/economy/rssfeeds/1373380680.cms,2026-03-31 12:35:03 IST,28.9,https://economictimes.indiatimes.com/news/economy/policy/new-i-t-law-higher-securities-transaction-tax-on-fo-trade-to-kick-in-from-april-1/articleshow/129918816.cms,False,Fintech,negative,0.75,7,0.2,0.4,False,"['Zerodha', 'Upstox', 'ICICI Securities', 'HDFC Securities']","['Tata Consultancy Services', 'Infosys', 'Wipro', 'HCL Technologies']",policy_change,bearish,swing_2_5days,medium,high,The introduction of higher securities transaction tax on F&O trades may dampen trading volumes and profitability for brokerage firms.,"Higher transaction costs could lead to reduced trading activity, negatively impacting brokerage revenues and market liquidity.",False,,-1,84.0,0.659,4.61,1.6,-0.15,Normal
Iran war shock: Middle East conflict could cut 1 ppt from India’s FY27 GDP outlook,"Iran War: A persistent Middle East conflict could reduce India's real GDP growth by 1 percentage point and increase retail inflation by 1.5 percentage points from baseline estimates. This impact stems from disruptions to global oil and energy markets, affecting employment-intensive sectors and aggregate demand. The government may need to implement countercyclical policies and augment the Economic Stabilization Fund.",ET Economy,https://economictimes.indiatimes.com/economy/rssfeeds/1373380680.cms,2026-03-31 13:49:31 IST,27.6,https://economictimes.indiatimes.com/news/economy/indicators/iran-war-shock-middle-east-conflict-could-cut-1-ppt-from-indias-fy27-gdp-outlook/articleshow/129920336.cms,False,Energy,negative,0.85,8,0.2,0.7,True,"['Reliance Industries', 'ONGC', 'Indian Oil', 'Bharat Petroleum']","['Hindustan Petroleum', 'GAIL', 'Tata Power', 'Adani Green Energy']",global_event,bearish,positional_weeks,high,high,"The ongoing Middle East conflict poses significant risks to India's GDP and inflation, particularly impacting the energy sector.",Disruptions in global oil markets due to the conflict are likely to lead to increased costs and reduced economic growth in India.,False,,-1,100.0,0.892,7.14,0.9,1.09,Shock
Data centre segment may attract investment commitment of $54 billion this year: CBRE,"Real estate consultant CBRE released a report 'India Alternate Sectors Outlook 2026', stating that India's total data centre stock across major cities is projected to increase by 30% year-on-year in 2026 with an estimated 500 MW of new supply addition.",ET Startups,https://economictimes.indiatimes.com/small-biz/startups/rssfeeds/13357270.cms,2026-04-01 15:09:30 IST,2.3,https://economictimes.indiatimes.com/tech/technology/data-centre-segment-may-attract-investment-commitment-of-54-billion-this-year-cbre/articleshow/129947561.cms,False,Other,positive,0.85,8,0.7,0.6,False,"['Digital Realty', 'Equinix', 'NVIDIA', 'Amazon']","['Telecom Providers', 'Cloud Service Providers', 'Construction Firms', 'Energy Suppliers']",capex_announcement,bullish,positional_weeks,high,medium,The projected $54 billion investment in data centers signals robust growth in India's tech infrastructure.,"The significant investment commitment indicates strong demand for data centers, driven by increasing digitalization and cloud services.",False,,1,0.0,0.991,7.93,1.4,1.09,Shock
Advocacy groups urge YouTube to protect kids from 'AI slop' videos,"Advocacy groups and experts are condemning YouTube for serving low-quality AI-generated videos to children, warning of developmental harm. A letter to YouTube's CEOs calls for clear labeling of AI content and a ban on such videos on YouTube Kids, citing concerns about distorted reality and hijacked attention.",ET Startups,https://economictimes.indiatimes.com/small-biz/startups/rssfeeds/13357270.cms,2026-04-01 16:06:50 IST,1.3,https://economictimes.indiatimes.com/tech/artificial-intelligence/advocacy-groups-urge-youtube-to-protect-kids-from-ai-slop-videos/articleshow/129949048.cms,False,IT,negative,0.85,7,0.2,0.6,False,"['YouTube', 'Google', 'Meta', 'Netflix']","['Child Development Organizations', 'Educational Content Creators', 'Parental Control Software', 'Mental Health Apps']",regulatory,bearish,swing_2_5days,medium,medium,Increased scrutiny on AI content for children may lead to regulatory changes impacting YouTube's ad revenue.,"The advocacy group's letter indicates potential regulatory pressure on YouTube, which could affect its business model and revenue streams.",False,,-1,84.0,0.981,6.87,1.1,-0.15,Normal
"ServiceNow names ex-SAP exec Kulmeet Bawa as India &amp; SAARC MD, GVP","He takes the helm from Ganesh Lakshminarayanan, who has moved to Tata Communications. Lakshminarayanan had joined the firm as the India and SAARC head in January 2025.",ET Startups,https://economictimes.indiatimes.com/small-biz/startups/rssfeeds/13357270.cms,2026-04-01 15:02:25 IST,2.4,https://economictimes.indiatimes.com/tech/technology/servicenow-names-ex-sap-exec-kulmeet-bawa-as-india-saarc-md-gvp/articleshow/129947448.cms,False,IT,positive,0.75,7,0.6,0.5,False,"['ServiceNow', 'SAP', 'Tata Communications']","['Cloudflare', 'Salesforce', 'Microsoft', 'Oracle']",management_change,bullish,swing_2_5days,medium,medium,ServiceNow's leadership change could enhance its strategic direction in the Indian market.,The appointment of a seasoned executive from SAP may lead to improved operational strategies and market penetration.,False,,1,0.0,0.966,6.76,1.0,-0.15,Normal
"""Unfortunate for India,"" Ex R&amp;AW Chief hints at probable inflation if West Asia situation escalates","Former R&amp;AW Chief Vikram Sood expressed concern over the West Asia conflict's impact on India, particularly potential oil and fertilizer shortages leading to inflation. He called the attack on Iran and the killing of its Supreme Leader unfortunate, emphasizing India's dependence on the Strait of Hormuz while noting Israel as an ally.",ET Economy,https://economictimes.indiatimes.com/economy/rssfeeds/1373380680.cms,2026-03-31 10:54:59 IST,30.5,https://economictimes.indiatimes.com/news/economy/indicators/unfortunate-for-india-ex-raw-chief-hints-at-probable-inflation-if-west-asia-situation-escalates/articleshow/129916876.cms,False,Energy,negative,0.85,7,0.2,0.6,True,"['Indian Oil Corporation', 'Reliance Industries', 'Bharat Petroleum', 'Tata Chemicals']","['Adani Group', 'ONGC', 'GAIL', 'Hindustan Petroleum']",global_event,bearish,swing_2_5days,medium,high,Escalation in West Asia could lead to inflationary pressures in India due to oil and fertilizer shortages.,"The geopolitical tensions in West Asia directly affect oil prices, which are crucial for India's economy, leading to potential inflation.",False,,-1,100.0,0.644,4.51,0.9,-0.15,Normal
Chinese chipmakers claim nearly half of local market as Nvidia's lead shrinks,"The gains come as Beijing ‌grows increasingly ⁠cautious ⁠about dependence on foreign chips, pushing government agencies and companies to adopt domestic alternatives ​after successive waves of U.S. export controls cut China off from Nvidia's most advanced ​products.",ET Startups,https://economictimes.indiatimes.com/small-biz/startups/rssfeeds/13357270.cms,2026-04-01 15:01:07 IST,2.4,https://economictimes.indiatimes.com/tech/technology/chinese-chipmakers-claim-nearly-half-of-local-market-as-nvidias-lead-shrinks/articleshow/129947421.cms,False,IT,positive,0.75,8,0.6,0.5,True,"['Nvidia', 'Huawei', 'SMIC', 'ZTE']","['Qualcomm', 'Intel', 'AMD', 'Broadcom']",policy_change,bullish,positional_weeks,high,medium,Chinese chipmakers are gaining market share as government policies favor domestic production over foreign reliance.,The shift in government policy towards domestic chip production is likely to bolster local companies while challenging foreign competitors like Nvidia.,False,,1,0.0,0.99,7.92,1.6,1.09,Shock
"AI could eliminate middle management, warns Twitter cofounder Jack Dorsey","In a blog post titled ‘From Hierarchy to Intelligence’, co-written with Sequoia Capital partner Roelof Botha, he explains how AI could replace multiple management layers that usually coordinate work across teams.",ET Startups,https://economictimes.indiatimes.com/small-biz/startups/rssfeeds/13357270.cms,2026-04-01 16:23:20 IST,1.1,https://economictimes.indiatimes.com/tech/artificial-intelligence/ai-could-eliminate-middle-management-warns-twitter-cofounder-jack-dorsey/articleshow/129949677.cms,False,IT,negative,0.75,7,0.2,0.6,False,"['Twitter', 'Sequoia Capital', 'Microsoft', 'Google']","['AI startups', 'Consulting firms', 'HR tech companies', 'Training platforms']",global_event,bearish,swing_2_5days,medium,high,The warning about AI replacing middle management could lead to market concerns about job security and operational structures in tech firms.,The potential disruption in management structures due to AI could negatively impact investor sentiment towards companies reliant on traditional management hierarchies.,True,"While the headline suggests a negative outlook, it may also present opportunities for companies that adapt quickly to AI integration, potentially leading to increased efficiency and profitability.",-1,84.0,0.984,6.89,0.9,-0.15,Normal
VCs bagged nearly $2 billion from 2025 IPO exits: Bain-IVCA report,"IPO-led startup exits rose 30% to nearly $2 billion in 2025, driven by eight larger VC-backed listings. Fewer IPOs delivered higher value, with deals above $100 million dominating. IPO share of exit value increased, though total public market exits dipped amid volatility, even as overall VC-backed exits reached about $7 billion.",ET Startups,https://economictimes.indiatimes.com/small-biz/startups/rssfeeds/13357270.cms,2026-04-01 14:22:37 IST,3.1,https://economictimes.indiatimes.com/tech/technology/vcs-bagged-nearly-2-billion-from-2025-ipo-exits-bain-ivca-report/articleshow/129946644.cms,False,Startup,positive,0.85,7,0.6,0.7,False,"['Company A', 'Company B', 'Company C', 'Company D']","['Company E', 'Company F', 'Company G', 'Company H']",global_event,bullish,swing_2_5days,medium,medium,"The surge in IPO-led exits indicates a robust startup ecosystem, signaling potential growth for VC-backed companies.","The increase in IPO exits suggests a favorable environment for startups, which may attract more investment and drive valuations higher.",False,,1,0.0,0.956,6.69,0.9,-0.15,Normal
Microsoft on track to invest $5.5 billion in Singapore by 2029: WSJ,"Microsoft ​is ​on track to invest $5.5 ‌billion ⁠in ⁠cloud ​and artificial intelligence infrastructure ​in Singapore ​through ⁠2029, ‌the ​Wall ​Street Journal ⁠reported on Wednesday.",ET Startups,https://economictimes.indiatimes.com/small-biz/startups/rssfeeds/13357270.cms,2026-04-01 13:27:02 IST,4.0,https://economictimes.indiatimes.com/tech/technology/microsoft-on-track-to-invest-5-5-billion-in-singapore-by-2029-wsj/articleshow/129945576.cms,False,IT,positive,0.85,8,0.7,0.6,False,['Microsoft'],"['Amazon', 'Google', 'IBM', 'Salesforce']",capex_announcement,bullish,positional_weeks,high,medium,Microsoft's significant investment in Singapore signals strong growth potential in cloud and AI sectors.,"The investment indicates confidence in the Singapore market and a commitment to expanding cloud and AI capabilities, which could lead to increased market share and revenue growth.",False,,1,0.0,0.984,7.87,1.4,1.09,Shock
Lenovo appoints Sumir Bhatia chief commercial officer for Asia Pacific region,"Lenovo named Sumir Bhatia as the first chief commercial officer for Asia Pacific. He will head a new organisation combining enterprise sales, channels and alliances to boost growth. The move aligns full-stack AI and commercial capabilities, while leadership changes follow Ivan Cheung’s planned retirement and Benjamin Yeh’s appointment.",ET Startups,https://economictimes.indiatimes.com/small-biz/startups/rssfeeds/13357270.cms,2026-04-01 13:13:45 IST,4.2,https://economictimes.indiatimes.com/tech/technology/lenovo-appoints-sumir-bhatia-chief-commercial-officer-for-asia-pacific-region/articleshow/129945225.cms,False,IT,positive,0.85,7,0.8,0.6,False,['Lenovo'],"['Microsoft', 'NVIDIA', 'IBM', 'Salesforce']",management_change,bullish,swing_2_5days,medium,medium,"Lenovo's strategic leadership change aims to enhance growth in the Asia Pacific region, leveraging AI capabilities.","The appointment of a chief commercial officer indicates a strategic shift towards enhancing enterprise sales and AI integration, which could drive growth.",False,,1,0.0,0.941,6.59,1.0,-0.15,Normal
Swiggy’s investor relations head Abhishek Agarwal quits,"Agarwal, who joined the company in July 2023, played a key role in Swiggy’s Rs 11,327 crore initial public offering (IPO) in 2024. He was part of the filing process, including banker selection and negotiations, and post-IPO work, such as earnings calls and stock coverage.",ET Startups,https://economictimes.indiatimes.com/small-biz/startups/rssfeeds/13357270.cms,2026-04-01 14:19:05 IST,3.1,https://economictimes.indiatimes.com/tech/technology/swiggys-investor-relations-head-abhishek-agarwal-quits/articleshow/129946343.cms,False,Startup,negative,0.75,7,0.2,0.4,False,['Swiggy'],"['Zomato', 'Dunzo', 'Foodpanda', 'Uber Eats']",management_change,bearish,swing_2_5days,medium,medium,"The departure of a key executive may signal instability at Swiggy, impacting investor confidence.","Abhishek Agarwal's role was crucial in the IPO process, and his exit could lead to uncertainty in Swiggy's future performance and strategic direction.",False,,-1,63.0,0.956,6.69,1.0,-0.15,Normal
"Microsoft, Chevron and Engine No. 1 sign exclusive deal for power supply","Bloomberg News, which has reported ​the deal with Microsoft, said the long-term agreement is tied to a proposed natural gas-fired power plant in West Texas, with a projected cost of roughly $7 billion. The facility would initially generate 2,500 ‌megawatts of electricity, intended to power a large data centre campus, Bloomberg said.",ET Startups,https://economictimes.indiatimes.com/small-biz/startups/rssfeeds/13357270.cms,2026-04-01 13:02:07 IST,4.4,https://economictimes.indiatimes.com/tech/technology/microsoft-chevron-and-engine-no-1-sign-exclusive-deal-for-power-supply/articleshow/129945056.cms,False,Energy,positive,0.85,8,0.7,0.6,False,"['Microsoft', 'Chevron', 'Engine No. 1']","['General Electric', 'Siemens', 'NextEra Energy', 'Duke Energy']",capex_announcement,bullish,positional_weeks,high,medium,The exclusive deal between Microsoft and Chevron for a natural gas power plant signals strong growth potential in energy and tech sectors.,"The long-term agreement indicates a significant investment in energy infrastructure, which could lead to increased demand for related companies and technologies.",False,,1,0.0,0.982,7.86,1.4,1.09,Shock
Ola Electric sees sales rebound in March but trails peers; lifetime sales cross 1 million mark,"This demand recovery is being driven by a structural transformation in service operations. Over 80 per cent of vehicles are now serviced on the same day, enabled by improved parts availability, faster diagnostics, and tighter operational control across the network, it said.",ET Startups,https://economictimes.indiatimes.com/small-biz/startups/rssfeeds/13357270.cms,2026-04-01 12:33:29 IST,4.9,https://economictimes.indiatimes.com/tech/technology/ola-electric-surges-back-in-march-as-daily-orders-cross-1000-units-registrations-more-than-double/articleshow/129944472.cms,False,Manufacturing,positive,0.85,7,0.6,0.5,False,"['Ola Electric', 'Tata Motors', 'Mahindra Electric', 'Ather Energy']","['Battery Manufacturers', 'Charging Infrastructure Providers', 'Auto Parts Suppliers', 'Logistics Companies']",sector_tailwind,bullish,swing_2_5days,medium,medium,"Ola Electric's sales rebound indicates a positive trend in the EV sector, driven by operational improvements.",The structural transformation in service operations and improved vehicle servicing times suggest a strong recovery and growth potential for Ola Electric.,False,,1,0.0,0.932,6.52,1.2,-0.15,Normal
Rediff files confidential IPO papers; eyes Rs 600-800 crore fundraise,"The proposed initial public offering could raise between Rs 600 crore and Rs 800 crore, although the final size will depend on market conditions and regulatory approvals. The move comes amid a broader strategic repositioning of Rediff from a legacy internet portal to an AI-led digital platform.",ET Startups,https://economictimes.indiatimes.com/small-biz/startups/rssfeeds/13357270.cms,2026-04-01 11:59:37 IST,5.4,https://economictimes.indiatimes.com/tech/technology/rediff-files-confidential-ipo-papers-eyes-rs-600-800-crore-fundraise/articleshow/129943708.cms,False,IT,positive,0.8,7,0.6,0.5,False,['Rediff'],"['Zomato', 'Paytm', 'Info Edge', 'Nykaa']",ipo_announcement,bullish,swing_2_5days,medium,medium,"Rediff's IPO filing signals a strategic shift towards AI, potentially attracting investor interest.","The transition from a legacy internet portal to an AI-led platform may enhance growth prospects, making the IPO appealing.",False,,1,0.0,0.925,6.48,0.7,-0.15,Normal
FirstCry subsidiary Globalbees increases stake in appliances brand Candes to 92%,"Brainbees Solutions’ subsidiary, Globalbees Brands, has raised its stake in Candes Technology from 62% to 92% by buying an additional 30% for Rs 37,250 per share. The deal was completed on March 31, 2026. Brainbees saw Q3 FY26 losses rise to Rs 38 crore amid higher expenses.",ET Startups,https://economictimes.indiatimes.com/small-biz/startups/rssfeeds/13357270.cms,2026-04-01 11:42:09 IST,5.7,https://economictimes.indiatimes.com/tech/technology/firstcry-subsidiary-globalbees-increases-stake-in-appliances-brand-candes-to-92/articleshow/129943182.cms,False,Retail,neutral,0.6,5,0.5,0.4,False,"['Brainbees Solutions', 'Globalbees Brands', 'Candes Technology']","['appliance manufacturers', 'retail technology firms', 'logistics companies', 'e-commerce platforms']",management_change,neutral,swing_2_5days,medium,medium,Globalbees' increased stake in Candes indicates a strategic consolidation in the appliance sector despite recent losses.,"The increase in stake suggests confidence in Candes' long-term potential, although recent losses at Brainbees may temper immediate investor enthusiasm.",False,,0,0.0,0.921,4.61,1.0,-2.63,Normal
"Baidu robotaxi outage in Wuhan caused by 'system failure', police say","At least 100 Apollo Go vehicles were affected, a traffic police officer said in a ​video published by Shanghai-based news outlet The ⁠Paper. The ‌officer added that while the car doors could ​be opened, ​some passengers were hesitant to get out because ⁠of heavy traffic and called police for assistance.",ET Startups,https://economictimes.indiatimes.com/small-biz/startups/rssfeeds/13357270.cms,2026-04-01 11:07:02 IST,6.3,https://economictimes.indiatimes.com/tech/technology/baidu-robotaxi-outage-in-wuhan-caused-by-system-failure-police-say/articleshow/129942611.cms,False,IT,negative,0.85,7,0.2,0.6,False,['Baidu'],"['Didi', 'Tesla', 'NIO', 'Xpeng']",global_event,bearish,swing_2_5days,medium,medium,Baidu's robotaxi system failure raises concerns about the reliability of autonomous vehicles in urban settings.,"The incident highlights potential operational risks and public safety concerns, which could impact Baidu's reputation and stock performance.",False,,-1,84.0,0.913,6.39,0.9,-0.15,Normal
TSMC plans 3-nanometre chip production launch in Japan in 2028,"In ⁠February, ⁠TSMC CEO CC Wei said the company plans to ​mass-produce advanced 3-nanometre chips at its second fabrication plant in ​Japan, during a meeting with Japan's Prime Minister Sanae Takaichi. Under the revised plan, its second chip-making ​plant in Japan will have a ⁠monthly production ‌capacity of 15,000 12-inch wafers through advanced ​3-nanometre ​process technology, the filing said on Tuesday.",ET Startups,https://economictimes.indiatimes.com/small-biz/startups/rssfeeds/13357270.cms,2026-04-01 08:46:51 IST,8.7,https://economictimes.indiatimes.com/tech/technology/tsmc-plans-3-nanometre-chip-production-launch-in-japan-in-2028/articleshow/129940385.cms,False,IT,positive,0.85,8,0.7,0.6,False,"['TSMC', 'Intel', 'Samsung', 'NVIDIA']","['ASML', 'Applied Materials', 'Lam Research', 'KLA Corporation']",capex_announcement,bullish,positional_weeks,high,medium,TSMC's investment in Japan for advanced chip production signals strong growth potential in the semiconductor sector.,"The planned production of 3-nanometre chips indicates TSMC's commitment to innovation and capacity expansion, which is likely to enhance its market position and profitability.",False,,1,0.0,0.965,7.72,1.4,1.09,Shock
Anthropic accidentally releases source code for Claude AI agent,"Anthropic said a Claude Code release accidentally included internal source code due to human error, not a breach. No customer data was exposed. The slip-up, following another recent issue, sparked developer interest and security concerns, as people examined details and clues about plans, including references to a powerful upcoming model.",ET Startups,https://economictimes.indiatimes.com/small-biz/startups/rssfeeds/13357270.cms,2026-04-01 08:39:00 IST,8.8,https://economictimes.indiatimes.com/tech/artificial-intelligence/anthropic-accidentally-releases-source-code-for-claude-ai-agent/articleshow/129940277.cms,False,IT,neutral,0.7,6,0.5,0.4,False,"['Anthropic', 'OpenAI', 'Google', 'Microsoft']","['NVIDIA', 'Amazon', 'IBM', 'Salesforce']",other,neutral,swing_2_5days,medium,medium,The accidental release of Claude AI's source code may lead to increased scrutiny and innovation in AI development.,"The incident has sparked developer interest and raised security concerns, indicating potential shifts in the competitive landscape of AI.",False,,0,0.0,0.881,5.29,0.7,-1.39,Normal
