title,description,source,source_url,published,hours_old,url,is_govt_source,sector,sentiment,sentiment_confidence,impact_score,valence,arousal,geopolitical_risk,affected_companies,second_order_beneficiaries,catalyst_type,price_direction,time_horizon,conviction,macro_sensitivity,one_line_insight,signal_reason,contrarian_flag,contrarian_reason,sentiment_num,weighted_risk_score,signal_decay,recency_weighted_impact,catalyst_weight,z_score,shock_status
NITI Aayog proposes National Job Skilling Policy to strengthen India’s skilling ecosystem,"A working paper, titled Education and Skilling for Employment: From Credentials to Learning Outcome authored by NITI Aayog member Arvind Virmani, said India’s education and skilling landscape faces challenges such as raising the minimum learning outcomes to the benchmarks appropriate for the per capita GDP levels which we are aiming to reach by 2047 and lowering the drop out rates of students between primary and secondary education.",ET Economy,https://economictimes.indiatimes.com/economy/rssfeeds/1373380680.cms,2026-03-20 13:37:17 IST,13.0,https://economictimes.indiatimes.com/news/economy/policy/niti-aayog-proposes-national-job-skilling-policy-to-strengthen-indias-skilling-ecosystem/articleshow/129695533.cms,False,Other,positive,0.8,7,0.6,0.5,False,[],"['EdTech companies', 'Vocational training institutes', 'Skill development NGOs', 'Corporate training providers']",policy_change,bullish,positional_weeks,medium,medium,"The proposed National Job Skilling Policy is likely to enhance the skill development sector, benefiting EdTech and vocational training providers.","The policy aims to address critical challenges in India's education and skilling landscape, which could lead to increased demand for skill development services.",False,,1,0.0,0.948,6.64,1.6,-0.02,Normal
"'Trade flows are returning to India, but markets remain unintegrated': Glazyev calls for Russia-India financial integration",Russia and India are building a strategic alliance. Russian officials are calling for greater integration in capital markets and payment systems. They want to move away from the US dollar. Digital currencies are seen as crucial for immediate and low-cost transactions. Direct linkage between Indian and Moscow exchanges is also needed.,ET Economy,https://economictimes.indiatimes.com/economy/rssfeeds/1373380680.cms,2026-03-20 12:04:32 IST,14.6,https://economictimes.indiatimes.com/news/economy/foreign-trade/trade-flows-are-returning-to-india-but-markets-remain-unintegrated-glazyev-calls-for-russia-india-financial-integration/articleshow/129694023.cms,False,Fintech,positive,0.75,7,0.6,0.5,True,"['HDFC Bank', 'ICICI Bank', 'Paytm', 'TCS']","['Wipro', 'Infosys', 'Zomato', 'Ola']",policy_change,bullish,swing_2_5days,medium,high,Increased financial integration between Russia and India could boost fintech opportunities and reduce reliance on the US dollar.,The push for digital currencies and direct exchange linkages indicates a shift in capital flows that could benefit Indian fintech companies.,False,,1,0.0,0.81,5.67,1.6,-0.02,Normal
"CBDT notifies new Income Tax rules; HRA benefits enhanced, disclosures tightened","New Income-tax Rules for 2026 are now in effect. These rules will bring the Income-tax Act of 2025 to life starting April 1, 2026. Compliance will be stricter in areas like capital gains and non-resident taxation. Valuation and disclosure rules are clearer. Reporting for financial instruments will be enhanced.",ET Economy,https://economictimes.indiatimes.com/economy/rssfeeds/1373380680.cms,2026-03-20 12:32:25 IST,14.1,https://economictimes.indiatimes.com/news/economy/policy/india-notifies-income-tax-rules-2026-whats-in-it/articleshow/129694515.cms,False,Other,neutral,0.7,6,0.5,0.4,False,"['HDFC Bank', 'ICICI Bank', 'Tata Consultancy Services', 'Infosys']","['Tax Consultants', 'Compliance Software Firms', 'Financial Advisory Services', 'Legal Firms']",policy_change,neutral,positional_weeks,medium,medium,The new Income Tax rules may lead to increased compliance costs for companies but could benefit tax advisory services.,Stricter compliance and clearer reporting requirements may create demand for financial and legal advisory services.,False,,0,0.0,0.943,5.66,1.6,-1.38,Normal
"Israel, GCC trade pact talks lose steam, UK FTA likely to be implemented by May","A free trade agreement with the UK, signed in July 2025, is expected to be implemented by early May, with officials resolving minor issues. The EU anticipates ratifying its trade pact with India by November for implementation this year.",ET Economy,https://economictimes.indiatimes.com/economy/rssfeeds/1373380680.cms,2026-03-20 00:47:56 IST,25.8,https://economictimes.indiatimes.com/news/economy/foreign-trade/israel-gcc-trade-pact-talks-lose-steam-uk-fta-likely-to-be-implemented-by-may/articleshow/129686871.cms,False,Other,neutral,0.6,5,0.5,0.3,True,"['Unilever', 'Diageo', 'AstraZeneca', 'BP']","['Logistics firms', 'Trade finance companies', 'Exporters', 'Importers']",policy_change,neutral,swing_2_5days,medium,medium,The implementation of the UK FTA may provide opportunities for UK-based companies while geopolitical tensions could impact trade dynamics.,"The trade agreement with the UK is a positive development, but the stalled talks with Israel and GCC introduce uncertainty.",False,,0,0.0,0.689,3.44,1.6,-2.74,Normal
Agro insolvencies see surge in deal activity,"Investors are actively acquiring struggling agro businesses. These deals offer processing facilities, supply chains, and licenses at significant discounts. Companies in poultry, rice milling, and ethanol manufacturing are changing hands. Multiple bids signal strong interest in the agricultural sector. This trend highlights opportunities within India's food and agribusiness landscape.",ET Economy,https://economictimes.indiatimes.com/economy/rssfeeds/1373380680.cms,2026-03-20 00:15:04 IST,26.4,https://economictimes.indiatimes.com/news/economy/agriculture/agro-insolvencies-see-surge-in-deal-activity/articleshow/129686201.cms,False,Other,positive,0.85,7,0.6,0.7,False,"['Company A (Poultry)', 'Company B (Rice Milling)', 'Company C (Ethanol Manufacturing)', 'Company D (Agro Processing)']","['Logistics Firms', 'Packaging Companies', 'Retailers', 'Food Technology Startups']",sector_tailwind,bullish,swing_2_5days,medium,medium,"Surge in agro insolvencies presents unique acquisition opportunities, signaling a bullish trend in the agricultural sector.","Increased deal activity indicates strong investor interest and potential for growth in the agricultural sector, particularly in processing and supply chain.",False,,1,0.0,0.683,4.78,1.2,-0.02,Normal
India rolls out ₹497 crore RELIEF scheme to support exporters amid West Asia conflict,"In a bold move to sustain international trade, India has unveiled a robust export support initiative with a budget of ₹497 crore. This program is strategically designed to safeguard Indian shipments adversely impacted by the turmoil in West Asia. Under the RELIEF scheme, exporters will benefit from improved insurance and logistics services, extending support to about 17 countries.",ET Economy,https://economictimes.indiatimes.com/economy/rssfeeds/1373380680.cms,2026-03-20 00:28:32 IST,26.2,https://economictimes.indiatimes.com/news/economy/foreign-trade/india-rolls-out-497-crore-relief-scheme-to-support-exporters-amid-west-asia-conflict/articleshow/129686392.cms,False,Other,positive,0.85,8,0.7,0.6,True,"['Tata Steel', 'Mahindra Logistics', 'Adani Ports', 'Hindustan Aeronautics']","['Shipping Companies', 'Insurance Providers', 'Logistics Firms', 'Export-Import Banks']",government_contract,bullish,swing_2_5days,medium,medium,"India's ₹497 crore RELIEF scheme is poised to bolster exporters, enhancing trade resilience amid geopolitical tensions.","The initiative aims to mitigate the adverse effects of the West Asia conflict on Indian exports, indicating government support for trade.",False,,1,0.0,0.685,5.48,1.7,1.34,Shock
"Meta, Alphabet join credit-risk index as AI hedging demand soars","Hyperscalers are tapping global debt markets at a record pace to fund artificial intelligence infrastructure. That’s helped fuel a surge of interest in derivatives. The swaps tied to single companies didn’t exist for many high-grade technology heavyweights a year ago. But they’re now some of the most actively traded US derivatives contracts outside of the financial sector, according to Depository Trust &amp; Clearing Corp.",ET Startups,https://economictimes.indiatimes.com/small-biz/startups/rssfeeds/13357270.cms,2026-03-21 00:22:08 IST,2.3,https://economictimes.indiatimes.com/tech/artificial-intelligence/meta-alphabet-join-credit-risk-index-as-ai-hedging-demand-soars/articleshow/129707866.cms,False,IT,positive,0.85,8,0.7,0.6,False,"['Meta', 'Alphabet']","['NVIDIA', 'Microsoft', 'Amazon', 'IBM']",sector_tailwind,bullish,positional_weeks,high,medium,"The surge in AI infrastructure funding is driving demand for credit-risk derivatives, benefiting major tech players.","The entry of Meta and Alphabet into the credit-risk index indicates strong market confidence in AI investments, leading to increased trading activity in derivatives.",False,,1,0.0,0.991,7.93,1.2,1.34,Shock
"Nvidia's $20 billion Groq deal queried by senators Elizabeth Warren, Richard Blumenthal","Two Democratic senators are probing Nvidia Corp.’s $20 billion licensing deal with AI startup Groq over possible antitrust concerns. Elizabeth Warren and Richard Blumenthal said the deal may have been structured to avoid merger review, warning it could stifle competition and further strengthen Nvidia’s dominance in AI computing.",ET Startups,https://economictimes.indiatimes.com/small-biz/startups/rssfeeds/13357270.cms,2026-03-20 22:21:11 IST,4.3,https://economictimes.indiatimes.com/tech/technology/nvidias-20-billion-groq-deal-queried-by-elizabeth-warren-richard-blumenthal/articleshow/129705446.cms,False,IT,negative,0.85,7,0.2,0.6,False,"['Nvidia', 'Groq']","['AMD', 'Intel', 'Google', 'Microsoft']",regulatory,bearish,swing_2_5days,medium,medium,"Nvidia's licensing deal faces scrutiny, potentially impacting its market position and investor sentiment.",The involvement of prominent senators raises concerns about regulatory actions that could affect Nvidia's growth and competitive landscape.,True,"While the immediate sentiment is negative, Nvidia's strong market position and growth in AI may provide long-term resilience.",-1,84.0,0.94,6.58,1.1,-0.02,Normal
UK aerospace company wins lawsuit against ex-CEO who lobbied against Chinese investment deal,"Gardner said Upton contacted politicians ​and encouraged them to pressure the British ⁠government to ""call in"" ‌the deal and impose onerous conditions, to try ​and ​keep his job under a different potential owner. But Judge Richard Smith ruled on Friday that Upton had breached his duties as ‌a director of Gardner by taking steps that ""he knew would undermine the transaction,"" including sending emails to lawmakers ​to oppose ​the deal.",ET Startups,https://economictimes.indiatimes.com/small-biz/startups/rssfeeds/13357270.cms,2026-03-20 23:04:19 IST,3.6,https://economictimes.indiatimes.com/tech/technology/uk-aerospace-company-wins-lawsuit-against-ex-ceo-who-lobbied-against-chinese-investment-deal/articleshow/129706180.cms,False,Manufacturing,positive,0.85,7,0.6,0.5,True,['Gardner Aerospace'],"['BAE Systems', 'Rolls-Royce', 'Airbus', 'Thales Group']",regulatory,bullish,swing_2_5days,medium,medium,The ruling against the ex-CEO may stabilize Gardner Aerospace's operations and enhance investor confidence.,"The court's decision reinforces corporate governance and may deter future lobbying against strategic deals, positively impacting Gardner's market position.",False,,1,0.0,0.949,6.64,1.1,-0.02,Normal
"Philippe Laffont’s $70 billion Coatue looks to launch new AI, tech fund","Philippe Laffont’s $70 billion Coatue Management is gearing up to launch a new fund to wager on public and private artificial intelligence and tech innovation companies, a sign the firm is rethinking its long-only investing strategy as more startups stay private for longer.",ET Startups,https://economictimes.indiatimes.com/small-biz/startups/rssfeeds/13357270.cms,2026-03-20 22:03:33 IST,4.6,https://economictimes.indiatimes.com/tech/funding/philippe-laffonts-70-billion-coatue-looks-to-launch-new-ai-tech-fund/articleshow/129705114.cms,False,Startup,positive,0.85,8,0.7,0.6,False,"['NVIDIA', 'Palantir', 'Snowflake', 'UiPath']","['Microsoft', 'Amazon', 'Google', 'IBM']",other,bullish,positional_weeks,high,medium,"Coatue's new fund launch signals strong investor confidence in AI and tech sectors, potentially boosting valuations.","The shift towards investing in AI and tech innovation indicates a growing market trend, which could lead to increased capital inflow into these sectors.",False,,1,0.0,0.981,7.85,0.7,1.34,Shock
"TVS Capital invests Rs 500 crore in Neo Group at Rs 10,000 crore valuation",This is TVS Capital’s first bet in the wealth management space. The Mumbai-based wealth and asset management company will use the new funds to accelerate its growth and deliver specialised solutions to its clients. The company manages about Rs 1 lakh crore in client assets.,ET Startups,https://economictimes.indiatimes.com/small-biz/startups/rssfeeds/13357270.cms,2026-03-20 21:30:28 IST,5.1,https://economictimes.indiatimes.com/tech/technology/tvs-capital-invests-rs-500-crore-in-neo-group-at-rs-10000-crore-valuation/articleshow/129704482.cms,False,Fintech,positive,0.85,7,0.8,0.6,False,"['TVS Capital', 'Neo Group']","['HDFC Asset Management', 'ICICI Prudential', 'SBI Mutual Fund', 'Axis Mutual Fund']",investment,bullish,positional_weeks,medium,medium,TVS Capital's investment in Neo Group signals confidence in the growing wealth management sector.,"The investment indicates a strategic move into wealth management, which is expected to grow significantly in the coming years.",False,,1,0.0,0.979,6.85,0.7,-0.02,Normal
"Zetwerk plans to confidentially file for Indian IPO, targets $4 billion valuation",Indian contract electronics manufacturer Zetwerk is gearing up for its initial public offering. The company plans to confidentially file draft papers within two weeks. Zetwerk aims to raise up to $550 million at a valuation of approximately $4 billion. The IPO includes fresh equity and an offer for sale. The company is targeting a listing later this year.,ET Startups,https://economictimes.indiatimes.com/small-biz/startups/rssfeeds/13357270.cms,2026-03-20 20:48:59 IST,5.8,https://economictimes.indiatimes.com/tech/startups/zetwerk-plans-to-confidentially-file-for-indian-ipo-targets-4-billion-valuation-report/articleshow/129703905.cms,False,Startup,positive,0.85,8,0.7,0.6,False,['Zetwerk'],"['Tata Electronics', 'Wipro', 'Infosys', 'L&T']",other,bullish,positional_weeks,high,medium,"Zetwerk's IPO plans signal strong growth potential in the Indian startup ecosystem, attracting investor interest.",The planned IPO and significant valuation indicate robust market confidence and growth prospects for Zetwerk and the broader sector.,False,,1,0.0,0.976,7.81,0.7,1.34,Shock
xAI sends engineers to client sites to win business from OpenAI,"The hands-on approach helped xAI land payments company Shift4 Payments, which now plans to phase out OpenAI’s ChatGPT in favor of xAI’s Grok after the on-site work, Shift4 Chief Executive Officer Taylor Lauber said in an interview.",ET Startups,https://economictimes.indiatimes.com/small-biz/startups/rssfeeds/13357270.cms,2026-03-20 21:20:52 IST,5.3,https://economictimes.indiatimes.com/tech/technology/xai-sends-engineers-to-client-sites-to-win-business-from-openai/articleshow/129704483.cms,False,IT,positive,0.85,8,0.7,0.6,False,"['xAI', 'Shift4 Payments', 'OpenAI']","['NVIDIA', 'Microsoft', 'Amazon']",management_change,bullish,swing_2_5days,high,medium,"xAI's strategic on-site engagement is positioning it as a strong competitor to OpenAI, potentially reshaping client preferences in AI solutions.","The successful acquisition of Shift4 Payments as a client indicates a shift in market dynamics favoring xAI's offerings over OpenAI's, suggesting a positive trend for xAI's growth.",False,,1,0.0,0.926,7.41,1.0,1.34,Shock
Trump releases AI policy for Congress to pre-empt state rules,The White House has unveiled a new artificial intelligence policy. This plan aims to create a single national framework for AI regulation. It seeks to prevent varied state laws and ensure consistent rules across the country. The policy also focuses on protecting children online and managing energy costs associated with AI.,ET Startups,https://economictimes.indiatimes.com/small-biz/startups/rssfeeds/13357270.cms,2026-03-20 20:19:36 IST,6.3,https://economictimes.indiatimes.com/tech/artificial-intelligence/trump-releases-ai-policy-to-pre-empt-state-rules/articleshow/129703461.cms,False,IT,positive,0.8,7,0.6,0.5,False,"['NVIDIA', 'Microsoft', 'Google', 'IBM']","['Cloudflare', 'Salesforce', 'Palantir', 'Adobe']",policy_change,bullish,positional_weeks,medium,medium,"The new AI policy could streamline regulations, benefiting major tech firms and fostering innovation.",A unified national framework for AI regulation may reduce compliance costs and enhance market opportunities for tech companies.,False,,1,0.0,0.974,6.82,1.6,-0.02,Normal
Microsoft launches MAI-Image-2: here's all you need to know,"Microsoft has unveiled MAI-Image-2, its new text-to-image AI model. This tool aims to boost creative workflows with enhanced photorealism and accurate text generation.  It promises natural lighting and detailed scenes, reducing post-production needs.  MAI-Image-2 is now available for preview and will soon be integrated into Copilot and Bing Image Creator.",ET Startups,https://economictimes.indiatimes.com/small-biz/startups/rssfeeds/13357270.cms,2026-03-20 20:36:49 IST,6.0,https://economictimes.indiatimes.com/tech/internet/microsoft-launches-mai-image-2-heres-all-you-need-to-know/articleshow/129703733.cms,False,IT,positive,0.85,8,0.7,0.6,False,['Microsoft'],"['Adobe', 'NVIDIA', 'Autodesk', 'Canva']",product_launch,bullish,positional_weeks,high,medium,"Microsoft's launch of MAI-Image-2 positions it strongly in the AI-driven creative tools market, enhancing its competitive edge.","The introduction of MAI-Image-2 is expected to significantly improve creative workflows, which could lead to increased adoption of Microsoft's AI tools and services.",False,,1,0.0,0.976,7.81,0.7,1.34,Shock
Germany to crack down on sexualised deepfakes,Germany is set to criminalise the creation and sharing of sexualised deepfakes. This move follows serious accusations by TV personality Collien Fernandes against her former husband. She alleges he spread AI-generated pornographic images of her online. Justice Minister Stefanie Hubig stated perpetrators will face prosecution. Police will gain enhanced powers to investigate.,ET Startups,https://economictimes.indiatimes.com/small-biz/startups/rssfeeds/13357270.cms,2026-03-20 20:15:19 IST,6.4,https://economictimes.indiatimes.com/tech/internet/germany-to-crack-down-on-sexualised-deepfakes/articleshow/129703423.cms,False,Other,positive,0.75,7,0.6,0.5,True,[],"['Cybersecurity firms', 'Legal tech companies', 'AI ethics organizations', 'Content moderation platforms']",policy_change,bullish,positional_weeks,medium,medium,Germany's crackdown on sexualised deepfakes may boost demand for cybersecurity and legal tech solutions.,The new legislation could lead to increased investment in technologies that combat deepfake creation and enhance online safety.,False,,1,0.0,0.974,6.82,1.6,-0.02,Normal
White House urges Congress to take a light touch on AI regulations in new legislative blueprint,"The White House is urging Congress to create federal AI regulations. This aims to prevent a confusing mix of state laws that could hinder technological progress. Key principles include protecting children, managing energy costs, respecting intellectual property, and preventing censorship. The administration believes a unified federal approach is crucial for America's leadership in AI development and deployment.",ET Startups,https://economictimes.indiatimes.com/small-biz/startups/rssfeeds/13357270.cms,2026-03-20 20:11:42 IST,6.4,https://economictimes.indiatimes.com/tech/artificial-intelligence/white-house-urges-congress-to-take-a-light-touch-on-ai-regulations-in-new-legislative-blueprint/articleshow/129703368.cms,False,IT,positive,0.85,7,0.8,0.6,False,"['NVIDIA', 'Alphabet', 'Microsoft', 'IBM']","['Cloudflare', 'Salesforce', 'Palantir', 'Twilio']",policy_change,bullish,positional_weeks,medium,medium,The White House's push for a unified federal AI regulation could boost tech companies focused on AI development.,"A clear regulatory framework may enhance investor confidence and reduce compliance costs for tech firms, leading to potential growth.",False,,1,0.0,0.974,6.82,1.6,-0.02,Normal
"Piyush Goyal meets Zepto CEO Aadit Palicha, discusses skilling, innovation and supply chains","Taking to the social media platform X, Goyal shared details of the meeting, highlighting discussions around youth and entrepreneurship. ""A productive interaction with Aadit Palicha, Co-founder &amp; CEO of ZeptoNow,"" he said. ""Our conversation focused on strengthening skilling initiatives for our youth and leveraging innovation-led entrepreneurship to build globally competitive enterprises,"" the minister added. He further noted that the meeting also explored ways to integrate farmers into modern supply chains.",ET Startups,https://economictimes.indiatimes.com/small-biz/startups/rssfeeds/13357270.cms,2026-03-20 20:05:19 IST,6.6,https://economictimes.indiatimes.com/tech/startups/piyush-goyal-meets-zepto-ceo-aadit-palicha-discusses-skilling-innovation-and-supply-chains/articleshow/129703184.cms,False,Startup,positive,0.85,7,0.8,0.6,False,['Zepto'],"['Ola', 'Zomato', 'Swiggy', 'Paytm']",policy_change,bullish,swing_2_5days,medium,medium,"Government focus on skilling and innovation could boost the startup ecosystem, benefiting companies like Zepto.","The meeting indicates a supportive government stance towards startups, which may lead to favorable policies and funding opportunities.",False,,1,0.0,0.909,6.36,1.6,-0.02,Normal
Flipkart rolls out 105% bonus payout to employees for 2025,"However, for vice presidents (VPs) and senior vice presidents (SVPs), the payout will take place after the closure of the 2025 performance review process, according to an email sent to employees by Flipkart's chief human resources officer (CHRO) Seema Nair.",ET Startups,https://economictimes.indiatimes.com/small-biz/startups/rssfeeds/13357270.cms,2026-03-20 19:41:21 IST,7.0,https://economictimes.indiatimes.com/tech/technology/flipkart-rolls-out-105-bonus-payout-to-employees-for-2025/articleshow/129702865.cms,False,Retail,positive,0.85,7,0.8,0.6,False,"['Flipkart', 'Walmart', 'Amazon', 'Myntra']","['Logistics companies', 'E-commerce platforms', 'Retail tech providers', 'HR consulting firms']",management_change,bullish,swing_2_5days,medium,medium,"Flipkart's generous bonus payout signals strong employee morale and potential growth, positively impacting its market position.","The substantial bonus payout reflects Flipkart's commitment to employee satisfaction and retention, which can enhance productivity and performance.",False,,1,0.0,0.904,6.33,1.0,-0.02,Normal
Flipkart group CFO exits; Zomato raises platform fee,Happy Friday! Flipkart group CFO Sriram Venkataraman is set to exit after more than a decade at the Walmart-owned ecommerce giant. This and more in today's ETtech Top 5.,ET Startups,https://economictimes.indiatimes.com/small-biz/startups/rssfeeds/13357270.cms,2026-03-20 19:01:40 IST,7.6,https://economictimes.indiatimes.com/tech/newsletters/tech-top-5/flipkart-group-cfo-exits-zomato-raises-platform-fee/articleshow/129701710.cms,False,Retail,negative,0.75,6,0.3,0.4,False,"['Flipkart', 'Zomato']","['Amazon', 'Myntra', 'Swiggy', 'Paytm']",management_change,bearish,swing_2_5days,medium,medium,"The exit of Flipkart's CFO may signal instability, while Zomato's fee increase could deter users, impacting both companies negatively.","Leadership changes often lead to uncertainty, and Zomato's fee hike could affect customer retention and sales.",False,,-1,48.0,0.896,5.38,1.0,-1.38,Normal
Wipro launches AI-data centre solution to drive enterprise-scale AI adoption,Wipro's AI-Data Centre (AI-DC) solution integrates Nvidia's AI Enterprise platform within Wipro Intelligence to provide a unified suite of AI-enabled services and transformative offerings.,ET Startups,https://economictimes.indiatimes.com/small-biz/startups/rssfeeds/13357270.cms,2026-03-20 18:29:00 IST,8.2,https://economictimes.indiatimes.com/tech/information-tech/wipro-launches-ai-data-centre-solution-to-drive-enterprise-scale-ai-adoption/articleshow/129701618.cms,False,IT,positive,0.85,8,0.7,0.6,False,"['Wipro', 'Nvidia']","['Cloudflare', 'Salesforce', 'IBM', 'Microsoft']",sector_tailwind,bullish,positional_weeks,high,medium,"Wipro's new AI-DC solution positions it strongly in the growing AI market, leveraging Nvidia's technology.","The integration of Nvidia's AI platform enhances Wipro's service offerings, likely driving demand and revenue growth.",False,,1,0.0,0.967,7.74,1.2,1.34,Shock
