title,description,source,source_url,published,hours_old,url,is_govt_source,sector,sentiment,sentiment_confidence,impact_score,valence,arousal,geopolitical_risk,affected_companies,second_order_beneficiaries,catalyst_type,price_direction,time_horizon,conviction,macro_sensitivity,one_line_insight,signal_reason,contrarian_flag,contrarian_reason,source_reliability,sentiment_num,weighted_risk_score,signal_decay,recency_weighted_impact,catalyst_weight,z_score,shock_status
India's total power consumption grows by 4 per cent to 154 billion units in April,,ET_Industry,,2026-05-02 12:08:51 IST,20.3,https://economictimes.indiatimes.com/industry/energy/power/indias-total-power-consumption-grows-by-4-per-cent-to-154-billion-units-in-april/articleshow/130675178.cms,False,Energy,positive,0.7,6.0,0.5,0.5,False,[],[],consumption data,bullish,intraday,low,medium,India's power consumption growth indicates economic recovery.,,False,,1.0,1,0.0,0.03,0.18,0.7,-0.44,Normal
"India maintained stable energy supplies amid crisis, shielded people from global price shocks: Hardeep Singh Puri",,ET_Industry,,2026-05-02 12:08:51 IST,20.3,https://economictimes.indiatimes.com/industry/energy/oil-gas/india-maintained-stable-energy-supplies-amid-crisis-shielded-people-from-global-price-shocks-hardeep-singh-puri/articleshow/130675322.cms,False,Energy,positive,0.7,7.0,0.5,0.5,False,[],[],government statement,bullish,intraday,low,medium,India's stable energy supplies during crises bolster its economic resilience.,,False,,1.0,1,0.0,0.03,0.21,0.7,0.76,Watch
Maruti starts FY27 with a bang as record April sales jump over 33%,,ET_Industry,,2026-05-02 12:08:51 IST,20.6,https://economictimes.indiatimes.com/industry/auto/auto-news/maruti-suzuki-india-posts-record-sales-at-239646-units-in-apr/articleshow/130674913.cms,False,Manufacturing,positive,0.7,8.0,0.5,0.5,False,['Maruti'],[],sales data,bullish,intraday,low,medium,"Maruti reports record sales in April, indicating strong demand in the auto sector.",,False,,1.0,1,0.0,0.028,0.22,0.7,1.3,Shock
Your initial savings of  ₹20 per day can help in getting a  ₹6 lakh monthly pension. Here's how,,Livemint_Markets,,2026-05-02 12:08:51 IST,2.0,https://www.livemint.com/market/mutual-fund-sip-calculator-your-initial-savings-of-rs-20-per-day-can-help-in-getting-a-rs-6-lakh-monthly-pension-11777693765312.html,False,Fintech,neutral,0.7,4.0,0.5,0.5,False,[],[],financial advice,neutral,intraday,low,medium,Savings advice may attract interest but lacks immediate market impact.,,False,,1.0,0,0.0,0.707,2.83,0.7,-1.26,Normal
Buy or sell: Sumeet Bagadia recommends three stocks to buy on Monday — 4 May 2026,,Livemint_Markets,,2026-05-02 12:08:51 IST,3.1,https://www.livemint.com/market/stock-market-news/buy-or-sell-sumeet-bagadia-recommends-three-stocks-to-buy-on-monday-4-may-2026-11777689508861.html,False,Other,neutral,0.7,3.0,0.5,0.5,False,[],[],market analysis,neutral,intraday,low,medium,Stock recommendations are common but depend on market conditions.,,False,,1.0,0,0.0,0.584,1.75,0.7,-1.68,Normal
UAE exits OPEC: What forced the West Asian nation to junk the oil cartel amid the US-Iran war? Explained,,Livemint_Markets,,2026-05-02 12:08:51 IST,4.5,https://www.livemint.com/market/stock-market-news/uae-exits-opec-what-forced-the-west-asian-nation-to-junk-the-oil-cartel-amid-the-us-iran-war-explained-11777684127139.html,False,Energy,negative,0.7,6.0,0.5,0.5,True,[],[],geopolitical event,bearish,intraday,low,medium,UAE's exit from OPEC raises concerns over oil supply stability amid tensions.,,False,,1.0,-1,100.0,0.459,2.75,0.7,-0.44,Normal
Dollar set for sharp weekly loss versus yen after Japan steps in,,Livemint_Markets,,2026-05-02 12:08:51 IST,10.4,https://www.livemint.com/market/dollar-set-for-sharp-weekly-loss-versus-yen-after-japan-steps-in-11777666267056.html,False,Other,neutral,0.7,4.0,0.5,0.5,False,[],[],currency movement,neutral,intraday,low,medium,Dollar's movement against yen reflects broader currency market trends.,,False,,1.0,0,0.0,0.165,0.66,0.7,-0.84,Normal
Crude futures fall on new Iran proposal for peace talks,,Livemint_Markets,,2026-05-02 12:08:51 IST,10.5,https://www.livemint.com/market/crude-futures-fall-on-new-iran-proposal-for-peace-talks-11777665707975.html,False,Energy,positive,0.7,7.0,0.5,0.5,True,[],[],geopolitical event,bullish,intraday,low,medium,"Crude futures drop on peace talks, easing supply concerns.",,False,,1.0,1,0.0,0.162,1.13,0.7,0.76,Watch
"Oil Falls on Hopes for US-Iran Negotiations, Hormuz Progress",,Livemint_Markets,,2026-05-02 12:08:51 IST,11.0,https://www.livemint.com/market/oil-falls-on-hopes-for-us-iran-negotiations-hormuz-progress-11777664232420.html,False,Energy,positive,0.7,7.0,0.5,0.5,True,[],[],geopolitical event,bullish,intraday,low,medium,"Oil prices fall on hopes for US-Iran negotiations, signaling potential stability.",,False,,1.0,1,0.0,0.149,1.04,0.7,0.76,Watch
"Exxon Mobil shares fall despite first quarter earnings beat expectations, CEO warns oil prices may continue to rise",,Livemint_Markets,,2026-05-02 12:08:51 IST,12.9,https://www.livemint.com/market/stock-market-news/exxon-mobil-shares-fall-despite-first-quarter-earnings-beat-expectations-ceo-warns-oil-prices-may-continue-to-rise-11777655014891.html,False,Energy,negative,0.7,5.0,0.5,0.5,True,['Exxon Mobil'],[],earnings report,bearish,intraday,low,medium,"Exxon Mobil shares decline despite earnings beat, indicating market concerns over oil prices.",,False,,1.0,-1,100.0,0.107,0.54,0.7,-1.65,Normal
"Intel shares gain over 5%, extend record April rally as AI-driven demand fuels momentum",,Livemint_Markets,,2026-05-02 12:08:51 IST,13.1,https://www.livemint.com/market/stock-market-news/intel-shares-gain-over-5-extend-record-april-rally-as-ai-driven-demand-fuels-momentum-11777652705969.html,False,IT,positive,0.7,8.0,0.5,0.5,False,['Intel'],[],earnings report,bullish,intraday,low,medium,"Intel shares surge on AI-driven demand, reflecting strong market interest.",,False,,1.0,1,0.0,0.103,0.82,0.7,0.95,Watch
"Gold, silver rates today: Comex gold gains $44/oz; silver up $3.5/oz on fresh Iran peace hopes",,Livemint_Markets,,2026-05-02 12:08:51 IST,14.3,https://www.livemint.com/market/commodities/gold-silver-rates-today-comex-gold-gains-44-oz-silver-up-3-5-oz-on-fresh-iran-peace-hopes-11777646032975.html,False,FMCG,positive,0.7,6.0,0.5,0.5,True,[],[],market data,bullish,intraday,low,medium,"Gold and silver prices rise on geopolitical tensions, impacting inflation.",,False,,1.0,1,0.0,0.084,0.5,0.7,0.6,Watch
Emerging Assets Extend Gains as Iran Delivers New Proposal to US,,Livemint_Markets,,2026-05-02 12:08:51 IST,15.2,https://www.livemint.com/market/emerging-assets-extend-gains-as-iran-delivers-new-proposal-to-us-11777648824640.html,False,Other,positive,0.7,6.0,0.5,0.5,True,[],[],geopolitical event,bullish,intraday,low,medium,"Emerging assets gain as Iran proposes new negotiations, easing tensions.",,False,,1.0,1,0.0,0.072,0.43,0.7,0.82,Watch
Global brokerages downgrade Indian stocks: Should retail investors look to raise foreign exposure?,,Livemint_Markets,,2026-05-02 12:08:51 IST,16.2,https://www.livemint.com/market/stock-market-news/global-brokerages-downgrade-indian-stocks-should-retail-investors-look-to-raise-exposure-to-global-stocks-11777643666912.html,False,Other,negative,0.7,5.0,0.5,0.5,False,[],[],market analysis,bearish,intraday,low,medium,"Global brokerages downgrade Indian stocks, suggesting caution for investors.",,False,,1.0,-1,35.0,0.06,0.3,0.7,-0.01,Normal
"Small-cap stocks shine bright in April recovery rally, beat large and mid-caps — Check top winners",,Livemint_Markets,,2026-05-02 12:08:51 IST,16.4,https://www.livemint.com/market/stock-market-news/smallcap-stocks-shine-bright-in-april-recovery-rally-beats-large-and-midcaps-11777642068465.html,False,Other,positive,0.7,7.0,0.5,0.5,False,[],[],market performance,bullish,intraday,low,medium,"Small-cap stocks outperform in recovery rally, indicating investor confidence.",,False,,1.0,1,0.0,0.058,0.41,0.7,1.66,Shock
"Wall Street surges on strong earnings, Apple jumps over 4%, Estee Lauder soars 4.2%",,Livemint_Markets,,2026-05-02 12:08:51 IST,16.7,https://www.livemint.com/market/stock-market-news/wall-street-surges-as-oil-prices-hold-steady-11777642683443.html,False,Other,positive,0.7,8.0,0.5,0.5,False,[],[],market performance,bullish,intraday,low,medium,Wall Street's strong performance boosts investor sentiment globally.,,False,,1.0,1,0.0,0.055,0.44,0.7,2.49,Major Shock
"Gold rate today falls  ₹1,300 to below  ₹150,000 mark as oil prices continue to fuel inflation worries",,Livemint_Markets,,2026-05-02 12:08:51 IST,17.5,https://www.livemint.com/market/commodities/gold-rate-today-falls-rs-1-300-to-below-rs-150-000-mark-as-oil-prices-continue-to-fuel-inflation-worries-11777639354134.html,False,Other,negative,0.7,5.0,0.5,0.5,True,[],[],market analysis,bearish,intraday,low,medium,"Gold prices decline as geopolitical pressures mount, impacting investor sentiment.",,False,,1.0,-1,52.5,0.048,0.24,0.7,-0.01,Normal
"US stock market today: S&amp;P 500, Nasdaq futures edge higher after record April rally; Apple gains over 3%",,Livemint_Markets,,2026-05-02 12:08:51 IST,17.6,https://www.livemint.com/market/stock-market-news/us-stock-market-today-s-p-500-nasdaq-futures-edge-higher-after-record-april-rally-apple-gains-over-3-11777638533148.html,False,Other,positive,0.7,7.0,0.5,0.5,False,[],[],market performance,bullish,intraday,low,medium,"US stock market shows resilience with strong earnings, boosting investor confidence.",,False,,1.0,1,0.0,0.047,0.33,0.7,1.66,Shock
Gold Declines as Trump Vows to Maintain Pressure on Iran,,Livemint_Markets,,2026-05-02 12:08:51 IST,17.8,https://www.livemint.com/market/gold-declines-as-trump-vows-to-maintain-pressure-on-iran-11777639482232.html,False,Other,negative,0.7,5.0,0.5,0.5,True,[],[],political statement,bearish,intraday,low,medium,"Gold prices decline as political tensions rise, impacting market stability.",,False,,1.0,-1,52.5,0.046,0.23,0.7,-0.01,Normal
Up 60% in a month! Ola Electric shares to be in focus next week on 20% growth in April sales,,Livemint_Markets,,2026-05-02 12:08:51 IST,19.1,https://www.livemint.com/market/stock-market-news/ola-electric-shares-to-be-in-focus-next-week-on-20-mom-growth-in-april-sales-11777634144076.html,False,Startup,positive,0.7,8.0,0.5,0.5,False,['Ola Electric'],[],sales growth,bullish,intraday,low,medium,"Ola Electric's 20% sales growth in April drives a 60% share price increase, indicating strong market interest.",,False,,1.0,1,0.0,0.037,0.3,0.7,1.0,Watch
"UAE exit from OPEC — How will it impact crude prices, market dynamics, oil cartel's future and geopolitics?",,Livemint_Markets,,2026-05-02 12:08:51 IST,19.1,https://www.livemint.com/market/stock-market-news/uae-exit-from-opec-how-will-it-impact-crude-oil-prices-market-dynamics-oil-cartels-future-and-geopolitics-11777632411128.html,False,Energy,negative,0.7,7.0,0.5,0.5,True,[],[],geopolitical analysis,bearish,intraday,low,medium,"UAE's exit from OPEC raises concerns about crude prices and market stability, impacting energy sector dynamics.",,False,,1.0,-1,100.0,0.037,0.26,0.7,0.76,Watch
"Groww, BSE to Angel One: Over 10 capital market stocks jump up to 43% in April amid market revival",,Livemint_Markets,,2026-05-02 12:08:51 IST,20.0,https://www.livemint.com/market/stock-market-news/groww-bse-to-angel-one-over-10-capital-market-stocks-jump-up-to-43-in-april-amid-market-revival-11777629224012.html,False,Fintech,positive,0.7,6.0,0.5,0.5,False,"['Groww', 'BSE', 'Angel One']",[],market revival,bullish,intraday,low,medium,"Capital market stocks surge up to 43% in April, indicating a positive sentiment in the fintech sector.",,False,,1.0,1,0.0,0.031,0.19,0.7,0.5,Normal
Private Credit’s Retail Risk Draws Scrutiny From Global Watchdog,,Livemint_Markets,,2026-05-02 12:08:51 IST,20.1,https://www.livemint.com/market/private-credit-s-retail-risk-draws-scrutiny-from-global-watchdog-11777631346694.html,False,Banking,negative,0.7,5.0,0.5,0.5,False,[],[],regulatory scrutiny,bearish,intraday,low,medium,Global watchdog scrutiny on private credit's retail risk raises concerns for banks involved in this sector.,,False,,1.0,-1,75.0,0.031,0.16,0.7,-1.0,Normal
Emerging Markets Eke Out Gains in Thin-Volume Holiday Trading,,Livemint_Markets,,2026-05-02 12:08:51 IST,20.3,https://www.livemint.com/market/emerging-markets-eke-out-gains-in-thin-volume-holiday-trading-11777630714374.html,False,Other,neutral,0.7,4.0,0.5,0.5,False,[],[],market conditions,neutral,intraday,low,medium,"Emerging markets show slight gains amid thin-volume trading, reflecting cautious investor sentiment.",,False,,1.0,0,0.0,0.03,0.12,0.7,-0.84,Normal
"Nifty 50 slips below 24,000: What are the key levels to watch for next week?",,Livemint_Markets,,2026-05-02 12:08:51 IST,20.5,https://www.livemint.com/market/stock-market-news/nifty-50-slips-below-24-000-next-key-levels-to-watch-11777626818884.html,False,Other,negative,0.7,6.0,0.5,0.5,False,[],[],market analysis,bearish,intraday,low,medium,"Nifty 50 slipping below 24,000 indicates bearish market sentiment and potential volatility ahead.",,False,,1.0,-1,42.0,0.029,0.17,0.7,0.82,Watch
Sell in May &amp; Go Away: Is it the right strategy as US-Iran war and crude oil prices wreak havoc on portfolios?,,Livemint_Markets,,2026-05-02 12:08:51 IST,20.8,https://www.livemint.com/market/stock-market-news/sell-in-may-go-away-is-it-the-right-strategy-as-us-iran-war-and-crude-oil-prices-wreak-havoc-on-portfolios-11777626548052.html,False,Other,negative,0.7,7.0,0.5,0.5,True,[],[],market strategy,bearish,intraday,low,medium,Concerns over US-Iran war and crude prices lead to a cautious 'Sell in May' strategy among investors.,,False,,1.0,-1,73.5,0.027,0.19,0.7,1.66,Shock
"RBL Bank, Canara Bank to PNB - Who will be impacted the most by RBI ECL norms? Explained",,Livemint_Markets,,2026-05-02 12:08:51 IST,21.0,https://www.livemint.com/market/stock-market-news/rbl-bank-canara-bank-to-pnb-who-will-be-impacted-the-most-by-rbi-ecl-norms-explained-11777626415203.html,False,Banking,negative,0.7,6.0,0.5,0.5,False,"['RBL Bank', 'Canara Bank', 'PNB']",[],regulatory impact,bearish,intraday,low,medium,"RBI's ECL norms could significantly impact banks like RBL, Canara, and PNB, raising concerns over profitability.",,False,,1.0,-1,90.0,0.026,0.16,0.7,0.0,Normal
GIFT City treasury hub picks up pace; 6 listed companies seek licences,,Livemint_Markets,,2026-05-02 12:08:51 IST,21.2,https://www.livemint.com/market/gift-city-treasury-hub-listed-companies-seek-licences-kalyanaraman-rajaraman-ifsca-lack-of-automation-cross-border-cash-11777616919418.html,False,Other,positive,0.7,5.0,0.5,0.5,False,[],[],business development,bullish,intraday,low,medium,"GIFT City treasury hub's growth attracts interest from listed companies seeking licenses, indicating economic development.",,False,,1.0,1,0.0,0.025,0.12,0.7,-0.01,Normal
Do you know how to transfer physical shares to demat account?,,Livemint_Markets,,2026-05-02 12:08:51 IST,21.5,https://www.livemint.com/market/stock-market-news/do-you-know-how-to-transfer-physical-shares-to-demat-account-11777622789346.html,False,Other,neutral,0.7,3.0,0.5,0.5,False,[],[],informational,neutral,intraday,low,medium,Understanding the process of transferring physical shares to demat accounts is essential for investors.,,False,,1.0,0,0.0,0.024,0.07,0.7,-1.68,Normal
Can HUL’s price hikes offset looming margin pressure?,,Livemint_Markets,,2026-05-02 12:08:51 IST,22.2,https://www.livemint.com/market/mark-to-market/hul-q4fy26-results-volume-growth-fy27-outlook-price-hikes-margin-pressure-11777620166287.html,False,FMCG,negative,0.7,6.0,0.5,0.5,False,['HUL'],[],cost pressures,bearish,intraday,low,medium,"HUL's price hikes may not fully offset margin pressures, raising concerns about profitability in a challenging environment.",,False,,1.0,-1,60.0,0.021,0.13,0.7,0.6,Watch
AMC quarterly earnings dented by impact of West Asia conflict on other income despite steady fees,,Livemint_Markets,,2026-05-02 12:08:51 IST,22.4,https://www.livemint.com/market/amcs-quarterly-earnings-west-asia-conflict-other-income-steady-fees-average-aum-total-expense-ratio-mutual-funds-11777609871793.html,False,Other,negative,0.7,5.0,0.5,0.5,True,[],[],earnings impact,bearish,intraday,low,medium,"AMC's quarterly earnings suffer due to West Asia conflict, highlighting vulnerability to geopolitical events.",,False,,1.0,-1,52.5,0.021,0.11,0.7,-0.01,Normal
Dr Lal Path Labs needs volume growth to clear its FY27 tests,,Livemint_Markets,,2026-05-02 12:08:51 IST,23.1,https://www.livemint.com/market/mark-to-market/dr-lal-path-labs-q4-earnings-diagnostics-market-india-dr-lal-path-labs-share-price-11777616903305.html,False,Healthcare,neutral,0.7,4.0,0.5,0.5,False,['Dr Lal Path Labs'],[],growth needs,neutral,intraday,low,medium,"Dr Lal Path Labs requires volume growth to meet FY27 targets, indicating a focus on operational efficiency.",,False,,1.0,0,0.0,0.018,0.07,0.7,-1.38,Normal
Air India cuts international flights until July 2026 as fuel costs and airspace closures bite,,Livemint_Companies,,2026-05-02 12:08:51 IST,0.2,https://www.livemint.com/companies/news/air-india-to-cut-international-flights-until-july-2026-as-fuel-costs-and-airspace-closures-make-routes-unprofitable-11777702684492.html,False,Aviation,negative,0.7,7.0,0.5,0.5,True,['Air India'],[],cost pressures,bearish,intraday,low,medium,Air India's cut in international flights due to fuel costs and airspace issues signals operational challenges ahead.,,False,,1.0,-1,100.0,0.966,6.76,0.7,0.0,Normal
Cognizant to lay off employees as AI drives ‘real and accelerated change’,,Livemint_Companies,,2026-05-02 12:08:51 IST,0.6,https://www.livemint.com/companies/news/cognizant-to-lay-off-employees-as-ai-drives-real-and-accelerated-change-11777700436203.html,False,IT,negative,0.7,6.0,0.5,0.5,False,['Cognizant'],[],workforce reduction,bearish,intraday,low,medium,Cognizant's layoffs due to AI changes reflect industry shifts and potential job market instability in IT.,,False,,1.0,-1,72.0,0.901,5.41,0.7,-0.95,Normal
"Meta buys humanoid robot startup Assured Robot Intelligence as 8,000 job cuts loom",,Livemint_Companies,,2026-05-02 12:08:51 IST,2.6,https://www.livemint.com/companies/news/meta-acquires-humanoid-robot-startup-assured-robot-intelligence-weeks-after-announcing-8-000-layoffs-11777692898608.html,False,Other,negative,0.7,5.0,0.5,0.5,False,['Meta'],[],acquisition news,bearish,intraday,low,medium,Meta's acquisition of a robotics startup amid layoffs raises concerns about job security in tech sectors.,,False,,1.0,-1,35.0,0.637,3.18,0.7,-0.01,Normal
GameStop prepares eBay takeover offer in Ryan Cohen's boldest move yet; Stocks jump 15%,,Livemint_Companies,,2026-05-02 12:08:51 IST,6.1,https://www.livemint.com/companies/news/gamestop-prepares-ebay-takeover-offer-in-ryan-cohens-boldest-move-yet-stocks-jump-15-per-cent-11777681014875.html,False,Retail,positive,0.7,7.0,0.5,0.5,False,['GameStop'],[],strategic move,bullish,intraday,low,medium,"GameStop's potential eBay takeover reflects bold strategic moves, boosting investor confidence with a 15% stock jump.",,False,,1.0,1,0.0,0.348,2.44,0.7,0.58,Watch
Brown University cuts stake in Blue Owl private credit fund by over 50%,,Livemint_Companies,,2026-05-02 12:08:51 IST,9.2,https://www.livemint.com/companies/brown-university-cuts-stake-in-blue-owl-private-credit-fund-by-over-50-11777670444288.html,False,Other,negative,0.7,4.0,0.5,0.5,False,['Blue Owl'],[],investment decision,bearish,intraday,low,medium,Brown University's significant stake cut in Blue Owl raises concerns about investor confidence in private credit.,,False,,1.0,-1,28.0,0.203,0.81,0.7,-0.84,Normal
"US Sanctions Iranian Exchanges, China Terminal on Oil Purchases",,Livemint_Companies,,2026-05-02 12:08:51 IST,11.6,https://www.livemint.com/companies/us-sanctions-iranian-exchanges-china-terminal-on-oil-purchases-11777661768532.html,False,Energy,negative,0.7,8.0,0.5,0.5,True,[],[],sanctions,bearish,intraday,low,medium,"US sanctions on Iranian exchanges could tighten oil supply, impacting global crude prices and market stability.",,False,,1.0,-1,100.0,0.134,1.07,0.7,1.96,Shock
"Jindal Steel FY26 profit up 20%, but costs weigh on margins",,Livemint_Companies,,2026-05-02 12:08:51 IST,13.6,https://www.livemint.com/companies/news/jindal-steel-fy26-profit-earning-margins-11777648890744.html,False,Manufacturing,positive,0.7,6.0,0.5,0.5,False,['Jindal Steel'],[],profit growth,bullish,intraday,low,medium,Jindal Steel's 20% profit growth for FY26 indicates strong operational performance despite cost pressures.,,False,,1.0,1,0.0,0.095,0.57,0.7,-0.48,Normal
"Spirit Airlines preparing for total shutdown after bailout talks fail, stock crashes 74%",,Livemint_Companies,,2026-05-02 12:08:51 IST,14.3,https://www.livemint.com/companies/news/spirit-airlines-preparing-for-total-shutdown-after-bailout-talks-fail-stock-crashes-74-11777650839485.html,False,Aviation,negative,0.7,9.0,0.5,0.5,False,['Spirit Airlines'],[],financial distress,bearish,intraday,low,medium,Spirit Airlines' potential shutdown after failed bailout talks signals severe financial distress in the aviation sector.,,False,,1.0,-1,90.0,0.084,0.76,0.7,1.0,Watch
"Aster DM targets 15,000 beds by FY30 post merger with Quality Care",,Livemint_Companies,,2026-05-02 12:08:51 IST,15.2,https://www.livemint.com/companies/news/aster-dm-15-000-beds-by-fy30-quality-care-merger-blackstone-11777639071840.html,False,Healthcare,positive,0.7,7.0,0.5,0.5,False,['Aster DM'],[],expansion plans,bullish,intraday,low,medium,"Aster DM's target of 15,000 beds post-merger indicates strong growth ambitions in the healthcare sector.",,False,,1.0,1,0.0,0.072,0.5,0.7,0.92,Watch
"Indus Towers flags delays, cost pressures as LPG supply tightens amid West Asia conflict",,Livemint_Companies,,2026-05-02 12:08:51 IST,16.3,https://www.livemint.com/companies/news/indus-towers-flags-delays-cost-pressures-as-lpg-supply-tightens-amid-west-asia-conflict-11777639743810.html,False,Manufacturing,negative,0.7,7.0,0.5,0.5,True,['Indus Towers'],[],supply chain issues,bearish,intraday,low,medium,"Indus Towers faces delays and cost pressures due to LPG supply tightness, impacting operational efficiency.",,False,,1.0,-1,100.0,0.059,0.41,0.7,0.41,Normal
Proxy advisory firm asks RBI to reject Tata Sons' bid to surrender licence,,Livemint_Companies,,2026-05-02 12:08:51 IST,17.6,https://www.livemint.com/companies/news/tata-sons-ipo-rbi-nbfc-rules-ingovern-tata-sons-11777637366311.html,False,Other,negative,0.7,5.0,0.5,0.5,False,['Tata Sons'],[],regulatory action,bearish,intraday,low,medium,Proxy advisory firm's recommendation against Tata Sons' bid raises governance concerns in corporate actions.,,False,,1.0,-1,35.0,0.047,0.24,0.7,-0.01,Normal
"Amid scorching heatwave, Zomato, Blinkit expand ‘insurance plan, SOS support’ and more for gig workers",,Livemint_Companies,,2026-05-02 12:08:51 IST,20.7,https://www.livemint.com/companies/amid-scorching-heatwave-zomato-blinkit-expand-insurance-plan-sos-support-and-more-for-gig-workers-11777626460240.html,False,FMCG,positive,0.7,6.0,0.5,0.5,False,"['Zomato', 'Blinkit']",[],employee support,bullish,intraday,low,medium,Zomato and Blinkit's expansion of support for gig workers amid heatwave reflects commitment to employee welfare.,,False,,1.0,1,0.0,0.028,0.17,0.7,0.6,Watch
Mint Explainer: Why Reliance Retail is backing loss-making celebrity brands,,Livemint_Companies,,2026-05-02 12:08:51 IST,21.0,https://www.livemint.com/companies/news/reliance-retail-celebrity-brands-india-priyanka-chopra-alia-bhatt-11777617360837.html,False,Other,neutral,0.7,5.0,0.5,0.5,False,['Reliance Retail'],[],market strategy,neutral,intraday,low,medium,Reliance Retail's backing of loss-making brands indicates a long-term strategy focused on brand building.,,False,,1.0,0,0.0,0.026,0.13,0.7,-0.01,Normal
Visa bets on cheaper tech and consumer choice to take on the UPI juggernaut,,Livemint_Companies,,2026-05-02 12:08:51 IST,21.7,https://www.livemint.com/companies/news/visa-india-upi-ramakrishnan-gopalan-visa-11777616418119.html,False,Fintech,positive,0.7,7.0,0.5,0.5,False,['Visa'],[],competitive strategy,bullish,intraday,low,medium,"Visa's investment in cheaper tech positions it well against UPI, indicating strong competitive strategy in fintech.",,False,,1.0,1,0.0,0.023,0.16,0.7,1.39,Shock
Inside Burgundy Brand Collective’s bet on India’s rising luxury appetite,,Livemint_Companies,,2026-05-02 12:08:51 IST,22.9,https://www.livemint.com/companies/news/burgundy-brand-collective-india-luxury-market-fashion-brands-india-11777610022774.html,False,Other,positive,0.7,6.0,0.5,0.5,False,[],[],market trend,bullish,intraday,low,medium,Burgundy Brand Collective's focus on India's luxury market reflects growing consumer appetite for premium products.,,False,,1.0,1,0.0,0.019,0.11,0.7,0.82,Watch
JPMorgan Executive Lorna Hajdini's old remark in spotlight amid allegations of sexual assault: ‘You are a force….’,,Livemint_Companies,,2026-05-02 12:08:51 IST,24.2,https://www.livemint.com/companies/people/jpmorgan-executive-lorna-hajdinis-old-remark-in-spotlight-amid-allegations-of-sexual-assault-you-are-a-force-to-be-11777599645319.html,False,Other,negative,0.7,4.0,0.5,0.5,False,['JPMorgan'],[],corporate governance,bearish,intraday,low,medium,JPMorgan's executive's past remarks amid assault allegations raise concerns about corporate governance and culture.,,False,,1.0,-1,28.0,0.015,0.06,0.7,-0.84,Normal
