title,description,source,source_url,published,hours_old,url,is_govt_source,sector,sentiment,sentiment_confidence,impact_score,valence,arousal,geopolitical_risk,affected_companies,second_order_beneficiaries,catalyst_type,price_direction,time_horizon,conviction,macro_sensitivity,one_line_insight,signal_reason,contrarian_flag,contrarian_reason,source_reliability,sentiment_num,weighted_risk_score,signal_decay,recency_weighted_impact,catalyst_weight,z_score,shock_status
"Apple logs record March quarter in India, iPhone sales grow despite market slump; Tim Cook ‘over the moon’",,Livemint_Companies,,2026-05-02 12:08:51 IST,24.4,https://www.livemint.com/companies/company-results/apple-india-revenue-tim-cook-india-11777613417226.html,False,IT,positive,0.7,8.0,0.5,0.5,False,['Apple'],[],sales growth,bullish,intraday,low,medium,Apple's record sales in India despite market slump indicate strong demand and resilience in the tech sector.,,False,,1.0,1,0.0,0.015,0.12,0.7,0.95,Watch
"Lorna Hajdini sexual abuse case: JP Morgan colleagues call Chirayu Rana ‘socially awkward’, question claims",,Livemint_Companies,,2026-05-02 12:08:51 IST,24.4,https://www.livemint.com/companies/news/lorna-hajdini-sexual-abuse-case-jp-morgan-colleagues-call-chirayu-rana-socially-awkward-question-claims-11777611985745.html,False,Other,negative,0.7,3.0,0.5,0.5,False,['JP Morgan'],[],legal,neutral,intraday,low,medium,The ongoing sexual abuse case involving JP Morgan raises reputational concerns for the firm.,,False,,1.0,-1,21.0,0.015,0.04,0.7,-1.68,Normal
JPMorgan breaks silence on the Lorna Hajdini sexual abuse case: ‘extensive internal probe reveals…’,,Livemint_Companies,,2026-05-02 12:08:51 IST,25.8,https://www.livemint.com/companies/people/jpmorgan-breaks-silence-on-the-lorna-hajdini-sexual-abuse-case-extensive-internal-probe-reveals-11777609045732.html,False,Other,neutral,0.7,4.0,0.5,0.5,False,['JP Morgan'],[],legal,neutral,intraday,low,medium,JP Morgan's internal probe into the sexual abuse case may mitigate reputational damage but remains a sensitive issue.,,False,,1.0,0,0.0,0.011,0.04,0.7,-0.84,Normal
"The House of Rare bets on lifestyle pivot, quick commerce to fuel growth",,Livemint_Companies,,2026-05-02 12:08:51 IST,27.1,https://www.livemint.com/companies/the-house-of-rare-lifestyle-pivot-quick-commerce-growth-myntra-libas-fashion-amazon-flipkart-ajio-nykaa-11777540069661.html,False,Retail,positive,0.7,6.0,0.5,0.5,False,['The House of Rare'],[],business strategy,bullish,intraday,low,medium,The House of Rare's pivot to lifestyle and quick commerce could drive growth in a competitive market.,,False,,1.0,1,0.0,0.009,0.05,0.7,-1.15,Normal
Who is Chirayu Rana? Man behind sexual abuse allegations against JPMorgan’s Lorna Hajdini—what new reports reveal,,Livemint_Companies,,2026-05-02 12:08:51 IST,29.6,https://www.livemint.com/companies/people/who-is-chirayu-rana-man-behind-sexual-abuse-allegations-against-jpmorgan-s-lorna-hajdini-what-new-reports-reveal-11777594879320.html,False,Other,negative,0.7,3.0,0.5,0.5,False,['JP Morgan'],[],legal,neutral,intraday,low,medium,Reports on Chirayu Rana's allegations against Lorna Hajdini add to the controversy surrounding the case.,,False,,1.0,-1,21.0,0.006,0.02,0.7,-1.68,Normal
"Reliance sells unit to former associate company, in test of Sebi's related party transaction rules",,Livemint_Companies,,2026-05-02 12:08:51 IST,30.1,https://www.livemint.com/companies/news/india-reliance-ril-subsidiary-reliance-projects-sale-jaipur-enclave-sebi-related-party-transactions-11777427156565.html,False,Other,neutral,0.7,5.0,0.5,0.5,False,['Reliance'],[],transaction,neutral,intraday,low,medium,Reliance's sale of a unit tests regulatory frameworks but may not significantly impact its overall business.,,False,,1.0,0,0.0,0.005,0.02,0.7,-0.01,Normal
Tata Sons can’t escape RBI’s public funds net,,Livemint_Companies,,2026-05-02 12:08:51 IST,30.1,https://www.livemint.com/companies/tata-sons-listing-upper-layer-nbfc-rbi-public-funds-net-11777555578163.html,False,Banking,negative,0.7,4.0,0.5,0.5,False,['Tata Sons'],[],regulatory,bearish,intraday,low,medium,Tata Sons facing RBI scrutiny over public funds could lead to tighter regulations affecting operations.,,False,,1.0,-1,60.0,0.005,0.02,1.1,-2.0,Normal
"Blue Owl sold about half its SpaceX holding at $1.25 trillion valuation, co-CEO says",,Livemint_Companies,,2026-05-02 12:08:51 IST,34.8,https://www.livemint.com/companies/blue-owl-sold-about-half-its-spacex-holding-at-1-25-trillion-valuation-co-ceo-says-11777578300751.html,False,Other,neutral,0.7,5.0,0.5,0.5,False,['Blue Owl'],[],investment,neutral,intraday,low,medium,Blue Owl's sale of SpaceX holdings reflects strategic investment decisions but has limited immediate market impact.,,False,,1.0,0,0.0,0.002,0.01,0.7,-0.01,Normal
"Exonerees struggle to rebuild their lives and gain lasting employment, even if elected to office",,Livemint_Companies,,2026-05-02 12:08:51 IST,35.4,https://www.livemint.com/companies/exonerees-struggle-to-rebuild-their-lives-and-gain-lasting-employment-even-if-elected-to-office-11777576071644.html,False,Other,negative,0.7,2.0,0.5,0.5,False,[],[],social issue,neutral,intraday,low,medium,"Exonerees face significant challenges in rebuilding lives, highlighting systemic issues in employment.",,False,,1.0,-1,14.0,0.002,0.0,0.7,-2.51,Normal
US Critical Mineral Inventory Plan Includes Buying China Metals,,Livemint_Companies,,2026-05-02 12:08:51 IST,36.0,https://www.livemint.com/companies/us-critical-mineral-inventory-plan-includes-buying-china-metals-11777574072036.html,False,Other,neutral,0.7,5.0,0.5,0.5,True,[],[],policy,neutral,intraday,low,medium,US's critical mineral inventory plan may impact global supply chains but is a long-term strategy.,,False,,1.0,0,0.0,0.002,0.01,0.7,-0.01,Normal
"The week in charts: New Zealand FTA, steel exports, boardroom gender disparity",,Livemint_Economy,,2026-05-02 12:08:51 IST,3.1,https://www.livemint.com/economy/the-week-in-charts-new-zealand-fta-steel-exports-boardroom-gender-disparity-11777540041047.html,False,Other,neutral,0.7,4.0,0.5,0.5,False,[],[],trade,neutral,intraday,low,medium,Charts on trade agreements and exports provide insights into economic trends but lack immediate impact.,,False,,1.0,0,0.0,0.584,2.34,0.7,-0.84,Normal
India’s green energy sector may be hit by power regulator’s stricter performance standards,,Livemint_Economy,,2026-05-02 12:08:51 IST,6.1,https://www.livemint.com/economy/green-energy-sector-may-be-hit-by-power-regulator-s-stricter-standards-wind-solar-power-discoms-11777634288328.html,False,Energy,negative,0.7,6.0,0.5,0.5,False,[],[],regulatory,bearish,intraday,low,medium,Stricter performance standards in India's green energy sector could hinder growth and investment.,,False,,1.0,-1,84.0,0.348,2.09,1.1,-0.44,Normal
"Eating out, international travel costlier after commercial LPG, ATF price hike",,Livemint_Economy,,2026-05-02 12:08:51 IST,15.5,https://www.livemint.com/economy/eating-out-international-travel-costlier-after-commercial-lpg-atf-price-hike-restaurants-hit-11777640208055.html,False,Energy,negative,0.7,7.0,0.5,0.5,False,[],[],price change,bearish,intraday,low,medium,Rising costs of eating out and travel due to LPG and ATF price hikes may dampen consumer spending.,,False,,1.0,-1,98.0,0.068,0.48,0.7,0.76,Watch
"Centre, states collect record  ₹2.43 trillion in gross April GST revenue",,Livemint_Economy,,2026-05-02 12:08:51 IST,24.3,https://www.livemint.com/economy/centre-states-collect-record-rs-2-43-trillion-in-gross-april-gst-revenue-11777610102627.html,False,Other,positive,0.7,5.0,0.5,0.5,False,[],[],revenue,bullish,intraday,low,medium,Record GST revenue collection indicates strong economic activity and could support government spending.,,False,,1.0,1,0.0,0.015,0.08,0.7,-0.01,Normal
"Government lowers export duty on diesel, ATF",,Livemint_Economy,,2026-05-02 12:08:51 IST,34.9,https://www.livemint.com/economy/government-export-duty-diesel-atf-levies-aviation-turbine-fuel-11777572180594.html,False,Energy,positive,0.7,6.0,0.5,0.5,False,[],[],policy,bullish,intraday,low,medium,Lowering export duties on diesel and ATF may boost exports and improve margins for energy companies.,,False,,1.0,1,0.0,0.002,0.01,0.7,-0.44,Normal
