title,sector,sentiment,impact_score,z_score,shock_status,one_line_insight,geopolitical_risk,url
"Rupee on shaky ground, touches fresh low of 93.73",Other,negative,8,1.33,Shock,"The sharp decline of the rupee signals potential volatility in the market, particularly affecting oil-importing companies.",True,https://economictimes.indiatimes.com/markets/forex/forex-news/rupee-on-shaky-ground-touches-fresh-low-of-93-73/articleshow/129715234.cms
"Dubai realty slows amid geopolitical shocks; India emerges as preferred investment destination, suggest experts",Other,positive,8,1.33,Shock,India's real estate market is gaining traction as investors shift focus from Dubai due to geopolitical uncertainties.,True,https://economictimes.indiatimes.com/markets/digital-real-estate/realty-news/dubai-realty-slows-amid-geopolitical-shocks-india-emerges-as-preferred-investment-destination-suggest-experts/articleshow/129714203.cms
"FPIs dump Rs 31,831 crore in financials as total outflows hit Rs 52,703 crore in a fortnight",Banking,negative,8,1.33,Shock,"Significant FPI outflows from financials indicate bearish sentiment, driven by geopolitical tensions and rising crude prices.",True,https://economictimes.indiatimes.com/markets/stocks/news/fpis-dump-rs-31831-crore-in-financials-as-total-outflows-hit-rs-52703-crore-in-a-fortnight/articleshow/129713496.cms
Investors pull out $20.3 billion from global equity funds,Other,negative,8,1.33,Shock,"The significant withdrawal from equity funds signals investor anxiety over inflation and geopolitical tensions, likely leading to bearish market conditions.",True,https://economictimes.indiatimes.com/markets/stocks/news/investors-pull-out-20-3-billion-from-global-equity-funds/articleshow/129712810.cms
Euro FX settlement in works at GIFT City,Fintech,positive,8,1.33,Shock,"The introduction of euro FX settlements at GIFT City could enhance India's financial integration with Europe, benefiting major banks and fintech firms.",False,https://economictimes.indiatimes.com/markets/forex/euro-fx-settlement-in-works-at-gift-city/articleshow/129712852.cms
"FPIs still in exit mode, dump record chunk of financial services",Banking,negative,8,1.33,Shock,The significant FPI exit from financial services indicates a bearish outlook for the sector amidst global economic concerns.,True,https://economictimes.indiatimes.com/markets/stocks/news/fpis-still-in-exit-mode-dump-record-chunk-of-financial-services/articleshow/129712777.cms
Rupee on shaky ground touches fresh low of 93.73,Other,negative,8,1.33,Shock,"The sharp decline of the Indian Rupee signals potential volatility in the market, particularly affecting oil-importing companies.",True,https://economictimes.indiatimes.com/markets/forex/rupee-on-shaky-ground-touches-fresh-low-of-93-73/articleshow/129712615.cms
Oil jumps to highest settlement since July 2022 as more Mideast supply disrupted,Energy,positive,8,1.33,Shock,Rising geopolitical tensions and supply disruptions are likely to keep oil prices elevated in the coming weeks.,True,https://economictimes.indiatimes.com/markets/commodities/news/oil-jumps-to-highest-settlement-since-july-2022-as-more-mideast-supply-disrupted/articleshow/129708593.cms
"US stocks: Super Micro shares plunge 27% as co-founder, 2 others charged with smuggling AI chips to China",IT,negative,8,1.33,Shock,Super Micro's significant share drop reflects heightened regulatory scrutiny and geopolitical tensions affecting the tech sector.,True,https://economictimes.indiatimes.com/markets/us-stocks/news/us-stocks-super-micro-shares-plunge-27-as-co-founder-2-others-charged-with-smuggling-ai-chips-to-china/articleshow/129703090.cms
US Fed Governor Waller sounds alarm on inflation risk due to Iran war,Other,negative,8,1.33,Shock,"The ongoing conflict in the Middle East poses significant inflation risks, particularly affecting energy prices and related sectors.",True,https://economictimes.indiatimes.com/markets/us-stocks/news/us-fed-governor-waller-sounds-alarm-on-inflation-risk-due-to-iran-war/articleshow/129703035.cms
Zetwerk plans to confidentially file for IPO in 2 weeks: Sources,Startup,positive,8,1.33,Shock,Zetwerk's upcoming IPO could signal strong investor interest in the Indian startup ecosystem.,False,https://economictimes.indiatimes.com/markets/ipos/fpos/zetwerk-plans-to-confidentially-file-for-ipo-in-2-weeks-sources/articleshow/129702791.cms
"US stocks today: Dow crashes 444 pts, Nasdaq 2%, S&amp;P over 1% as Iran war hurts US stock markets most in 4 weeks",Other,negative,8,1.33,Shock,The ongoing geopolitical tensions are likely to lead to sustained market volatility and bearish sentiment in the short term.,True,https://economictimes.indiatimes.com/markets/us-stocks/news/us-stocks-today-us-stock-open-lower-as-middle-east-turmoil-clouds-fed-outlook/articleshow/129702213.cms
"US Stock Market Today | Dow Jones | Nasdaq Highlights: Dow drops 444 pts, Nasdaq 2%, S&amp;P over 1% as Iran war clouds outlook",Other,negative,8,1.33,Shock,"The significant drop in major indices reflects heightened geopolitical tensions, particularly related to Iran, which may lead to increased market volatility.",True,https://economictimes.indiatimes.com/markets/us-stocks/news/us-stock-market-live-dow-jones-sp-500-nasdaq-trump-us-iran-israel-war-crude-brent-oil-tech-ai-stock-price-news-earnings/liveblog/129701493.cms
Tata Power among 7 stocks that hit 52-week high; rally up to 20% in a month,Energy,positive,8,1.33,Shock,"Tata Power's recent performance indicates strong momentum in the energy sector, driven by broader market trends.",False,https://economictimes.indiatimes.com/markets/stocks/news/tata-power-among-7-stocks-that-hit-52-week-high-rally-up-to-20-in-a-month/slideshow/129699243.cms
Government unveils Rs 20000 crore credit guarantee plan for MFIs,Fintech,positive,8,1.33,Shock,"The government's credit guarantee plan for MFIs is set to boost liquidity and credit flow, positively impacting the fintech sector.",False,https://economictimes.indiatimes.com/news/economy/finance/government-unveils-rs-20000-crore-credit-guarantee-plan-for-mfis/articleshow/129700478.cms
Centre classifies key energy data as national security; mandates real-time reporting from oil and gas firms,Energy,positive,8,1.33,Shock,The classification of energy data as national security enhances operational transparency and could lead to increased investments in the energy sector.,True,https://economictimes.indiatimes.com/news/economy/policy/centre-classifies-key-energy-data-as-national-security-mandates-real-time-reporting-from-oil-and-gas-firms/articleshow/129699966.cms
"West Asia conflict to push up pesticide input costs by 20-25%, warns industry body",Manufacturing,negative,8,1.33,Shock,"The West Asia conflict is set to significantly increase pesticide costs, impacting India's agricultural sector and related industries.",True,https://economictimes.indiatimes.com/news/economy/agriculture/iran-war-west-asia-conflict-to-push-up-pesticide-input-costs-by-20-25pc-warns-industry-body/articleshow/129698076.cms
India rolls out ₹497 crore RELIEF scheme to support exporters amid West Asia conflict,Other,positive,8,1.33,Shock,India's new export support scheme is likely to boost trade and benefit various sectors amid geopolitical tensions.,True,https://economictimes.indiatimes.com/news/economy/foreign-trade/india-rolls-out-497-crore-relief-scheme-to-support-exporters-amid-west-asia-conflict/articleshow/129686392.cms
"OpenAI to nearly double workforce to 8,000 by end-2026: FT",IT,positive,8,1.33,Shock,OpenAI's workforce expansion signals strong growth potential and increased demand for AI solutions.,False,https://economictimes.indiatimes.com/tech/artificial-intelligence/openai-to-nearly-double-workforce-to-8000-by-end-2026-ft/articleshow/129718951.cms
US jury finds Elon Musk misled Twitter shareholders,IT,negative,8,1.33,Shock,Elon Musk's misleading actions could lead to a significant decline in Twitter's stock and impact investor confidence.,False,https://economictimes.indiatimes.com/tech/technology/us-jury-finds-elon-musk-misled-twitter-shareholders/articleshow/129711784.cms
SoftBank and AEP plan massive Ohio gas-fired AI data center campus,Energy,positive,8,1.33,Shock,"The partnership between SoftBank and AEP signals a strong investment in energy infrastructure and AI, likely boosting related sectors.",False,https://economictimes.indiatimes.com/tech/artificial-intelligence/softbank-and-aep-plan-massive-ohio-gas-fired-ai-data-center-campus/articleshow/129711812.cms
"Pentagon to adopt Palantir AI as core US military system, memo says",IT,positive,8,1.33,Shock,"Palantir's integration into the US military signals strong demand for AI in defense, potentially boosting its stock.",True,https://economictimes.indiatimes.com/tech/artificial-intelligence/pentagon-to-adopt-palantir-ai-as-core-us-military-system-memo-says/articleshow/129711789.cms
"Meta, Alphabet join credit-risk index as AI hedging demand soars",IT,positive,8,1.33,Shock,"The surge in AI infrastructure funding is driving demand for credit-risk derivatives, indicating strong growth potential for tech giants.",False,https://economictimes.indiatimes.com/tech/artificial-intelligence/meta-alphabet-join-credit-risk-index-as-ai-hedging-demand-soars/articleshow/129707866.cms
"Philippe Laffont’s $70 billion Coatue looks to launch new AI, tech fund",Startup,positive,8,1.33,Shock,"Coatue's new AI fund signals a strong bullish trend in tech investments, particularly in startups.",False,https://economictimes.indiatimes.com/tech/funding/philippe-laffonts-70-billion-coatue-looks-to-launch-new-ai-tech-fund/articleshow/129705114.cms
xAI sends engineers to client sites to win business from OpenAI,IT,positive,8,1.33,Shock,"xAI's strategic on-site engagement is effectively displacing OpenAI's ChatGPT, indicating strong competitive positioning.",False,https://economictimes.indiatimes.com/tech/technology/xai-sends-engineers-to-client-sites-to-win-business-from-openai/articleshow/129704483.cms
"Zetwerk plans to confidentially file for Indian IPO, targets $4 billion valuation",Startup,positive,8,1.33,Shock,Zetwerk's IPO plans signal strong growth potential in the Indian startup ecosystem.,False,https://economictimes.indiatimes.com/tech/startups/zetwerk-plans-to-confidentially-file-for-indian-ipo-targets-4-billion-valuation-report/articleshow/129703905.cms
Microsoft launches MAI-Image-2: here's all you need to know,IT,positive,8,1.33,Shock,"Microsoft's launch of MAI-Image-2 positions it strongly in the AI-driven creative tools market, enhancing its competitive edge.",False,https://economictimes.indiatimes.com/tech/internet/microsoft-launches-mai-image-2-heres-all-you-need-to-know/articleshow/129703733.cms
White House urges Congress to take a light touch on AI regulations in new legislative blueprint,IT,positive,8,1.33,Shock,The White House's push for a unified federal AI regulatory framework is likely to boost tech companies focused on AI development.,False,https://economictimes.indiatimes.com/tech/artificial-intelligence/white-house-urges-congress-to-take-a-light-touch-on-ai-regulations-in-new-legislative-blueprint/articleshow/129703368.cms
Wipro launches AI-data centre solution to drive enterprise-scale AI adoption,IT,positive,8,1.33,Shock,"Wipro's new AI-DC solution positions it strongly in the growing AI market, leveraging Nvidia's technology.",False,https://economictimes.indiatimes.com/tech/information-tech/wipro-launches-ai-data-centre-solution-to-drive-enterprise-scale-ai-adoption/articleshow/129701618.cms
Ecolab to acquire AI data center cooling tech firm for $5 billion,Other,positive,8,1.33,Shock,Ecolab's acquisition of CoolIT Systems positions it strongly in the growing AI data center market.,False,https://economictimes.indiatimes.com/tech/technology/ecolab-to-acquire-ai-data-center-cooling-tech-firm-for-4-75-billion/articleshow/129700816.cms
India achieves 1 billion tonne coal production for 2nd consecutive year,Energy,positive,8,1.33,Shock,"India's consistent coal production bolsters energy security and supports economic growth, presenting investment opportunities in the energy sector.",False,https://economictimes.indiatimes.com/industry/energy/power/india-achieves-1-billion-tonne-coal-production-for-2nd-consecutive-year/articleshow/129716749.cms
"Iran war's energy impact forces world to pay up, cut consumption",Energy,negative,9,2.6,Major Shock,The ongoing conflict in Iran is likely to lead to sustained high oil prices and increased volatility in energy markets.,True,https://economictimes.indiatimes.com/industry/energy/oil-gas/iran-wars-energy-impact-forces-world-to-pay-up-cut-consumption/articleshow/129716091.cms
India-Africa meet focuses on grid planning and financing in energy transition,Energy,positive,8,1.33,Shock,The India-Africa energy partnership presents significant growth opportunities for companies involved in renewable energy and infrastructure development.,False,https://economictimes.indiatimes.com/industry/renewables/india-africa-meet-focuses-on-grid-planning-and-financing-in-energy-transition/articleshow/129715718.cms
"Alkem Laboratories launches semaglutide in India at Rs 450 per week, eyes booming weight-loss market",Healthcare,positive,8,1.33,Shock,Alkem Laboratories' launch of semaglutide positions it well in the expanding diabetes and weight-loss market in India.,False,https://economictimes.indiatimes.com/industry/healthcare/biotech/pharmaceuticals/alkem-laboratories-launches-semaglutide-in-india-at-rs-450-per-week-eyes-booming-weight-loss-market/articleshow/129714782.cms
India among key APAC markets as global real estate investment volumes rise 8.2% in 2025: Colliers,Other,positive,8,1.33,Shock,"India's real estate market is set for significant growth as global investment volumes rise, indicating strong investor confidence.",False,https://economictimes.indiatimes.com/industry/services/property-/-cstruction/india-among-key-apac-markets-as-global-real-estate-investment-volumes-rise-8-2-in-2025-colliers/articleshow/129714916.cms
US lifts Iran oil sanctions for 30 days to ease price surge; 140 mn barrels to hit global markets,Energy,positive,8,1.33,Shock,The temporary lifting of sanctions on Iranian oil is likely to stabilize global oil prices and benefit major oil companies.,True,https://economictimes.indiatimes.com/industry/energy/oil-gas/us-lifts-iran-oil-sanctions-for-30-days-to-ease-price-surge-140-mn-barrels-to-hit-global-markets/videoshow/129714310.cms
"West Asia war: Refiners in India, elsewhere in Asia look to buy Iranian oil after US waives sanctions",Energy,positive,8,1.33,Shock,The US waiver on Iranian oil sanctions presents a significant opportunity for Indian refiners to alleviate energy shortages and enhance margins.,True,https://economictimes.indiatimes.com/industry/energy/oil-gas/west-asia-war-refiners-in-india-elsewhere-in-asia-look-to-buy-iranian-oil-after-us-waives-sanctions/articleshow/129713860.cms
A blockbuster unleashed: What happens when a big fat business explodes?,Healthcare,positive,8,1.33,Shock,"The launch of affordable generics for semaglutide is set to revolutionize the Indian healthcare market, driving growth for key pharmaceutical players.",False,https://economictimes.indiatimes.com/industry/healthcare/biotech/pharmaceuticals/a-blockbuster-unleashed-what-happens-when-a-big-fat-business-explodes-semaglutide-injection-ozempic-wegovy-patent-expire-novo-nordisk-eli-lily-generic-copies-price-cut-weight-loss-drug/articleshow/129713429.cms
Dr. Reddy’s Lab launches India’s first DCGI-approved Semaglutide injection for Type 2 Diabetes,Healthcare,positive,8,1.33,Shock,Dr. Reddy's Laboratories' launch of a DCGI-approved Semaglutide injection positions it strongly in the diabetes treatment market.,False,https://economictimes.indiatimes.com/industry/healthcare/biotech/pharmaceuticals/dr-reddys-lab-launches-indias-first-dcgi-approved-semaglutide-injection-for-type-2-diabetes-patent-expiry/articleshow/129712037.cms
Obesity bet may drive focus on chronic segment: Alkem Labs,Healthcare,positive,8,1.33,Shock,"Alkem Labs' strategic shift towards chronic care, particularly in obesity and diabetes, positions it for significant revenue growth.",False,https://economictimes.indiatimes.com/industry/healthcare/biotech/pharmaceuticals/obesity-bet-may-drive-focus-on-chronic-segment-alkem-labs/articleshow/129708455.cms
Gujarat approves Tata Power PPA; Mundra plant all set for restart,Energy,positive,8,1.33,Shock,"The approval of Tata Power's PPA is a significant step towards stabilizing energy supply in Gujarat, enhancing Tata Power's operational outlook.",False,https://economictimes.indiatimes.com/industry/energy/power/gujarat-approves-tata-power-ppa-mundra-plant-all-set-for-restart/articleshow/129708305.cms
War in West Asia has squeezed the skies,Other,negative,8,1.33,Shock,The ongoing conflict in West Asia is likely to negatively impact airline operations and profitability due to increased costs and logistical challenges.,True,https://economictimes.indiatimes.com/industry/transportation/airlines-/-aviation/war-in-west-asia-has-squeezed-the-skies/articleshow/129707867.cms
"Tata Steel adds EAF route to produce steel; commissions Rs 3,200-cr project in Punjab",Manufacturing,positive,8,1.33,Shock,"Tata Steel's new EAF project positions it for sustainable growth in the steel sector, leveraging renewable energy.",False,https://economictimes.indiatimes.com/industry/indl-goods/svs/steel/tata-steel-adds-eaf-route-to-produce-steel-commissions-rs-3200-cr-project-in-punjab/articleshow/129705855.cms
Delhi government eyes private push to expand EV infrastructure ahead of policy rollout,Energy,positive,8,1.33,Shock,The Delhi government's push for EV infrastructure signals strong growth potential for electric vehicle manufacturers and related sectors.,False,https://economictimes.indiatimes.com/industry/renewables/delhi-government-eyes-private-push-to-expand-ev-infrastructure-ahead-of-policy-rollout/articleshow/129705428.cms
30% YTD return! Healthcare stock to be in focus on Monday - Here's why,Healthcare,positive,8,1.33,Shock,The acquisition of KPIMS by Park Medi World is likely to enhance market position and drive stock performance.,False,https://www.livemint.com/market/stock-market-news/30-ytd-return-healthcare-stock-to-be-in-focus-on-monday-heres-why-11774087937285.html
"US-Iran war effect: S&amp;P 500 lost over $1 trillion market cap last week, crashes 5.83% in one month",Other,negative,8,1.33,Shock,"The ongoing US-Iran tensions are significantly impacting the S&P 500, indicating a bearish trend in the broader market.",True,https://www.livemint.com/market/stock-market-news/usiran-war-effect-on-us-stock-market-s-p-500-lost-over-1-trillion-market-cap-last-week-crashes-5-83-in-one-mont-11774061692159.html
Super Micro Computer shares crash 29% after co-founder charged in US with smuggling Nvidia chips to China,IT,negative,8,1.33,Shock,Super Micro Computer's significant share drop highlights the risks associated with geopolitical tensions and export controls in the semiconductor industry.,True,https://www.livemint.com/market/stock-market-news/super-micro-computer-shares-crash-29-after-co-founder-charged-in-us-with-smuggling-nvidia-chips-to-china-11774017910548.html
"Another day, another low: Rupee slips past 93 a dollar, for the first time ever",Other,negative,8,1.33,Shock,The rupee's depreciation against the dollar signals potential inflationary pressures and impacts oil-importing companies significantly.,True,https://www.livemint.com/market/another-day-another-low-rupee-slips-past-93-a-dollar-for-the-first-time-ever-11774006001308.html
Great Eastern Shipping gains as charter rates double due to war in West Asia,Other,positive,8,1.33,Shock,Great Eastern Shipping is poised for continued gains as it capitalizes on soaring charter rates driven by geopolitical tensions.,True,https://www.livemint.com/companies/great-eastern-shipping-gains-as-charter-rates-double-due-to-war-in-west-asia-vessels-fuel-oil-11773994135861.html
"Natco Pharma fires first shot in weight-loss drug price war; generic semaglutide to cost 90% less at  ₹1,290 per month",Healthcare,positive,8,1.33,Shock,"Natco Pharma's aggressive pricing strategy for semaglutide could reshape the weight-loss drug market, enhancing accessibility and competition.",False,https://www.livemint.com/companies/natco-generic-semaglutide-rs-1290-per-month-weight-loss-drug-price-ozempic-wegovy-glp-1-drug-semaglutide-vial-price-war-11773997371140.html
"Uber–Rivian deal: $1.25 billion investment to deploy 50,000 robotaxis across US, Europe by 2031",Startup,positive,8,1.33,Shock,"The Uber-Rivian partnership signals a strong commitment to the future of autonomous transportation, potentially reshaping urban mobility.",False,https://www.livemint.com/companies/news/uberrivian-deal-1-25-billion-investment-to-deploy-50-000-robotaxis-across-us-europe-by-2031-11773930240638.html
Iran’s caused a rates crisis for the world’s central banks. Why the ECB should follow the Fed.,Energy,negative,8,1.33,Shock,"The Iran conflict is likely to exacerbate inflationary pressures globally, impacting central bank policies and energy prices.",True,https://www.livemint.com/economy/irans-caused-a-rates-crisis-for-the-world-s-central-banks-why-the-ecb-should-follow-the-fed-11773933177824.html
